-- phpMyAdmin SQL Dump
-- version 4.1.7
-- http://www.phpmyadmin.net
--
-- Host: localhost
-- Generation Time: Dec 19, 2014 at 12:23 PM
-- Server version: 5.5.25a
-- PHP Version: 5.4.4

SET SQL_MODE = "NO_AUTO_VALUE_ON_ZERO";
SET time_zone = "+00:00";


/*!40101 SET @OLD_CHARACTER_SET_CLIENT=@@CHARACTER_SET_CLIENT */;
/*!40101 SET @OLD_CHARACTER_SET_RESULTS=@@CHARACTER_SET_RESULTS */;
/*!40101 SET @OLD_COLLATION_CONNECTION=@@COLLATION_CONNECTION */;
/*!40101 SET NAMES utf8 */;

--
-- Database: `dbase`
--

-- --------------------------------------------------------

--
-- Stand-in structure for view `courtesy`
--
CREATE TABLE IF NOT EXISTS `courtesy` (
`Ticket` int(7)
,`Date` text
,`STime` time
,`Priority` smallint(2)
,`Site` text
,`Timeout` varchar(2)
);
-- --------------------------------------------------------

--
-- Table structure for table `emailed`
--

CREATE TABLE IF NOT EXISTS `emailed` (
  `Ticket` int(6) NOT NULL,
  `Date` varchar(10) NOT NULL,
  `Start time` varchar(8) NOT NULL,
  `Priority` int(1) NOT NULL,
  `Site` text NOT NULL,
  `Email` varchar(1) NOT NULL,
  PRIMARY KEY (`Ticket`)
) ENGINE=InnoDB DEFAULT CHARSET=latin1;

--
-- Dumping data for table `emailed`
--

INSERT INTO `emailed` (`Ticket`, `Date`, `Start time`, `Priority`, `Site`, `Email`) VALUES
(39934, '10/28/2013', '08:53:41', 9, '', ''),
(366369, '10/28/2013', '15:43:57', 4, 'MEMBER SERVICES     ', ''),
(399225, '10/22/2013', '10:33:02', 2, 'VERIDIAN CREDIT UNION  ', ''),
(399308, '11/5/2013', '09:59:59', 4, 'ESTES EXPRESS LINE     ', ''),
(399313, '10/29/2013', '14:53:45', 4, 'WK KELLOGG FOUNDATION      ', ''),
(399321, '10/25/2013', '10:19:38', 2, 'PALOS COMMUNITY HOSPITAL    ', ''),
(399324, '10/25/2013', '12:35:14', 4, 'RUTGERS UNIVERSITY     ', ''),
(399327, '10/25/2013', '13:05:36', 2, 'REVELEX     ', ''),
(399332, '10/25/2013', '16:38:31', 4, 'CORINTHIAN COLLEGES    ', ''),
(399333, '10/25/2013', '16:40:46', 9, 'PALOS COMMUNITY HOSPITAL', ''),
(399334, '10/25/2013', '17:08:32', 4, 'CBS STUDIO CENTER    ', ''),
(399343, '10/28/2013', '07:50:50', 4, 'CITY OF NAPERVILLE    ', ''),
(399345, '10/28/2013', '08:54:39', 9, 'MEDICAL EDUCATION TECHNOLOGIES', ''),
(399348, '10/28/2013', '09:37:51', 9, 'TRACTOR SUPPLY CO     ', ''),
(399353, '10/28/2013', '10:54:58', 4, 'HARVEY INDUSTRIES ', ''),
(399359, '10/28/2013', '11:43:25', 4, 'XL GROUP PLC    ', ''),
(399361, '10/28/2013', '12:35:21', 2, 'HACH COMPANY    ', ''),
(399362, '10/28/2013', '13:02:22', 4, 'FT. MCDOWELL YAVAPAI NATION  ', ''),
(399364, '10/28/2013', '13:49:34', 4, 'WORLD VISION  ', ''),
(399368, '10/28/2013', '15:36:20', 9, 'AMD 5200121534   ', ''),
(399377, '10/29/2013', '09:04:59', 4, 'MEMORIAL HOSPITAL ', ''),
(399380, '10/29/2013', '09:16:44', 9, 'RUAN CENTER ', ''),
(399381, '10/29/2013', '09:34:33', 9, 'TSA INFRASTRUCTURE            ', ''),
(399382, '10/29/2013', '09:57:13', 4, 'WALLWORK INC          ', ''),
(399383, '10/29/2013', '11:41:29', 2, 'MORTON SALT, INC.   ', ''),
(399384, '10/29/2013', '13:15:39', 9, 'MO ARMY NATIONAL GUARD MAIN ', ''),
(399385, '10/29/2013', '13:30:08', 4, 'FIRSTCOMP WARWICK  ', ''),
(399386, '10/29/2013', '13:40:14', 4, 'NEWS JOURNAL COMPANY  ', ''),
(399390, '10/29/2013', '15:41:28', 4, 'WYNDHAM VACATION OWNERSHIP   ', ''),
(399391, '10/29/2013', '15:46:43', 2, '15 CRAIGSIDE   ', ''),
(399393, '10/29/2013', '15:58:31', 2, 'CROW HOLDINGS   ', ''),
(399396, '10/29/2013', '19:03:40', 4, 'ACCENTURE PRAGUE      ', ''),
(399411, '10/30/2013', '09:32:43', 4, 'AMERIS BANK    ', ''),
(399417, '10/30/2013', '11:18:17', 4, 'TORRANCE MEMORIAL HOSPITAL   ', ''),
(399418, '10/30/2013', '11:20:25', 4, 'ANDREWS KURTH LLP HOUSTON     ', ''),
(399422, '10/30/2013', '12:12:49', 4, 'AP WIRELESS', ''),
(399426, '10/30/2013', '15:16:43', 4, 'HELMERICH ', ''),
(399444, '10/31/2013', '11:30:37', 4, 'CITY OF DELTONA FLORIDA ', ''),
(399490, '11/4/2013', '10:38:46', 4, 'STATE OF MD NAT&#39;L PARK ', ''),
(399494, '11/4/2013', '13:02:49', 4, 'WELLCARE     ', ''),
(399503, '11/4/2013', '15:37:48', 4, 'VISA - FOSTER CITY', ''),
(399504, '11/4/2013', '15:59:40', 4, 'AAARON EQUIPMENT CO.   ', ''),
(399505, '11/4/2013', '16:46:43', 4, 'TAHITI VILLAGE VACATION     ', ''),
(399506, '11/4/2013', '17:49:58', 2, 'FMC TECHNOLOGIES  ', ''),
(399507, '11/5/2013', '08:19:11', 4, 'COMMUNITY HEALTH NETWORK    ', ''),
(399508, '11/5/2013', '08:36:44', 9, 'BISHA MINING SHARE COMPANY    ', ''),
(399509, '11/5/2013', '09:15:33', 4, 'COPIC INSURANCE COMPANIES    ', ''),
(399510, '11/5/2013', '09:27:02', 4, 'NORTHERN TOOL ', ''),
(399512, '11/5/2013', '10:41:24', 4, 'ASPIRUS HEALTH - INFORMATION S', ''),
(399514, '11/5/2013', '11:33:58', 2, 'IDAHO STATE TAX COMMISSION ', ''),
(399522, '11/5/2013', '12:02:27', 9, 'Transcorr LLC', ''),
(399524, '11/5/2013', '13:11:05', 4, 'DOCUMENT STORAGE SYSTEMS, INC.', ''),
(399525, '11/5/2013', '14:15:11', 2, 'ALIGN TECHNOLOGY INC   ', ''),
(399527, '11/5/2013', '15:36:23', 4, 'MA MORTENSON COMPANY', ''),
(399528, '11/5/2013', '15:44:24', 4, 'FOREST PHARMACEUTICALS ', ''),
(399529, '11/5/2013', '15:55:41', 2, 'SENTINEL TECHNOLOGIES  ', ''),
(399530, '11/5/2013', '16:06:38', 2, 'SOCIAL SECURITY ADMINISTRATION', ''),
(399531, '11/5/2013', '16:19:49', 9, 'CITY OF JOLIET   ', ''),
(399532, '11/5/2013', '16:46:53', 2, 'COLORADO COMMUNITY COLLEGE ', ''),
(399535, '11/6/2013', '08:44:54', 4, 'JOHN DEERE FINANCIAL  ', ''),
(399536, '11/6/2013', '08:49:22', 9, 'STATE OF MD-DIST CRT-HAGERSTOW', ''),
(399539, '10/28/2013', '12:12:44', 2, 'HUBSPOT ', ''),
(399547, '11/6/2013', '12:13:57', 4, 'FITZ PATRICK GRANDE CNT HOTEL', ''),
(399549, '11/6/2013', '12:41:07', 4, 'STATE OF MD MARYLAND DOT   ', ''),
(399551, '11/6/2013', '12:50:51', 4, 'REXEL, INC', ''),
(399554, '11/6/2013', '14:14:46', 2, 'UTAH RETIREMENT SYSTEMS', ''),
(399564, '11/6/2013', '16:54:49', 2, 'MA MORTENSON COMPANY', ''),
(399566, '11/7/2013', '07:41:58', 4, 'PORTLAND PUBLIC SCHOOLS ', ''),
(399567, '11/7/2013', '08:29:21', 4, 'KENNEDY CTR FOR PERFORMING ART', ''),
(399575, '11/7/2013', '10:59:03', 4, 'WOODHULL MEDICAL CENTER       ', ''),
(399582, '11/7/2013', '13:00:31', 2, 'ADECCO ', ''),
(399585, '11/7/2013', '14:36:42', 2, 'PLAINS CAPITAL CORPORATION  ', ''),
(399586, '11/7/2013', '16:09:41', 4, 'SHERATON LINCOLN HARBOR ', ''),
(399590, '11/8/2013', '09:33:04', 2, 'STATE OF MISSOURI       ', ''),
(399599, '11/8/2013', '15:56:07', 2, 'WHALER ON KAANAPALI BEACH  ', ''),
(399606, '11/11/2013', '08:19:47', 4, 'FOREST PHARMACEUTICALS  ', ''),
(399619, '11/11/2013', '13:24:22', 2, 'LAND O LAKES INC   ', ''),
(399620, '11/11/2013', '13:58:42', 2, 'CORINTHIAN COLLEGES ', ''),
(399622, '11/11/2013', '15:10:15', 4, 'MCKINSEY ', ''),
(399623, '11/11/2013', '15:37:52', 4, 'FITZ PATRICK GRANDE CNT HOTEL ', ''),
(399716, '11/18/2013', '10:57:17', 4, 'INVER HILLS COMMUNITY COLLEGE ', ''),
(400072, '11/19/2013', '07:46:48', 4, 'HARVEY INDUSTRIES         ', ''),
(400073, '11/19/2013', '07:57:01', 4, 'BLESSING MEMORIAL HOSPITAL    ', ''),
(400075, '11/19/2013', '09:04:42', 2, 'PARKER HANNIFIN CLEVELAND   ', ''),
(400076, '11/19/2013', '09:10:37', 4, 'AAA OHIO MOTORISTS ASSOCIATION', ''),
(400078, '11/19/2013', '09:15:59', 4, 'BAKER HUGHES - CDR MS   ', ''),
(400085, '11/19/2013', '13:01:38', 4, 'CA NATIONAL GUARD SACRAMENTO', ''),
(400086, '11/19/2013', '13:16:22', 4, 'DYNCORP TECHNICAL SERVICES    ', ''),
(400087, '11/19/2013', '13:29:23', 4, 'HUDSON ADVISORS LLC   ', ''),
(400090, '11/19/2013', '16:30:44', 2, 'PADUCAH BANK ', ''),
(400095, '11/20/2013', '08:33:55', 4, 'MEMORIAL HOSPITAL ', ''),
(400096, '11/20/2013', '08:40:33', 2, 'NATIONWIDE MUTUAL INSURANCE mn', ''),
(400104, '11/20/2013', '09:37:56', 4, 'HERITAGE VALLEY HEALTH SYSTEM ', ''),
(400112, '11/20/2013', '13:21:49', 4, 'HILLSBOROUGH CNTY ENGINEERING ', ''),
(400113, '11/20/2013', '13:40:54', 4, 'VISION SERVICE PLAN, INC  ', ''),
(400120, '11/20/2013', '15:56:16', 4, 'ASSURANT INC - AS01   ', ''),
(400121, '11/20/2013', '16:19:43', 4, 'CITY OF DAVIS  ', ''),
(400122, '11/20/2013', '16:40:12', 2, 'BENTLEY UNIVERSITY   ', '');

-- --------------------------------------------------------

--
-- Table structure for table `images`
--

CREATE TABLE IF NOT EXISTS `images` (
  `Ticket` int(6) NOT NULL,
  `Date` text NOT NULL,
  `Name` text NOT NULL,
  `Timestamp` timestamp NOT NULL DEFAULT CURRENT_TIMESTAMP,
  PRIMARY KEY (`Timestamp`),
  KEY `Tickets` (`Ticket`) COMMENT 'Ticket relation'
) ENGINE=InnoDB DEFAULT CHARSET=latin1;

-- --------------------------------------------------------

--
-- Table structure for table `members`
--

CREATE TABLE IF NOT EXISTS `members` (
  `id` int(4) NOT NULL AUTO_INCREMENT,
  `username` varchar(65) NOT NULL DEFAULT '',
  `password` varchar(65) NOT NULL DEFAULT '',
  `IP` text NOT NULL,
  `LastLoggedIn` text NOT NULL,
  PRIMARY KEY (`id`),
  UNIQUE KEY `username` (`username`)
) ENGINE=InnoDB  DEFAULT CHARSET=latin1 AUTO_INCREMENT=33 ;

--
-- Dumping data for table `members`
--

INSERT INTO `members` (`id`, `username`, `password`, `IP`, `LastLoggedIn`) VALUES
(1, 'admin', '81dc9bdb52d04dc20036dbd8313ed055', '10.2.100.162', '11/21/2014 @ 10:42 PM'),
(2, 'mstratton', '7cbb3252ba6b7e9c422fac5334d22054', '10.2.5.58', '10/22/2014 @ 3:28 PM'),
(3, 'dino', 'b246ff693d453c3b1a3049752da2bc75', '10.2.5.72', '12/19/2014 @ 8:24 AM'),
(4, 'jim', '827ccb0eea8a706c4c34a16891f84e7b', '10.2.5.77', '12/19/2014 @ 12:18 PM'),
(7, 'abaum', '3cf02fae3e9629ec6f3fe611fc3f1e30', '10.2.5.61', '12/19/2014 @ 12:12 PM'),
(10, 'rburquist', '5ae53028efd00ce255c961ccc5535024', '10.2.100.164', '12/19/2014 @ 11:59 AM'),
(12, 'dschmitt', 'ef43604c0f16dc3edf4f577a0e25aadc', '10.2.5.96', '10/6/2014 @ 2:32 PM'),
(14, 'jscholtens', 'a2744dd9c5feecfca51263fcefb487e0', '10.2.5.85', '12/17/2014 @ 4:40 PM'),
(15, 'apark', '05d66f426e355d68a9e0ae971750008a', '', ''),
(16, 'shoctor', '0c5b8f64b9cf8014d5d7352bb916f429', '', ''),
(20, 'pmathewsian', 'e7bc5acd6ad2b39f94a8db5670320601', '10.2.110.43', 'L_10/15/2013 @ 4:53 PM'),
(22, 'tgarza', 'a6cfebf074f69bdf6e28ac41fd7c51c0', '10.2.5.60', '12/19/2014 @ 10:36 AM'),
(23, 'mrsikes', '133987b0b6ad0c01fc0ccbdae1b95449', '10.2.5.80', '12/19/2014 @ 12:21 PM'),
(25, 'jdehlin', 'c8fc55c1a6a22ac1cd8c1c24299b0309', '10.2.100.149', '10/10/2014 @ 9:17 AM'),
(26, 'Tiver43809', 'fbada1a660e824ab72dda1b4f75ff8dc', '10.2.5.84', '5/8/2014 @ 2:59 PM'),
(27, 'Terry', 'fbada1a660e824ab72dda1b4f75ff8dc', '10.2.5.84', '12/19/2014 @ 10:08 AM'),
(28, 'vvrba', '5364cd5349fb58f19f8f4d30d3d54c14', '10.2.5.73', '1/14/2014 @ 9:19 AM'),
(30, 'dwoods', '42602d15a19ceab26c24f002da8d016c', '10.2.5.90', '12/19/2014 @ 12:17 PM'),
(31, 'sgarcia', 'df78ee5603fc76d90de950e7baf41a8c', '10.2.6.51', '8/15/2014 @ 4:52 PM'),
(32, 'dgrondin', 'e4bf95776c4fbbe0cfafad8b871af4f9', '10.2.5.103', '12/19/2014 @ 12:17 PM');

-- --------------------------------------------------------

--
-- Stand-in structure for view `removed_tickets`
--
CREATE TABLE IF NOT EXISTS `removed_tickets` (
`REMOVED_ON` text
,`LOGIN` text
,`Customer` text
,`Comments` longtext
);
-- --------------------------------------------------------

--
-- Table structure for table `stats`
--

CREATE TABLE IF NOT EXISTS `stats` (
  `id` int(11) NOT NULL AUTO_INCREMENT,
  `browser` varchar(255) NOT NULL,
  `ip` varchar(15) NOT NULL,
  `recieved` date NOT NULL,
  PRIMARY KEY (`id`)
) ENGINE=InnoDB  DEFAULT CHARSET=latin1 AUTO_INCREMENT=2 ;

--
-- Dumping data for table `stats`
--

INSERT INTO `stats` (`id`, `browser`, `ip`, `recieved`) VALUES
(1, 'Mozilla/5.0 (Windows NT 6.1; WOW64) AppleWebKit/537.36 (KHTML, like Gecko) Chrome/33.0.1750.154 Safari/537.36', '10.2.5.77', '2014-03-26');

-- --------------------------------------------------------

--
-- Table structure for table `tickets`
--

CREATE TABLE IF NOT EXISTS `tickets` (
  `Ticket` int(7) NOT NULL,
  `Date` text NOT NULL,
  `STime` time NOT NULL,
  `ETA` time NOT NULL,
  `Priority` smallint(2) NOT NULL,
  `Site` text NOT NULL,
  `Comments` longtext,
  `Deleted` text,
  `Removed_Datetime` text NOT NULL,
  `removedby` text NOT NULL,
  `Creator` text NOT NULL,
  `ContactPref` text NOT NULL,
  PRIMARY KEY (`Ticket`),
  UNIQUE KEY `Ticket` (`Ticket`)
) ENGINE=InnoDB DEFAULT CHARSET=latin1;

--
-- Dumping data for table `tickets`
--

INSERT INTO `tickets` (`Ticket`, `Date`, `STime`, `ETA`, `Priority`, `Site`, `Comments`, `Deleted`, `Removed_Datetime`, `removedby`, `Creator`, `ContactPref`) VALUES
(4076, '8/21/2014', '14:45:40', '18:45:40', 9, 'HORIZON SOLUTIONS CORP ', 'MOVED TO NEW CUCM, UNABLE TO LOGIN TO SELECT', 'X', '2014-08-21 14:59:57', 'dgrondin', 'terry', 'Phone'),
(39865, '10/7/2013', '14:04:37', '18:04:37', 9, 'SECURIAN FINANCIAL GROUP  ', 'CTI DATA SOURCE NOT COLLECTING', 'X', '2013-10-07 14:25:44', 'jscholtens', '\nssmith', 'phone'),
(40033, '12/3/2013', '16:06:26', '20:06:26', 2, 'INGRAM BARGE COMPANY  ', 'When adding a facility, is it possible to use an ip range for the gateway IP or must I enter each individual IP Address', 'X', '2013-12-04 12:15:06', 'mstratton', '\nssmith', 'phone'),
(40119, '1/6/2014', '07:52:55', '11:52:55', 9, 'DECATUR MEMORIAL HOSPITAL    ', 'Down system no data collecting', 'X', '2014-01-06 09:08:53', 'tgarza', '\ntgarza', 'phone'),
(41884, '1/27/2014', '08:56:56', '12:56:56', 9, 'CONSTRUCTION SPECIALTIES INC. ', 'Reports showing up blank', 'X', '2014-01-27 09:44:22', 'abaum', '\ntgarza', 'phone'),
(43800, '12/2/2013', '09:35:44', '13:35:44', 9, 'MEDLINE INDUSTRIES MUNDELEIN', 'NOT POLLING ANY SITES', 'X', '2013-12-02 10:32:22', 'mrsikes', '\nssmith', 'phone'),
(43878, '4/1/2014', '09:18:09', '13:18:09', 4, 'ICMA RETIREMENT CORP  ', 'having difficulty figuring out a method to export the account codes', 'X', '2014-04-01 09:43:24', 'jscholtens', 'tgarza', 'Phone'),
(44968, '5/14/2014', '10:02:25', '14:02:25', 9, 'WORLDPOINT ECC, INC.     ', 'Down system no data collected since 5/9/14', 'X', '2014-05-14 10:42:16', 'pdunn', 'Tgarza', 'Phone'),
(45523, '5/27/2014', '14:28:52', '18:28:52', 2, 'CLEVELAND MUNICIPAL COURT ', 'Cant login to run reports', 'X', '2014-05-27 16:48:33', 'mrsikes', 'tgarza', 'Phone'),
(45524, '5/27/2014', '14:38:08', '18:38:08', 4, 'PLAINS CAPITAL CORPORATION ', 'Missing Report Information', 'X', '2014-05-28 14:24:46', 'jscholtens', 'tgarza', 'Phone'),
(51391, '8/22/2014', '11:32:48', '15:32:48', 4, 'AAA SOUTHERN NEW ENGLAND    ', 'SQL Database is full', 'X', '2014-08-22 11:41:52', 'jscholtens', 'tgarza', 'Phone'),
(53103, '12/2/2013', '07:06:53', '11:06:53', 9, 'SEABOARD MARINE', 'We may not be recording CDR&#39;s from one of our CME sites.', 'X', '2013-12-02 10:25:46', 'abaum', '\nssmith', 'phone'),
(53392, '10/24/2013', '13:45:47', '17:45:47', 2, 'SBA COMMUNICATIONS CORP    ', 'When accessing Infortel dashboard -- receiving error message: Object reference not set to an instance of an object.', 'X', '2013-10-24 14:59:19', 'mrsikes', '\nssmith', 'phone'),
(54072, '10/2/2014', '09:46:36', '13:46:36', 9, 'INTERTAPE POLYMER GROUP', 'NO CDR AFTER 9/13.', 'X', '2014-10-02 10:23:19', 'terry', 'dwoods', 'E-mail'),
(54305, '12/18/2014', '16:53:01', '20:53:01', 2, 'UNIVERSITY OF SOUTH DAKOTA  ', 'Questions about Bridge Calling and how some of the data is processed.', 'X', '2014-12-18 18:01:12', 'dwoods', 'dwoods', 'E-mail'),
(348720, '6/20/2012', '11:36:59', '15:36:59', 4, 'TECK RESOURCES LIMITED    ', 'Directory issues', 'X', '2012-06-20 14:12:39', 'jscholtens', 'Not Logged In', 'phone'),
(359173, '6/3/2013', '09:32:50', '13:32:50', 4, 'ALL CHILDRENS HOSPITAL     ', 'LD Costing not working consistently. LD calls are processed with no charges and some local calls are showing up as LD call', 'X', '2013-06-03 11:28:47', 'jscholtens', 'Not Logged In', 'phone'),
(361665, '3/2/2012', '11:43:07', '15:43:07', 4, 'CORINTHIAN COLLEGES    ', 'NEED ASST RUNNING A TRUNK ANALYSIS REPORT FOR AN H323 GATEWAY (PERHAPS SIMILAR TO SIP)', 'X', '2012-03-05 08:27:04', 'Not Logged In', 'Not Logged In', 'phone'),
(366369, '10/28/2013', '15:43:57', '19:43:57', 4, 'MEMBER SERVICES     ', 'Help change SMTP server address ', 'X', '2013-10-28 16:00:54', 'jscholtens', '\n10.2.5.60', 'phone'),
(367852, '10/14/2011', '15:02:46', '19:02:46', 4, 'TENNECO AUTOMOTIVE  ', 'Buffer box swap out', 'X', '2011-10-14 15:44:28', '', 'Not Logged In', 'phone'),
(369003, '12/13/2012', '18:01:50', '22:01:50', 9, 'FT. MCDOWELL YAVAPAI NATION ', 'Down systewm zero recoirds collected and processed ', 'X', '2012-12-13 18:18:53', 'jscholtens', 'Not Logged In', 'phone'),
(370340, '9/23/2011', '10:40:50', '14:40:50', 4, 'TCF BANK MINNEAPOLIS ', 'ISSUES RUNNING REPORT VIA DASHBOARD', 'X', '2011-09-23 11:13:52', '', 'Not Logged In', 'phone'),
(370775, '2/6/2012', '13:40:05', '17:40:05', 9, 'OUR LADY OF LOURDES REGIONAL', 'The SQL server log file has reached 92 GB. I need to purge the log file and keep it from growing this large in the future. Currently there is only 2GB free on that server. ', 'X', '2012-02-06 14:46:14', '', 'Not Logged In', 'phone'),
(371683, '8/19/2011', '17:19:53', '21:19:53', 4, 'COLQUITT REGIONAL MEDICAL CTR', 'CBA - Still in open queue', 'X', '2011-11-07 08:13:41', '', 'Not Logged In', 'phone'),
(372171, '7/18/2011', '10:29:05', '14:29:05', 2, 'CHAFFEY COLLEGE   ', 'R/A FROM PBM', 'X', '2011-07-25 17:49:31', '', 'Not Logged In', 'phone'),
(372228, '11/17/2011', '10:37:42', '14:37:42', 2, 'TEACHERS CREDIT UNION    ', 'CPU SPIKING', 'X', '2011-11-17 11:06:01', '', 'Not Logged In', 'phone'),
(372452, '7/12/2011', '08:27:11', '12:27:11', 4, 'CHILDRENS MEDICAL CENTER  ', '', 'X', ' ', '', 'Not Logged In', 'phone'),
(373116, '7/26/2011', '10:19:12', '14:19:12', 4, 'DAYTON FREIGHT ', 'CCB - Open Report Issues', 'X', '2011-08-18 14:48:22', '', 'Not Logged In', 'phone'),
(373302, '7/25/2011', '16:19:29', '20:19:29', 2, 'PLAINS CAPITAL', 'SP4041', 'X', '2011-07-26 15:51:28', '', 'Not Logged In', 'phone'),
(373511, '8/23/2011', '10:31:50', '14:31:50', 4, 'UNIVERSAL WEATHER & AVIATION', 'Re-set Password for attendant console.', 'X', '2011-08-23 10:43:03', '', 'Not Logged In', 'phone'),
(373593, '8/26/2011', '14:34:04', '18:34:04', 4, 'CAPITAL GROUP  ', 'Licenses Full', 'X', '2011-08-29 09:33:07', '', 'Not Logged In', 'phone'),
(373656, '7/6/2011', '14:30:16', '18:30:16', 2, 'MN NATIONAL GUARD SAINT PAUL ', 'RateTable not getting downloaded.', 'X', ' ', '', 'Not Logged In', 'phone'),
(373777, '5/14/2012', '10:31:12', '14:31:12', 9, 'FAUQUIER HEALTH SYSTEM    ', 'Down system several errors under isvcollect', 'X', '2012-05-14 11:22:57', 'Not Logged In', 'Not Logged In', 'phone'),
(373986, '7/6/2011', '09:32:03', '13:32:03', 9, 'JOHNSON DIVERSEY     ', 'System not processing any data', 'X', ' ', '', 'Not Logged In', 'phone'),
(373988, '8/4/2011', '09:46:11', '13:46:11', 2, 'CROASDAILE VILLAGE ', 'Remote Training', 'X', '2011-08-04 12:14:05', '', 'Not Logged In', 'phone'),
(373996, '7/18/2011', '07:47:22', '11:47:22', 2, 'MEDIAWHIZ   ', 'Call Manager Upgrade from 4.2 to 8.5 Select ver 8.1.3692 DB 3784', 'X', '2011-08-03 15:54:52', '', 'Not Logged In', 'phone'),
(374001, '7/8/2011', '11:52:45', '15:52:45', 2, 'CAPITAL GROUP ', 'SP4041', 'X', '2011-09-16 16:58:14', '', 'Not Logged In', 'phone'),
(374005, '7/11/2011', '15:08:14', '19:08:14', 4, 'LIZ CLAIBORNE N BERGEN     ', 'CCM Upgrade from 4.1.3 TO 7.1.3', 'X', ' ', '', 'Not Logged In', 'phone'),
(374007, '6/28/2011', '15:59:14', '19:59:14', 9, 'CDR MANAGED SERVICES', 'SERVER 2', 'X', ' ', '', 'Not Logged In', 'phone'),
(374012, '7/12/2011', '11:39:06', '15:39:06', 4, 'COUNTY OF FRESNO', 'Cell phone bill import', 'X', ' ', '', 'Not Logged In', 'phone'),
(374015, '8/8/2011', '15:14:13', '19:14:13', 2, 'ROTHSTEIN, KASS & COMPANY   ', 'Missing Tariff Update', 'X', '2011-08-08 15:30:39', '', 'Not Logged In', 'phone'),
(374023, '6/30/2011', '07:51:21', '11:51:21', 4, 'HMA-WUESTHOFF ROCKLEDGE MED CT', 'IP ADDRESS CHANGE', 'X', ' ', '', 'Not Logged In', 'phone'),
(374028, '6/30/2011', '07:51:56', '11:51:56', 2, 'WORK FORCE OF CENTRAL FLORIDA ', 'Abandoned Calls Report', 'X', ' ', '', 'Not Logged In', 'phone'),
(374034, '6/30/2011', '07:52:18', '11:52:18', 4, 'MCKINSEY & COMPANY', 'Tandem Call Matching', 'X', ' ', '', 'Not Logged In', 'phone'),
(374039, '6/30/2011', '10:44:52', '14:44:52', 4, 'B A E SYSTEMS', 'LD Calls showing as Local Calls\r\n', 'X', ' ', '', 'Not Logged In', 'phone'),
(374048, '7/25/2011', '10:12:52', '14:12:52', 4, 'PLAINS CAPITAL CORPORATION', 'sp 4041 Upgrade', 'X', ' ', '', 'Not Logged In', 'phone'),
(374049, '7/1/2011', '12:45:47', '16:45:47', 4, 'BOAT US ALEXANDRIA', '', 'X', ' ', '', 'Not Logged In', 'phone'),
(374055, '7/1/2011', '11:40:10', '15:40:10', 4, 'Badger State Univ', 'Reporting Questions', 'X', ' ', '', 'Not Logged In', 'phone'),
(374088, '7/1/2011', '13:05:06', '17:05:06', 4, 'CHAROLETTE COUNTY IT', '', 'X', ' ', '', 'Not Logged In', 'phone'),
(374114, '7/5/2011', '07:00:01', '11:00:01', 2, 'SALT LAKE COMMUNITY COLLEGES  ', 'Assist with setting up new user', 'X', ' ', '', 'Not Logged In', 'phone'),
(374115, '7/5/2011', '07:25:57', '11:25:57', 4, 'RUTGERS UNIVERSITY  ', 'Not able to access report portal', 'X', ' ', '', 'Not Logged In', 'phone'),
(374121, '7/5/2011', '09:44:31', '13:44:31', 4, 'AAA EAST CENTRAL     ', 'Not Collecting', 'X', ' ', '', 'Not Logged In', 'phone'),
(374123, '7/5/2011', '09:58:29', '13:58:29', 4, 'COMMSCOPE, INC. ', 'Activate site\r\n', 'X', ' ', '', 'Not Logged In', 'phone'),
(374124, '7/5/2011', '10:04:33', '14:04:33', 2, 'MORAINE VALLEY COMM COLLEGE   ', 'Down System', 'X', ' ', '', 'Not Logged In', 'phone'),
(374125, '7/5/2011', '10:27:11', '14:27:11', 2, 'AMERITAS LIFE INSURANCE CORP  ', 'Autoreport trouble.', 'X', ' ', '', 'Not Logged In', 'phone'),
(374128, '7/7/2011', '07:48:38', '11:48:38', 4, 'MEMORIAL HOSPITAL & HEALTH SYS', 'R/A FROM DES', 'X', ' ', '', 'Not Logged In', 'phone'),
(374130, '7/5/2011', '11:18:12', '15:18:12', 4, 'TAHITI VILLAGE VACATION   ', '', 'X', ' ', '', 'Not Logged In', 'phone'),
(374133, '7/5/2011', '12:12:59', '16:12:59', 4, 'CA NATIONAL GUARD SACRAMENTO  ', 'Auth Codes', 'X', ' ', '', 'Not Logged In', 'phone'),
(374136, '7/5/2011', '13:20:47', '17:20:47', 9, 'PALOS COMMUNITY HOSPITAL    ', 'DOWN SYSTEM', 'X', ' ', '', 'Not Logged In', 'phone'),
(374139, '7/5/2011', '14:10:27', '18:10:27', 4, 'ST BARNABAS SBO     ', '', 'X', ' ', '', 'Not Logged In', 'phone'),
(374145, '7/5/2011', '16:38:15', '20:38:15', 9, 'EXPRESS, LLC   ', 'HDD FULL', 'X', ' ', '', 'Not Logged In', 'phone'),
(374146, '7/5/2011', '17:03:11', '21:03:11', 2, 'ALEXIAN BROTHERS MED CTR BIEST', 'Post-install Web errors', 'X', ' ', '', 'Not Logged In', 'phone'),
(374147, '7/5/2011', '17:53:06', '21:53:06', 9, 'GILEAD SCIENCES INC   ', 'Logs not collecting.', 'X', ' ', '', 'Not Logged In', 'phone'),
(374149, '7/6/2011', '08:37:34', '12:37:34', 9, 'ARMSTRONG WORLD INDUSTRIES ', 'Down System ', 'X', ' ', '', 'Not Logged In', 'phone'),
(374150, '7/6/2011', '08:57:56', '12:57:56', 9, 'NORTHWEST MISSISSIPPI COM CLG ', 'System not processing since 6/25/11...getting errors in isvprocess', 'X', ' ', '', 'Not Logged In', 'phone'),
(374153, '7/6/2011', '09:55:40', '13:55:40', 4, 'COVANTAGE CREDIT UNION    ', 'no cdr alarms incorrect', 'X', ' ', '', 'Not Logged In', 'phone'),
(374155, '7/6/2011', '10:37:38', '14:37:38', 2, 'SHERMAN HOSPITAL', 'AUTOREPORT SETTINGS', 'X', ' ', '', 'Not Logged In', 'phone'),
(374157, '7/6/2011', '11:38:56', '15:38:56', 2, 'EISENHOWER MEDICAL CENTER     ', 'UNDEFINED GATEWAYS', 'X', ' ', '', 'Not Logged In', 'phone'),
(374158, '7/6/2011', '17:40:18', '21:40:18', 2, 'EISENHOWER MEDICAL CENTER   ', 'R/A FROM DES', 'X', ' ', '', 'Not Logged In', 'phone'),
(374159, '7/6/2011', '11:57:25', '15:57:25', 2, 'TEACHERS CREDIT UNION ', 'Autoreports & Directory Management', 'X', ' ', '', 'Not Logged In', 'phone'),
(374161, '7/6/2011', '12:53:40', '16:53:40', 9, 'PRESBYTERIAN INTERCOMM HOSP   ', 'DOWN SYSTEM', 'X', ' ', '', 'Not Logged In', 'phone'),
(374164, '7/6/2011', '13:42:39', '17:42:39', 2, 'WORK FORCE OF CENTRAL FLORIDA ', 'Call Transfer Report help', 'X', ' ', '', 'Not Logged In', 'phone'),
(374166, '7/6/2011', '14:38:32', '18:38:32', 4, 'TOWN OF NORTH HEMPSTEAD TOWN H', 'Add user so they can run reports of the from the web', 'X', ' ', '', 'Not Logged In', 'phone'),
(374168, '7/6/2011', '15:39:14', '19:39:14', 4, 'WASHINGTON STATE UNIVERSITY   ', 'Assist with runnig report for one time charge', 'X', ' ', '', 'Not Logged In', 'phone'),
(374171, '7/6/2011', '16:01:38', '20:01:38', 2, 'CABELAS              ', 'Call Forwarding Issues', 'X', ' ', '', 'Not Logged In', 'phone'),
(374175, '7/7/2011', '07:19:35', '11:19:35', 9, 'OUR LADY OF BELLEFONTE HOSP', 'MISSING DATA', 'X', ' ', '', 'Not Logged In', 'phone'),
(374177, '7/7/2011', '10:07:04', '14:07:04', 9, 'COLORADO COMMUNITY COLLEGE ', 'DOWN SYSTEM', 'X', ' ', '', 'Not Logged In', 'phone'),
(374184, '7/7/2011', '12:50:35', '16:50:35', 9, 'CITY OF ANDERSON', 'DOWN SYSTEM', 'X', ' ', '', 'Not Logged In', 'phone'),
(374186, '7/7/2011', '13:18:00', '17:18:00', 2, 'FORT SAM HOUSTON ISD  ', 'AUTH CODES ', 'X', ' ', '', 'Not Logged In', 'phone'),
(374188, '7/7/2011', '14:16:23', '18:16:23', 2, 'OHIO STATE LOTTERY      ', 'Autoreport Emailing assistance', 'X', ' ', '', 'Not Logged In', 'phone'),
(374191, '7/7/2011', '15:34:10', '19:34:10', 4, 'Childrens National ', 'Rate table expired error', 'X', ' ', '', 'Not Logged In', 'phone'),
(374195, '7/11/2011', '15:25:27', '19:25:27', 9, 'STATE OF MD-BOWIE #1 ADMIN    ', 'Down System', 'X', ' ', '', 'Not Logged In', 'phone'),
(374196, '7/8/2011', '08:45:44', '12:45:44', 4, 'WYNDHAM VACATION OWNERSHIP    ', '', 'X', ' ', '', 'Not Logged In', 'phone'),
(374207, '7/8/2011', '10:01:02', '14:01:02', 2, 'MIDLAND COUNTY  ', '', 'X', ' ', '', 'Not Logged In', 'phone'),
(374209, '7/8/2011', '11:13:31', '15:13:31', 2, 'COLLIN COUNTY COMMUNITY COLLEG', 'CTI Route point issue', 'X', ' ', '', 'Not Logged In', 'phone'),
(374215, '7/8/2011', '13:58:57', '17:58:57', 2, 'LIFE ALERT EMERGENCY RESPONSE ', 'HUNT GROUPS', 'X', ' ', '', 'Not Logged In', 'phone'),
(374222, '7/8/2011', '15:25:51', '19:25:51', 2, 'UCAR NCAR   ', 'Rate table questions', 'X', ' ', '', 'Not Logged In', 'phone'),
(374230, '7/11/2011', '08:50:50', '12:50:50', 2, 'AMERICREDIT    ', 'SFTP Questions', 'X', ' ', '', 'Not Logged In', 'phone'),
(374233, '7/11/2011', '09:02:11', '13:02:11', 4, 'CALAMOS INVESTMENTS ', 'DATASOURCE CONFIG', 'X', ' ', '', 'Not Logged In', 'phone'),
(374237, '7/11/2011', '09:58:39', '13:58:39', 2, 'HUBBELL POWER SYSTEMS      ', 'SMTP & Email changes', 'X', ' ', '', 'Not Logged In', 'phone'),
(374238, '7/11/2011', '10:08:39', '14:08:39', 4, 'WESTINGHOUSE CRANBERRY TWP  ', '', 'X', ' ', '', 'Not Logged In', 'phone'),
(374240, '7/11/2011', '10:50:18', '14:50:18', 9, 'ANDREWS & KURTH HOUSTON    ', 'All Remote collections Failing', 'X', ' ', '', 'Not Logged In', 'phone'),
(374242, '7/11/2011', '11:14:09', '15:14:09', 2, 'CITY OF PEORIA  ', '911 ALARMS', 'X', ' ', '', 'Not Logged In', 'phone'),
(374245, '7/11/2011', '13:03:57', '17:03:57', 4, 'TECK RESOURCES LIMITED   ', 'Costing all off', 'X', ' ', '', 'Not Logged In', 'phone'),
(374247, '7/11/2011', '18:50:28', '22:50:28', 4, 'IDAHO STATE POLICE  ', 'Error in logs', 'X', ' ', '', 'Not Logged In', 'phone'),
(374249, '7/12/2011', '06:54:24', '10:54:24', 9, 'Johnson Diversey', 'Unable to process reports for all sites', 'X', ' ', '', 'Not Logged In', 'phone'),
(374254, '7/12/2011', '09:35:47', '13:35:47', 4, 'AVX CORPORATION', '', 'X', ' ', '', 'Not Logged In', 'phone'),
(374259, '7/12/2011', '10:02:28', '14:02:28', 4, 'RAPPAHANNOCK ELECTRIC COOP    ', '', 'X', ' ', '', 'Not Logged In', 'phone'),
(374260, '7/12/2011', '10:12:15', '14:12:15', 2, 'TSA INFRASTRUCTURE ', 'Assistance with RT update', 'X', ' ', '', 'Not Logged In', 'phone'),
(374262, '7/12/2011', '10:56:00', '14:56:00', 4, 'BOY SCOUTS OF AMERICA   ', 'Att Importr issues', 'X', ' ', '', 'Not Logged In', 'phone'),
(374263, '7/12/2011', '11:02:25', '15:02:25', 2, 'CULTURAL MISSION OF THE ROYAL ', 'System crashes several times', 'X', ' ', '', 'Not Logged In', 'phone'),
(374264, '7/12/2011', '11:21:02', '15:21:02', 4, 'BENTLEY COLLEGE    ', 'Cant Login', 'X', ' ', '', 'Not Logged In', 'phone'),
(374266, '7/12/2011', '12:09:18', '16:09:18', 2, 'PUTNAM INVESTMENTS  ', '', 'X', ' ', '', 'Not Logged In', 'phone'),
(374275, '7/13/2011', '07:20:05', '11:20:05', 4, 'VISA - FOSTER CITY  (main)    ', 'Active Stations Count', 'X', ' ', '', 'Not Logged In', 'phone'),
(374277, '7/13/2011', '08:23:15', '12:23:15', 4, 'Boat US', 'Trunk Analysis Report questions', 'X', ' ', '', 'Not Logged In', 'phone'),
(374286, '7/13/2011', '11:35:59', '15:35:59', 4, 'METROPOLITAN WATER DIST. HQ   ', 'FAILED EXPORT', 'X', ' ', '', 'Not Logged In', 'phone'),
(374287, '7/13/2011', '12:03:01', '16:03:01', 9, 'KETTERING MEDICAL CENTER  ', 'DOWN SYSTEM', 'X', ' ', '', 'Not Logged In', 'phone'),
(374288, '7/13/2011', '12:12:30', '16:12:30', 2, 'CAPITAL GROUP    ', 'Directory assistance.', 'X', ' ', '', 'Not Logged In', 'phone'),
(374289, '7/13/2011', '12:25:22', '16:25:22', 9, 'MAMMOTH MOUNTAIN SKI RESORT ', 'MISSING INB CDR', 'X', ' ', '', 'Not Logged In', 'phone'),
(374290, '7/13/2011', '12:59:02', '16:59:02', 2, 'TOWN OF NORTH HEMPSTEAD TOWN H', 'Explain why they need rate tables', 'X', ' ', '', 'Not Logged In', 'phone'),
(374292, '7/13/2011', '13:06:52', '17:06:52', 2, 'STATE OF OR  ', 'Processing 100K calls', 'X', ' ', '', 'Not Logged In', 'phone'),
(374295, '7/13/2011', '13:16:09', '17:16:09', 4, 'HILTON GRAND VACATION CO', 'wants to be able to Collect zero Duration caalls', 'X', ' ', '', 'Not Logged In', 'phone'),
(374297, '7/14/2011', '07:51:07', '11:51:07', 4, 'RUTGERS UNIVERSITY        ', 'Costing incorrectly for a internal call', 'X', ' ', '', 'Not Logged In', 'phone'),
(374298, '7/14/2011', '09:31:29', '13:31:29', 2, 'ESSEX COUNTY CORRECTIONAL  ', '', 'X', ' ', '', 'Not Logged In', 'phone'),
(374310, '7/14/2011', '10:57:57', '14:57:57', 4, 'RE SOURCES USA', 'Help with Report', 'X', ' ', '', 'Not Logged In', 'phone'),
(374312, '7/14/2011', '11:56:05', '15:56:05', 2, 'STATE OF ARIZONA - ADOA      ', 'CALL COSTING', 'X', ' ', '', 'Not Logged In', 'phone'),
(374314, '7/14/2011', '12:31:32', '16:31:32', 2, 'UNION LEAGUE CLUB OF CHICAGO  ', 'Summary Report Help', 'X', ' ', '', 'Not Logged In', 'phone'),
(374317, '7/14/2011', '14:37:26', '18:37:26', 2, 'HAWAII NATIONAL BANK    ', 'TIME DIFFERENCE', 'X', ' ', '', 'Not Logged In', 'phone'),
(374320, '7/14/2011', '16:35:16', '20:35:16', 2, 'UNIVERSITY OF ARKANSAS FT SMIT', 'DIRECTORY FULL', 'X', ' ', '', 'Not Logged In', 'phone'),
(374322, '7/14/2011', '16:59:49', '20:59:49', 9, 'US DEPARTMENT OF JUSTICE ', 'DOWN SYSTEM', 'X', ' ', '', 'Not Logged In', 'phone'),
(374324, '7/14/2011', '17:27:48', '21:27:48', 2, 'EISENHOWER MEDICAL CENTER    ', 'Phone Number Search', 'X', ' ', '', 'Not Logged In', 'phone'),
(374328, '7/15/2011', '07:52:15', '11:52:15', 2, 'Roswell Park', 'Web Reports menu blank', 'X', ' ', '', 'Not Logged In', 'phone'),
(374329, '7/15/2011', '08:27:21', '12:27:21', 2, 'STREET.COM, INC (THE)', 'Report error', 'X', ' ', '', 'Not Logged In', 'phone'),
(374332, '7/15/2011', '12:21:34', '16:21:34', 2, 'EISENHOWER MEDICAL CENTER ', 'Web user access, need to get his working', 'X', ' ', '', 'Not Logged In', 'phone'),
(374333, '7/15/2011', '12:20:29', '16:20:29', 9, 'EDISON STATE COLLEGE', 'Down', 'X', ' ', '', 'Not Logged In', 'phone'),
(374335, '7/18/2011', '06:38:32', '10:38:32', 9, 'LEE MEMORIAL HEALTH SYSTEM    ', 'Control Center not updating', 'X', ' ', '', 'Not Logged In', 'phone'),
(374338, '7/18/2011', '09:21:26', '13:21:26', 2, 'HILLSBOROUGH COUNTY 13TH', 'PASSWORD TROUBLE', 'X', ' ', '', 'Not Logged In', 'phone'),
(374340, '7/18/2011', '10:00:06', '14:00:06', 4, 'AMERICREDIT   ', 'Web Authentication issues', 'X', ' ', '', 'Not Logged In', 'phone'),
(374342, '7/18/2011', '10:12:26', '14:12:26', 2, 'WESTINGHOUSE CRANBERRY TWP', 'EXPLAIN RAW CDR ', 'X', ' ', '', 'Not Logged In', 'phone'),
(374343, '7/18/2011', '10:22:02', '14:22:02', 4, 'EISENHOWER MEDICAL CENTER     ', 'Help with report', 'X', ' ', '', 'Not Logged In', 'phone'),
(374346, '7/18/2011', '12:55:46', '16:55:46', 2, 'CITY OF DENTON TECHNOLOGY SVCS', 'Service dead after every saturday at midnight durring windows updates', 'X', ' ', '', 'Not Logged In', 'phone'),
(374353, '7/18/2011', '16:00:54', '20:00:54', 9, 'CROWNE PLAZA HOUSTON WEST  ', 'PMS ISSUES', 'X', ' ', '', 'Not Logged In', 'phone'),
(374356, '7/19/2011', '07:42:03', '11:42:03', 2, 'CANCER TREATMENT CTR OF AMERIC', 'Missing data on report', 'X', ' ', '', 'Not Logged In', 'phone'),
(374358, '7/19/2011', '08:00:47', '12:00:47', 9, 'AMERICREDIT   ', 'Error collecting AVAYA RSP data', 'X', ' ', '', 'Not Logged In', 'phone'),
(374359, '7/19/2011', '09:55:57', '13:55:57', 9, 'CENTRE COLLEGE DANVILLE KY   ', 'Not collecting due to change in Routers', 'X', ' ', '', 'Not Logged In', 'phone'),
(374361, '7/19/2011', '08:43:43', '12:43:43', 4, 'WEST TEXAS A&M UNIVERSITY    ', 'Assist with report', 'X', ' ', '', 'Not Logged In', 'phone'),
(374365, '7/19/2011', '11:06:18', '15:06:18', 2, 'WOODHULL MEDICAL CENTER ', 'Phone number search.', 'X', ' ', '', 'Not Logged In', 'phone'),
(374366, '7/19/2011', '11:42:09', '15:42:09', 4, 'LENDER PROCESSING SERVICES', 'Error with login ', 'X', ' ', '', 'Not Logged In', 'phone'),
(374367, '7/19/2011', '12:03:59', '16:03:59', 4, 'HEALTHCARE PARTNERS  ', 'Datasource trouble', 'X', ' ', '', 'Not Logged In', 'phone'),
(374368, '7/19/2011', '13:23:41', '17:23:41', 2, 'SHATTUCK PLAZA HOTEL  ', 'NO CDR alarm issues', 'X', ' ', '', 'Not Logged In', 'phone'),
(374371, '7/19/2011', '15:49:41', '19:49:41', 2, 'SECURIAN FINANCIAL GROUP   ', 'Upgrade questions - NO NOTES IN TICKET.', 'X', ' ', '', 'Not Logged In', 'phone'),
(374372, '7/19/2011', '18:59:33', '22:59:33', 2, 'EISENHOWER MEDICAL CENTER', 'Company Logo Display', 'X', ' ', '', 'Not Logged In', 'phone'),
(374375, '7/20/2011', '08:40:18', '12:40:18', 4, 'RUTGERS UNIVERSITY ', 'Rollover ext help', 'X', ' ', '', 'Not Logged In', 'phone'),
(374384, '7/20/2011', '10:50:28', '14:50:28', 4, 'EDISON STATE COLLEGE', 'Help with reports rotating on a select group of records', 'X', ' ', '', 'Not Logged In', 'phone'),
(374387, '8/9/2011', '10:37:23', '14:37:23', 2, 'UNION SQUARE EYE CARE INC.    ', '1hr Training left', 'X', '2011-10-17 15:18:20', '', 'Not Logged In', 'phone'),
(374390, '7/20/2011', '13:42:34', '17:42:34', 9, 'LENDER PROCESSING SERVICES', 'No Data on Reports', 'X', ' ', '', 'Not Logged In', 'phone'),
(374392, '7/21/2011', '10:29:01', '14:29:01', 9, 'OUR LADY OF BELLEFONTE HOSP', 'RE-INSTALLATION OF SELECT 8.0', 'X', ' ', '', 'Not Logged In', 'phone'),
(374397, '7/20/2011', '14:44:44', '18:44:44', 2, 'GENOPTIX    ', 'Delete unassigned ext', 'X', ' ', '', 'Not Logged In', 'phone'),
(374401, '7/20/2011', '15:13:56', '19:13:56', 2, 'GENUINE PARTS COMPANY', 'Explain Call Transfer Reports', 'X', ' ', '', 'Not Logged In', 'phone'),
(374402, '7/29/2011', '15:31:43', '19:31:43', 2, 'SECURIAN FINANCIAL GROUP      ', 'SP4041', 'X', '2011-07-29 15:59:45', '', 'Not Logged In', 'phone'),
(374405, '7/20/2011', '16:23:46', '20:23:46', 2, 'MEDICAL COLLEGE OF WI     ', 'Call Costing Questions', 'X', ' ', '', 'Not Logged In', 'phone'),
(374408, '7/21/2011', '08:16:43', '12:16:43', 2, 'TALMER BANK AND TRUST   ', 'Needs assistance with reports on her call trees', 'X', ' ', '', 'Not Logged In', 'phone'),
(374413, '7/21/2011', '10:00:07', '14:00:07', 2, 'CLASSIFIED VENTURES       ', '0 CALL SUMMARY', 'X', ' ', '', 'Not Logged In', 'phone'),
(374701, '7/21/2011', '10:32:01', '14:32:01', 2, 'MEDICAL COLLEGE OF WI ', 'Assistance Moving Gateways', 'X', ' ', '', 'Not Logged In', 'phone'),
(374702, '7/21/2011', '11:56:10', '15:56:10', 9, 'SPECTRUM HEALTH - GRAND RAPIDS', 'DOWN SYSTEM', 'X', ' ', '', 'Not Logged In', 'phone'),
(374704, '7/21/2011', '12:47:19', '16:47:19', 2, 'AMERITAS LIFE INSURANCE CORP  ', 'Rate Table Error Message', 'X', ' ', '', 'Not Logged In', 'phone'),
(374706, '7/21/2011', '12:58:48', '16:58:48', 9, 'SONY COMPUTER ENTERTAINMENT', 'Foster City (DS1) no calls since June', 'X', ' ', '', 'Not Logged In', 'phone'),
(374707, '7/21/2011', '12:59:31', '16:59:31', 4, 'CAREERBUILDER    ', 'Reporting Statistics.', 'X', ' ', '', 'Not Logged In', 'phone'),
(374709, '7/21/2011', '14:09:23', '18:09:23', 4, 'CITY OF TYLER ', 'DIAGNOSE ISSUES', 'X', ' ', '', 'Not Logged In', 'phone'),
(374714, '7/21/2011', '16:12:54', '20:12:54', 2, 'WEST TEXAS A&M UNIVERSITY ', 'Report Walkthrough', 'X', ' ', '', 'Not Logged In', 'phone'),
(374716, '7/21/2011', '17:59:19', '21:59:19', 4, 'CLASSIFIED VENTURES', 'Directory Objects', 'X', '2011-07-26 15:51:49', '', 'Not Logged In', 'phone'),
(374717, '7/22/2011', '09:16:09', '13:16:09', 9, 'POMONA SCHOOL ED CENTER ', 'System has been down since hte 14th ', 'X', ' ', '', 'Not Logged In', 'phone'),
(374725, '7/22/2011', '12:18:05', '16:18:05', 2, 'CHRISTIAN BROADCASTING NETWORK', 'Tennessee Call Costing', 'X', ' ', '', 'Not Logged In', 'phone'),
(374726, '7/25/2011', '16:20:40', '20:20:40', 9, 'AR NATIONAL GUARD', 'DOWN SYSTEM', 'X', '2011-07-26 08:34:04', '', 'Not Logged In', 'phone'),
(374732, '7/25/2011', '07:15:18', '11:15:18', 4, 'GENUINE PARTS COMPANY   ', '****Trial Order*** Costing Issue', 'X', ' ', '', 'Not Logged In', 'phone'),
(374739, '7/25/2011', '08:48:15', '12:48:15', 2, 'JP MORGAN CHASE', 'Maumbi Cisco site not recording all calls on old system', 'X', '2011-07-26 08:34:54', '', 'Not Logged In', 'phone'),
(374740, '7/25/2011', '09:09:58', '13:09:58', 9, 'JOHNSON DIVERSEY  ', 'No Cdr on Reports', 'X', '2011-07-25 16:21:09', '', 'Not Logged In', 'phone'),
(374743, '7/27/2011', '15:16:10', '19:16:10', 4, 'LOCK HAVEN UNIVERISITY    ', 'Re-install Select 8.1', 'X', '2011-07-29 16:05:37', '', 'Not Logged In', 'phone'),
(374746, '7/25/2011', '10:28:37', '14:28:37', 4, 'PUBLIX CREDIT UNION    ', 'Alerts not working', 'X', '2011-07-25 16:21:14', '', 'Not Logged In', 'phone'),
(374748, '7/25/2011', '10:35:18', '14:35:18', 4, 'TCF BANK LISLE IL (main svr)  ', 'Scheduled report missing all but 1 ext ', 'X', '2011-07-26 13:45:50', '', 'Not Logged In', 'phone'),
(374749, '7/25/2011', '10:42:11', '14:42:11', 2, 'PHILADELPHIA INSURANCE CO.', 'Summary Gate problems', 'X', '2011-07-26 15:52:09', '', 'Not Logged In', 'phone'),
(374750, '7/25/2011', '10:54:00', '14:54:00', 4, 'BOAT US ALEXANDRIA  ', 'Looking to track a number', 'X', '2011-07-27 07:41:46', '', 'Not Logged In', 'phone'),
(374751, '7/25/2011', '11:33:38', '15:33:38', 9, 'COUNTY OF TULARE ', 'DOWN SYSTEM', 'X', '2011-07-25 16:22:20', '', 'Not Logged In', 'phone'),
(374752, '7/25/2011', '11:37:51', '15:37:51', 2, 'CATERPILLAR FINANCIAL SERVICES', 'Reports for new extensions are blank', 'X', '2011-07-27 07:44:21', '', 'Not Logged In', 'phone'),
(374754, '7/25/2011', '13:39:36', '17:39:36', 2, 'ASSOCIATED BANC CORP ', 'Wed CaCenter Dir DB error when adding a location', 'X', '2011-07-27 13:17:47', '', 'Not Logged In', 'phone'),
(374755, '7/25/2011', '14:09:49', '18:09:49', 9, 'WESTINGHOUSE CRANBERRY TWP', 'One time charges not correct.  Darlene called back on this', 'X', '2011-07-25 16:21:26', '', 'Not Logged In', 'phone'),
(374757, '7/25/2011', '16:39:13', '20:39:13', 9, 'CITY OF WEST HOLLYWOOD  ', 'DOWN SYSTEM', 'X', '2011-07-25 17:14:36', '', 'Not Logged In', 'phone'),
(374758, '7/25/2011', '17:07:10', '21:07:10', 2, 'EYE CLINIC OF WISCONSIN', 'Directory Management', 'X', '2011-07-26 14:24:44', '', 'Not Logged In', 'phone'),
(374760, '7/26/2011', '07:44:26', '11:44:26', 4, 'GENUINE PARTS COMPANY ', 'unable to purge some directory objects', 'X', '2011-07-26 11:02:43', '', 'Not Logged In', 'phone'),
(374766, '7/26/2011', '09:05:42', '13:05:42', 9, 'CHICAGO BOARD OPTIONS EXCHANGE', 'No data collected for today', 'X', '2011-07-26 11:27:24', '', 'Not Logged In', 'phone'),
(374768, '7/26/2011', '09:12:13', '13:12:13', 2, 'KINGS COUNTY HOSPITAL', 'Moving VM Question', 'X', '2011-07-26 15:57:18', '', 'Not Logged In', 'phone'),
(374771, '7/26/2011', '09:51:43', '13:51:43', 4, 'DIRECT EDGE ', 'Help with configuring reports', 'X', '2011-07-27 09:56:53', '', 'Not Logged In', 'phone'),
(374772, '7/26/2011', '10:09:51', '14:09:51', 2, 'RUTGERS UNIVERSITY   ', 'Web Server event viewer error', 'X', '2011-07-27 13:33:07', '', 'Not Logged In', 'phone'),
(374775, '7/26/2011', '10:37:21', '14:37:21', 2, 'ING WHOLESALE BANKING ', 'Extension Auto-add not updating', 'X', '2011-07-27 13:51:17', '', 'Not Logged In', 'phone'),
(374776, '7/26/2011', '11:14:19', '15:14:19', 2, 'TENNECO AUTOMOTIVE  ', 'BBOX reconfigure', 'X', '2011-07-27 13:56:22', '', 'Not Logged In', 'phone'),
(374782, '8/1/2011', '10:22:42', '14:22:42', 2, 'ALTRU HEALTH SYSTEM ', 'Missing Backups since 7/13', 'X', '2011-08-01 15:54:04', '', 'Not Logged In', 'phone'),
(374786, '7/27/2011', '08:15:28', '12:15:28', 2, 'Geico', 'Duplicate Exts in Dir DB', 'X', '2011-07-27 13:51:54', '', 'Not Logged In', 'phone'),
(374787, '7/27/2011', '08:36:07', '12:36:07', 2, 'COUNTY OF GALVESTON  ', 'Trouble adding username', 'X', '2011-07-27 14:12:42', '', 'Not Logged In', 'phone'),
(374788, '7/27/2011', '09:47:08', '13:47:08', 2, 'Corinthian Colleges', 'Since SP 4041 installed the CaCenter Run Now button is missing on reports', 'X', '2011-07-27 11:06:28', '', 'Not Logged In', 'phone'),
(374789, '8/10/2011', '11:24:36', '15:24:36', 4, 'KS NATIONAL GUARD TOPEKA', 'Domain name changed on VM', 'X', '2011-08-11 14:35:52', '', 'Not Logged In', 'phone'),
(374791, '7/27/2011', '09:45:55', '13:45:55', 9, 'WOODHULL MEDICAL CENTER  ', 'Cannot connect to the DB', 'X', '2011-07-27 10:22:32', '', 'Not Logged In', 'phone'),
(374792, '8/18/2011', '09:25:48', '13:25:48', 4, 'TRANSCORR LLC ', 'Software Server Move', 'X', '2011-08-18 11:13:43', '', 'Not Logged In', 'phone'),
(374793, '7/27/2011', '09:59:33', '13:59:33', 2, 'NATIONAL FUTURES ASSOC', 'Information Only', 'X', '2011-07-27 14:24:46', '', 'Not Logged In', 'phone'),
(374795, '7/29/2011', '15:24:38', '19:24:38', 9, 'CROWNE PLAZA CABANA PALO ALTO ', 'DOWN SYSTEM', 'X', '2011-07-29 15:53:37', '', 'Not Logged In', 'phone'),
(374797, '7/27/2011', '10:29:21', '14:29:21', 9, 'SIERRA PACIFIC POWER main site', 'DOWN SYSTEM', 'X', '2011-07-27 11:52:51', '', 'Not Logged In', 'phone'),
(374802, '7/28/2011', '07:24:07', '11:24:07', 2, 'CITY OF ANDERSON  ', 'Cisco Dir import errors, not updating', 'X', '2011-08-02 10:41:18', '', 'Not Logged In', 'phone'),
(374803, '7/28/2011', '08:08:48', '12:08:48', 9, 'PUTNAM INVESTMENTS ', 'Down, No CDR ALarms', 'X', '2011-07-28 08:42:23', '', 'Not Logged In', 'phone'),
(374804, '7/28/2011', '08:41:35', '12:41:35', 2, 'The Street', 'Time zones wrong on some reports', 'X', '2011-07-29 14:05:09', '', 'Not Logged In', 'phone'),
(374805, '7/28/2011', '09:12:10', '13:12:10', 9, 'PALOS COMMUNITY HOSPITAL', 'No CDR Alarm for DS2', 'X', '2011-07-28 12:59:47', '', 'Not Logged In', 'phone'),
(374809, '7/28/2011', '10:01:18', '14:01:18', 2, 'EISENHOWER MEDICAL CENTER ', 'IsvExports will not start', 'X', '2011-07-28 14:30:32', '', 'Not Logged In', 'phone'),
(374812, '7/28/2011', '17:02:55', '21:02:55', 2, 'SMITH SENIOR LIVING ', 'Install Select 8.1', 'X', '2011-08-03 13:02:42', '', 'Not Logged In', 'phone'),
(374813, '7/28/2011', '12:09:48', '16:09:48', 2, 'CATERPILLAR FINANCIAL SERVICES', 'Digit Filtering', 'X', '2011-07-29 08:29:58', '', 'Not Logged In', 'phone'),
(374815, '7/28/2011', '13:30:38', '17:30:38', 9, 'HMA WUESTHOFF ROCKLEDGE MED CT', 'All 3 DSs getting No CDR Alarms', 'X', '2011-07-29 07:53:22', '', 'Not Logged In', 'phone'),
(374816, '7/28/2011', '13:23:46', '17:23:46', 9, 'MO ARMY NATIONAL GUARD MAIN ', 'Kansas City only recording internal calls after new PRI installed', 'X', '2011-07-28 14:07:49', '', 'Not Logged In', 'phone'),
(374817, '7/28/2011', '14:00:47', '18:00:47', 2, 'WESTINGHOUSE CRANBERRY TWP', 'Dashboard Dir filter tree view not working', 'X', '2011-07-29 14:29:34', '', 'Not Logged In', 'phone'),
(374823, '7/28/2011', '16:16:38', '20:16:38', 4, 'DRIVETIME   ', 'Calls being filtered', 'X', '2011-07-29 11:46:51', '', 'Not Logged In', 'phone'),
(374824, '7/28/2011', '16:40:03', '20:40:03', 2, 'LATHAM & WATKINS-LOS ANGELES C', 'Report Viewing User Settings', 'X', '2011-08-01 16:07:15', '', 'Not Logged In', 'phone'),
(374825, '7/29/2011', '07:08:39', '11:08:39', 2, 'SHERMAN HOSPITAL', 'Forgot PW,need to run repts', 'X', '2011-07-29 07:25:29', '', 'Not Logged In', 'phone'),
(374826, '7/29/2011', '08:56:43', '12:56:43', 9, 'FLORIDA COMMUNITY COLLEGE', 'Stopped Collecting Data', 'X', '2011-07-29 11:06:37', '', 'Not Logged In', 'phone'),
(374827, '7/29/2011', '08:43:47', '12:43:47', 9, 'TAKATA', 'Last calls processed on 7-12-11', 'X', '2011-07-29 11:27:06', '', 'Not Logged In', 'phone'),
(374828, '7/29/2011', '09:27:37', '13:27:37', 2, 'COUNTY OF GALVESTON', 'New user cannot change PW', 'X', '2011-08-01 16:04:51', '', 'Not Logged In', 'phone'),
(374839, '7/29/2011', '11:01:29', '15:01:29', 2, 'CITY OF DAVIS ', 'Export Error ', 'X', '2011-08-01 11:18:12', '', 'Not Logged In', 'phone'),
(374840, '7/29/2011', '11:03:33', '15:03:33', 9, 'DYNAMEX INC      ', 'CONTROL CENTER', 'X', '2011-08-02 15:03:53', '', 'Not Logged In', 'phone'),
(374841, '7/29/2011', '11:04:47', '15:04:47', 2, 'DYNAMEX INC ', 'HUNT GROUPS', 'X', '2011-08-02 15:04:03', '', 'Not Logged In', 'phone'),
(374842, '7/29/2011', '11:06:45', '15:06:45', 2, 'DYNAMEX INC', 'Duplicate Calls', 'X', '2011-08-02 15:03:58', '', 'Not Logged In', 'phone'),
(374843, '7/29/2011', '11:44:43', '15:44:43', 2, 'NRECA ARLINGTON VA ', 'RATES WAY TOO HIGH', 'X', '2011-08-02 11:42:33', '', 'Not Logged In', 'phone'),
(374846, '7/29/2011', '13:54:13', '17:54:13', 2, 'COUNTY OF WOOD    ', 'Transfered calls detaile report timing out', 'X', '2011-08-05 13:32:20', '', 'Not Logged In', 'phone'),
(374864, '8/1/2011', '07:51:26', '11:51:26', 2, 'AMERICREDIT', 'Need to get Web authentication working after upgrade on Select.', 'X', '2011-08-02 16:47:32', '', 'Not Logged In', 'phone'),
(374865, '8/1/2011', '08:13:01', '12:13:01', 2, 'OWENS & MINOR ', 'Questions on costing internal calls', 'X', '2011-08-03 10:57:12', '', 'Not Logged In', 'phone'),
(374866, '8/1/2011', '08:36:27', '12:36:27', 9, 'CDR MANAGED SERVICES SERVER 2 ', 'Avaya ip office switch, the records below are going to the g file ', 'X', '2011-08-03 09:27:12', '', 'Not Logged In', 'phone'),
(374870, '8/2/2011', '15:20:43', '19:20:43', 2, 'HOLZER MEDICAL CENTER   ', 'REMOTE TRAINING ', 'X', '2011-08-03 13:20:22', '', 'Not Logged In', 'phone'),
(374871, '8/1/2011', '10:24:09', '14:24:09', 9, 'SERVICE MASTER MEMPHIS   ', 'HDD FULL', 'X', '2011-08-01 14:00:00', '', 'Not Logged In', 'phone'),
(374874, '8/1/2011', '10:53:51', '14:53:51', 9, 'DES MOINES IND. COMMUNITY SCHL', 'DOWN SYSTEM', 'X', '2011-08-01 11:04:17', '', 'Not Logged In', 'phone'),
(374877, '8/17/2011', '16:20:42', '20:20:42', 4, 'EISENHOWER MEDICAL CENTER  ', 'Autoreports Attachment', 'X', '2011-08-18 08:13:13', '', 'Not Logged In', 'phone'),
(374880, '8/1/2011', '11:53:10', '15:53:10', 2, 'MOODYS CORPORATION   ', 'SP3863 causes server crash', 'X', '2011-08-02 11:54:38', '', 'Not Logged In', 'phone'),
(374881, '8/1/2011', '12:16:51', '16:16:51', 4, 'LENDER PROCESSING SERVICES    ', 'MAX LICENSES', 'X', '2011-08-02 09:57:49', '', 'Not Logged In', 'phone'),
(374883, '8/1/2011', '12:39:47', '16:39:47', 2, 'AMERITAS LIFE INSURANCE CORP  ', 'AUTOREPORTS', 'X', '2011-08-01 15:59:23', '', 'Not Logged In', 'phone'),
(374885, '8/1/2011', '12:45:38', '16:45:38', 2, 'GALE DIV OF CENGAGE LEARNING  ', 'Explain ACD/NACD', 'X', '2011-08-04 11:46:48', '', 'Not Logged In', 'phone'),
(374886, '8/1/2011', '13:31:38', '17:31:38', 9, 'RESEARCH PHARMACEUTICALS', 'No calls recorded for today. ', 'X', '2011-08-02 09:56:40', '', 'Not Logged In', 'phone'),
(374887, '8/1/2011', '13:04:31', '17:04:31', 2, 'HOSPICE OF THE COMFORTER, INC', 'Cal going to VM not recording', 'X', '2011-08-04 13:28:26', '', 'Not Logged In', 'phone'),
(374889, '8/1/2011', '14:48:03', '18:48:03', 2, 'TAKATA    ', 'Web User Security Settings', 'X', '2011-08-16 11:04:03', '', 'Not Logged In', 'phone'),
(374893, '8/1/2011', '15:36:31', '19:36:31', 4, 'STATE BAR OF CALIFORNIA   ', 'FIXED CHARGES', 'X', '2011-08-10 10:44:55', '', 'Not Logged In', 'phone'),
(374894, '8/1/2011', '16:24:14', '20:24:14', 2, 'RBC CAPITAL MARKETS CORP', 'Missing Data in Report', 'X', '2011-08-02 11:29:35', '', 'Not Logged In', 'phone'),
(374895, '8/1/2011', '16:37:08', '20:37:08', 9, 'DENTON COUNTY      ', 'DOWN SYSTEM', 'X', '2011-08-01 16:47:13', '', 'Not Logged In', 'phone'),
(374896, '8/1/2011', '16:44:40', '20:44:40', 9, 'CORINTHIAN COLLEGES  ', 'DOWN SYSTEM', 'X', '2011-08-02 11:29:56', '', 'Not Logged In', 'phone'),
(374898, '8/2/2011', '08:34:55', '12:34:55', 2, 'PUTNAM INVESTMENTS', 'Costing too high.', 'X', '2011-08-02 13:17:20', '', 'Not Logged In', 'phone'),
(374900, '8/2/2011', '10:20:48', '14:20:48', 4, 'STATE U. AT MORRISVILLE ', 'AUTOREPORTS ERROR', 'X', '2011-08-02 11:35:19', '', 'Not Logged In', 'phone'),
(374902, '8/2/2011', '13:20:19', '17:20:19', 4, 'CURBELL - ORCHARD PARK NY', 'DOWN SYSTEM DIAGNOSIS', 'X', '2011-08-03 12:40:37', '', 'Not Logged In', 'phone'),
(374906, '8/2/2011', '11:07:20', '15:07:20', 2, 'TRINITY UNIVERSITY  ', 'EXTENSION DIGITS', 'X', '2011-08-09 11:24:01', '', 'Not Logged In', 'phone'),
(374910, '8/2/2011', '13:44:32', '17:44:32', 2, 'WESTINGHOUSE', 'Needs to configure Report Portal', 'X', '2011-08-03 14:04:48', '', 'Not Logged In', 'phone'),
(374912, '8/2/2011', '14:40:45', '18:40:45', 4, 'AMERICREDIT', 'Analytical reprts for VM calls show 0 calls after SP4041', 'X', '2011-08-10 11:03:25', '', 'Not Logged In', 'phone'),
(374914, '8/2/2011', '14:52:24', '18:52:24', 4, 'ST MARGARET HOSPITAL', 'Billing Description Help', 'X', '2011-08-04 07:50:04', '', 'Not Logged In', 'phone'),
(374917, '8/2/2011', '15:27:14', '19:27:14', 2, 'TORRANCE MEMORIAL HOSPITAL   ', 'IFW AUTOREPORTS NOT WORKING', 'X', '2011-08-03 11:49:53', '', 'Not Logged In', 'phone'),
(374919, '8/2/2011', '17:07:32', '21:07:32', 9, 'CITY OF LUBBOCK  ', 'Directory Setup', 'X', '2011-08-03 08:11:10', '', 'Not Logged In', 'phone'),
(374920, '8/2/2011', '18:40:18', '22:40:18', 2, 'SALEM-KEIZER PUBLIC SCHOOLS ', 'Blank Autoreports', 'X', '2011-08-03 08:06:02', '', 'Not Logged In', 'phone'),
(374925, '8/3/2011', '09:33:31', '13:33:31', 9, 'ST JOSEPHS HOSPITAL MARSHFIELD', 'Down, no calls processing', 'X', '2011-08-03 09:37:48', '', 'Not Logged In', 'phone'),
(374927, '8/5/2011', '10:39:59', '14:39:59', 9, 'HORIZON SOLUTIONS CORP ', 'CUCM 8 Upgrade', 'X', '2011-08-05 13:14:06', '', 'Not Logged In', 'phone'),
(374928, '8/3/2011', '09:55:19', '13:55:19', 2, 'CHRISTIAN BROADCASTING NETWORK', 'Autoreports Help', 'X', '2011-08-04 13:31:59', '', 'Not Logged In', 'phone'),
(374931, '8/3/2011', '10:49:51', '14:49:51', 2, 'STATE OF MD-DIST COURT OF MD  ', 'Not stripping digits dialed', 'X', '2011-08-03 11:05:31', '', 'Not Logged In', 'phone'),
(374933, '8/3/2011', '10:58:30', '14:58:30', 2, 'DORAL ARROWWOOD ', 'INT Call Tracking', 'X', '2011-08-03 15:10:15', '', 'Not Logged In', 'phone'),
(374938, '8/3/2011', '12:45:04', '16:45:04', 2, 'ST VINCENT MARTEN HOUSE ', 'RT update error', 'X', '2011-08-04 12:41:19', '', 'Not Logged In', 'phone'),
(374940, '8/3/2011', '14:35:54', '18:35:54', 4, 'STEPTOE & JOHNSON ', 'CUCM 8 UPGRADE for 8-6-11', 'X', '2011-08-05 07:25:20', '', 'Not Logged In', 'phone'),
(374941, '8/3/2011', '13:45:37', '17:45:37', 9, 'STEPTOE & JOHNSON', 'Last calls recorded on 7-14-11.', 'X', '2011-08-03 14:54:47', '', 'Not Logged In', 'phone'),
(374942, '8/3/2011', '14:23:42', '18:23:42', 2, 'CLASSIFIED VENTURES', 'Error when running reports.', 'X', '2011-08-03 15:22:25', '', 'Not Logged In', 'phone'),
(374945, '8/3/2011', '15:42:48', '19:42:48', 2, 'CITY OF EL PASO ', 'Reports incomplete', 'X', '2011-08-04 13:37:36', '', 'Not Logged In', 'phone'),
(374946, '8/3/2011', '16:08:42', '20:08:42', 4, 'JP MORGAN CHASE  main site  ', 'Multi-server CDR', 'X', '2011-08-04 11:08:32', '', 'Not Logged In', 'phone'),
(374947, '8/3/2011', '17:29:22', '21:29:22', 2, 'BOY SCOUTS OF AMERICA   ', 'Delete Wireless Charges', 'X', '2011-08-05 15:31:47', '', 'Not Logged In', 'phone'),
(374948, '8/3/2011', '17:35:07', '21:35:07', 4, 'MCKINSEY & COMPANY', 'Rejected Calls', 'X', '2011-08-04 07:58:35', '', 'Not Logged In', 'phone'),
(374949, '8/4/2011', '08:00:41', '12:00:41', 2, 'EBSCO PUBLISHING', 'SQL error in Event Viewer.', 'X', '2011-08-09 11:24:25', '', 'Not Logged In', 'phone'),
(374951, '8/4/2011', '09:36:21', '13:36:21', 9, 'UNION SQUARE EYE CARE INC.   ', 'No calls recording.', 'X', '2011-08-04 10:43:19', '', 'Not Logged In', 'phone'),
(374952, '8/4/2011', '09:47:43', '13:47:43', 2, 'PAN AMERICAN HEALTH ORG', 'Undefined Extensions', 'X', '2011-08-04 14:26:06', '', 'Not Logged In', 'phone'),
(374953, '8/4/2011', '11:00:14', '15:00:14', 4, 'BASS PRO SHOPS', 'Sizeup Assistance', 'X', '2011-08-04 11:16:24', '', 'Not Logged In', 'phone'),
(374954, '8/4/2011', '11:27:17', '15:27:17', 9, 'ALPERT & ALPERT IRON & METAL ', '8-3 calls recording over & over', 'X', '2011-08-04 12:00:24', '', 'Not Logged In', 'phone'),
(374955, '8/4/2011', '12:06:29', '16:06:29', 2, 'TORRANCE MEMORIAL HOSPITAL   ', 'User Password Changes', 'X', '2011-08-04 15:19:34', '', 'Not Logged In', 'phone'),
(374957, '8/4/2011', '14:15:35', '18:15:35', 9, 'DYNAMEX INC   ', 'Down, cannot access Control center', 'X', '2011-08-05 07:23:20', '', 'Not Logged In', 'phone'),
(374958, '8/4/2011', '14:26:37', '18:26:37', 2, 'MARSHFIELD CLINIC', 'Departments showing 0 calls on monthly reports', 'X', '2011-08-05 08:05:34', '', 'Not Logged In', 'phone'),
(374959, '8/4/2011', '15:45:28', '19:45:28', 2, 'PHILADELPHIA INSURANCE CO.  ', 'Directory Edits', 'X', '2011-08-08 16:16:35', '', 'Not Logged In', 'phone'),
(374960, '8/4/2011', '16:48:39', '20:48:39', 9, 'ANSCHUTZ KANSAS CITY ARENA', 'CUCM Upgrade Issues', 'X', '2011-08-04 16:51:03', '', 'Not Logged In', 'phone'),
(374961, '8/4/2011', '15:54:54', '19:54:54', 2, 'ANDERSON TRUCKING SERVICE ', 'Blank Reports', 'X', '2011-08-04 16:38:54', '', 'Not Logged In', 'phone'),
(374972, '8/5/2011', '10:21:10', '14:21:10', 4, 'APEX INFORMATION SYSTEMS  ', '', 'X', '2011-08-05 11:12:51', '', 'Not Logged In', 'phone'),
(374975, '8/5/2011', '10:52:56', '14:52:56', 2, 'ST BARNABAS COM MEDICAL CENTER', 'Email Filesize Errors', 'X', '2011-08-05 14:08:09', '', 'Not Logged In', 'phone'),
(374977, '8/5/2011', '11:51:29', '15:51:29', 4, 'INTER-AMERICAN DEVELOPMENT BAN', 'Licenses Exceeded', 'X', '2011-08-09 08:06:49', '', 'Not Logged In', 'phone'),
(374978, '8/12/2011', '14:55:03', '18:55:03', 9, 'MAKAHA RESORT GOLF CLUB       ', 'PMS SYSTEM DOWN', 'X', '2011-08-12 17:46:17', '', 'Not Logged In', 'phone'),
(374983, '8/5/2011', '13:03:58', '17:03:58', 2, 'ERIE INSURANCE COMPANY ', '', 'X', '2011-08-08 14:56:23', '', 'Not Logged In', 'phone'),
(374986, '8/5/2011', '14:46:00', '18:46:00', 2, 'UNION LEAGUE CLUB OF CHICAGO  ', 'Abandoned Call Autoreport help', 'X', '2011-08-09 11:24:53', '', 'Not Logged In', 'phone'),
(374989, '8/9/2011', '10:09:09', '14:09:09', 4, 'BRANCH BANKING & TRUST   ', 'LDAP IMPORT', 'X', '2011-08-09 10:48:22', '', 'Not Logged In', 'phone'),
(374990, '8/8/2011', '07:28:27', '11:28:27', 9, 'GAINESVILLE REGIONAL UTILITIES', 'Not processed any data for over a week', 'X', '2011-08-08 08:10:29', '', 'Not Logged In', 'phone'),
(374998, '8/8/2011', '08:47:41', '12:47:41', 4, 'GEICO ', '', 'X', '2011-08-09 08:09:14', '', 'Not Logged In', 'phone'),
(375000, '8/8/2011', '09:06:00', '13:06:00', 9, 'MUNCIE POWER PRODUCTS INC.  ', 'No CDR Collected', 'X', '2011-08-08 09:13:12', '', 'Not Logged In', 'phone'),
(375002, '8/8/2011', '09:42:20', '13:42:20', 2, 'MCKINSEY & COMPANY ', 'Question on SQL 2008 R2', 'X', '2011-08-09 09:49:25', '', 'Not Logged In', 'phone'),
(375003, '8/8/2011', '11:19:13', '15:19:13', 4, 'RETIREMENT SYSTEMS OF ALABAMA ', 'User License Maxed out by Unassigned users', 'X', '2011-08-08 11:54:55', '', 'Not Logged In', 'phone'),
(375005, '8/8/2011', '13:08:59', '17:08:59', 2, 'FOREST PHARMACEUTICALS        ', 'DB Sync', 'X', '2011-08-09 09:48:51', '', 'Not Logged In', 'phone'),
(375006, '8/8/2011', '13:11:46', '17:11:46', 2, 'ST MARGARET HOSPITAL', 'CLIENT NOT WORKING', 'X', '2011-08-09 09:37:52', '', 'Not Logged In', 'phone'),
(375008, '8/8/2011', '13:43:57', '17:43:57', 4, 'CITY OF DENTON TECHNOLOGY SVCS', '', 'X', '2011-08-09 08:08:40', '', 'Not Logged In', 'phone'),
(375014, '8/8/2011', '15:30:50', '19:30:50', 2, 'ROTHSTEIN, KASS & COMPANY', 'Missing Tariff Update', 'X', '2011-08-09 13:55:39', '', 'Not Logged In', 'phone'),
(375018, '8/9/2011', '07:48:57', '11:48:57', 9, 'AMERICAN PRECIOUS METALS EXCHA', 'No data on Graph', 'X', '2011-08-09 08:02:31', '', 'Not Logged In', 'phone'),
(375021, '8/9/2011', '10:00:42', '14:00:42', 2, 'CLASSIFIED VENTURES ', 'Excel Report Format', 'X', '2011-08-09 13:23:50', '', 'Not Logged In', 'phone'),
(375022, '8/9/2011', '10:37:40', '14:37:40', 2, 'BUCHANAN INGERSOLL & ROONEY PC', 'Fresh IFW Install', 'X', '2011-08-09 11:25:12', '', 'Not Logged In', 'phone'),
(375027, '8/9/2011', '10:46:28', '14:46:28', 2, 'LIGHTHOUSE GROUP  ', 'Web Report Errors', 'X', '2011-08-09 10:56:18', '', 'Not Logged In', 'phone'),
(375029, '8/9/2011', '11:05:07', '15:05:07', 2, 'BUCHANAN INGERSOLL & ROONEY PC', 'REMOTE TRAINING', 'X', '2011-08-09 11:52:10', '', 'Not Logged In', 'phone'),
(375044, '8/9/2011', '13:39:15', '17:39:15', 4, 'GRAHAM CAPITAL MANAGEMENT', 'Adding additional trunk', 'X', '2011-08-09 13:41:32', '', 'Not Logged In', 'phone'),
(375052, '8/9/2011', '16:17:23', '20:17:23', 2, 'BASS PRO SHOPS  ', 'LICENSE KEY UPDATE', 'X', '2011-08-09 16:28:29', '', 'Not Logged In', 'phone'),
(375060, '8/10/2011', '09:35:22', '13:35:22', 4, 'AMERITAS LIFE INSURANCE CORP', 'Issue with Rate tables via FTP, 10 Dig numbers filling up Unassigned, Call costing of Inbound calls', 'X', '2011-08-10 16:10:21', '', 'Not Logged In', 'phone'),
(375061, '8/10/2011', '09:39:49', '13:39:49', 2, 'WYNDHAM VACATION OWNERSHIP  ', 'Web users cannot login using Windows Authentication', 'X', '2011-08-10 09:57:09', '', 'Not Logged In', 'phone'),
(375066, '8/10/2011', '10:40:38', '14:40:38', 2, 'OKLAHOMA HEART HOSPITAL  ', 'Help with abandon call report', 'X', '2011-08-10 12:21:55', '', 'Not Logged In', 'phone'),
(375068, '8/10/2011', '11:23:26', '15:23:26', 2, 'MCKINSEY & COMPANY  ', 'Excel Format Issues', 'X', '2011-08-10 12:02:27', '', 'Not Logged In', 'phone'),
(375075, '8/11/2011', '06:47:01', '10:47:01', 9, 'KAMEHAMEHA SCHOOLS ', 'DOWN SYSTEM', 'X', '2011-08-11 08:18:12', '', 'Not Logged In', 'phone'),
(375076, '8/11/2011', '07:56:16', '11:56:16', 4, 'RESEARCH PHARMACEUTICALS SERVI', 'Cannot Access Web', 'X', '2011-08-11 11:22:38', '', 'Not Logged In', 'phone'),
(375077, '8/11/2011', '08:20:25', '12:20:25', 9, 'BARNES & NOBLE COLLEGE  ', 'DOWN SYSTEM', 'X', '2011-08-11 09:05:39', '', 'Not Logged In', 'phone'),
(375078, '8/11/2011', '08:27:44', '12:27:44', 2, 'COOK INCORPORATED ', 'CallManager IP Change', 'X', '2011-08-11 12:59:51', '', 'Not Logged In', 'phone'),
(375083, '8/11/2011', '11:47:12', '15:47:12', 9, 'HILTON - SAN FRANCISCO     ', 'Down System..Not posting any calls to any of the rooms', 'X', '2011-08-11 12:00:18', '', 'Not Logged In', 'phone'),
(375085, '8/11/2011', '12:41:15', '16:41:15', 4, 'SOUTHERN IL HEALTHCARE  ', 'Extension Detail Report shows calls in the future', 'X', '2011-08-11 13:25:54', '', 'Not Logged In', 'phone'),
(375086, '8/11/2011', '13:36:20', '17:36:20', 4, 'AMERICAN PRECIOUS METALS EXCHA', 'Reporting Questions', 'X', '2011-08-11 14:36:01', '', 'Not Logged In', 'phone'),
(375090, '8/11/2011', '15:17:08', '19:17:08', 9, 'RETIREMENT SYSTEMS OF ALABAMA ', 'Customer Called Back on LDAP', 'X', '2011-09-06 14:00:47', '', 'Not Logged In', 'phone'),
(375099, '8/12/2011', '08:33:30', '12:33:30', 4, 'CONDE NAST PUBLICATIONS', 'AD Questions', 'X', '2011-08-12 10:52:38', '', 'Not Logged In', 'phone'),
(375100, '8/12/2011', '08:36:43', '12:36:43', 4, 'FRANKLIN COUNTY CHILDRENS SVCS', 'SQL Failure with SA & INFORTEL Password', 'X', '2011-08-12 13:17:43', '', 'Not Logged In', 'phone'),
(375106, '8/12/2011', '10:11:08', '14:11:08', 9, 'JOHNSON DIVERSEY   ', 'DOWN SYSTEM', 'X', '2011-08-12 10:31:04', '', 'Not Logged In', 'phone'),
(375115, '8/12/2011', '12:58:50', '16:58:50', 4, 'AMERICREDIT ', 'Help with Reclassify of toll free call', 'X', '2011-08-12 14:20:23', '', 'Not Logged In', 'phone'),
(375116, '8/12/2011', '13:02:58', '17:02:58', 9, 'ANDERSON TRUCKING SERVICE ', 'No Data on Report', 'X', '2011-08-12 13:41:03', '', 'Not Logged In', 'phone'),
(375117, '8/12/2011', '13:43:11', '17:43:11', 9, 'LENDER PROCESSING SERVICES    ', 'Not processing all information', 'X', '2011-08-12 14:36:05', '', 'Not Logged In', 'phone'),
(375118, '8/12/2011', '13:57:45', '17:57:45', 4, 'VISA - FOSTER CITY  (main)    ', 'Verify system size ', 'X', '2011-08-12 15:41:29', '', 'Not Logged In', 'phone'),
(375119, '8/12/2011', '14:49:51', '18:49:51', 9, 'GEORGE BUSH INTERCONTINAL AIRPORT', 'BBOX FULL', 'X', '2011-08-12 15:06:37', '', 'Not Logged In', 'phone'),
(375121, '8/12/2011', '16:37:53', '20:37:53', 2, 'CORINTHIAN COLLEGES', 'Extension Digits', 'X', '2011-08-17 13:31:22', '', 'Not Logged In', 'phone'),
(375123, '8/12/2011', '17:10:41', '21:10:41', 2, 'UCAR NCAR ', 'STRIP + CHARACTER', 'X', '2011-08-15 08:16:29', '', 'Not Logged In', 'phone'),
(375126, '8/15/2011', '07:48:41', '11:48:41', 4, 'HGT/ VANTAGE HEALTH GROUP  ', 'Getting error:The process cannot access the file C;usersadministratorlocal	emp1Allied Urology.pdf because it is being used by another process.', 'X', '2011-08-15 08:44:52', '', 'Not Logged In', 'phone'),
(375128, '8/15/2011', '09:01:20', '13:01:20', 2, 'GENUINE PARTS COMPANY    ', 'Questions on report views', 'X', '2011-08-15 09:03:47', '', 'Not Logged In', 'phone'),
(375129, '8/15/2011', '09:09:36', '13:09:36', 4, 'FINLEY HOSPITAL        ', 'LD Calls incorrect city name ', 'X', '2011-08-15 13:52:43', '', 'Not Logged In', 'phone'),
(375130, '8/15/2011', '09:16:07', '13:16:07', 9, 'STATE OF MD DISABILITY DETERMI', 'Down System no data on graph', 'X', '2011-08-15 11:18:54', '', 'Not Logged In', 'phone'),
(375134, '8/16/2011', '07:05:25', '11:05:25', 2, 'ANOKA COUNTY GOVERNMENT', 'Print out International pricing', 'X', '2011-08-16 08:42:55', '', 'Not Logged In', 'phone'),
(375135, '8/16/2011', '07:36:48', '11:36:48', 4, 'WORK FORCE OF CENTRAL FLORIDA ', 'Getting 911 alarms that were never made', 'X', '2011-08-16 07:40:32', '', 'Not Logged In', 'phone'),
(375139, '8/16/2011', '09:00:38', '13:00:38', 4, 'MERITUS HEALTH ', 'Buffer polling changed ', 'X', '2011-08-16 11:59:47', '', 'Not Logged In', 'phone');
INSERT INTO `tickets` (`Ticket`, `Date`, `STime`, `ETA`, `Priority`, `Site`, `Comments`, `Deleted`, `Removed_Datetime`, `removedby`, `Creator`, `ContactPref`) VALUES
(375141, '8/16/2011', '10:17:10', '14:17:10', 9, 'CENTRAL GARDEN & PET  ', 'Not Collecting Data...Additional open issues from Upgrade', 'X', '2011-08-16 12:48:00', '', 'Not Logged In', 'phone'),
(375144, '12/12/2011', '09:40:51', '13:40:51', 2, 'BHP BILLITON-main   ', 'SP 4304 Upgrade', 'X', '2011-12-14 08:25:45', '', 'Not Logged In', 'phone'),
(375145, '9/2/2011', '09:01:24', '13:01:24', 2, 'EBSCO PUBLISHING  ', 'SP 4213 Upgrade', 'X', '2011-09-08 11:03:09', '', 'Not Logged In', 'phone'),
(375150, '8/16/2011', '13:52:29', '17:52:29', 9, 'RAYTHEON COMPANY IIS   ', 'Down System ...No Data being collected ', 'X', '2011-08-16 14:46:41', '', 'Not Logged In', 'phone'),
(375151, '8/16/2011', '14:46:16', '18:46:16', 2, 'NATIONAL FUTURES ASSOC.  ', 'FTP & SQL Questions', 'X', '2011-08-16 15:25:43', '', 'Not Logged In', 'phone'),
(375152, '8/16/2011', '15:24:48', '19:24:48', 2, 'IVANS', 'Report & Summary Gates questions', 'X', '2011-08-17 08:16:10', '', 'Not Logged In', 'phone'),
(375156, '9/19/2011', '08:44:16', '12:44:16', 9, 'FAIRMONT HOTEL WASHINGTON DC  ', 'Down System not collecting any data for the past few days\r\n', 'X', '2011-09-19 10:07:17', '', 'Not Logged In', 'phone'),
(375157, '8/16/2011', '16:34:30', '20:34:30', 9, 'WY NATIONAL GUARD CHEYENN MAIN', 'DOWN SYSTEM', 'X', '2011-08-16 17:19:39', '', 'Not Logged In', 'phone'),
(375158, '8/16/2011', '17:43:52', '21:43:52', 2, 'COUNTY OF FRESNO FRESNO CA    ', 'CUCM Diagram', 'X', '2011-08-17 13:33:41', '', 'Not Logged In', 'phone'),
(375159, '8/17/2011', '09:01:52', '13:01:52', 9, 'FRANKLIN COUNTY VIRGINIA      ', 'Down system not collected since 8/4', 'X', '2011-08-17 09:28:45', '', 'Not Logged In', 'phone'),
(375160, '8/17/2011', '09:10:37', '13:10:37', 4, 'AMERICREDIT ', 'How to export all the extension listed in Unassigned to excel', 'X', '2011-08-17 09:28:34', '', 'Not Logged In', 'phone'),
(375161, '8/17/2011', '09:32:00', '13:32:00', 4, 'KFORCE  ', 'W3WP.EXE Process using most of the resources', 'X', '2011-08-17 10:44:32', '', 'Not Logged In', 'phone'),
(375162, '8/17/2011', '09:34:10', '13:34:10', 4, 'COMPUTER ASSOCIATES', 'Calls being reported incorrectly', 'X', '2011-08-17 10:13:29', '', 'Not Logged In', 'phone'),
(375164, '8/17/2011', '09:53:12', '13:53:12', 2, 'DONA ANA COMMUNITY COLLEGE    ', 'FTP Rate table setup', 'X', '2011-08-17 10:39:46', '', 'Not Logged In', 'phone'),
(375165, '8/17/2011', '10:02:25', '14:02:25', 2, 'INTERCONTINENTAL HOTEL BOSTON ', 'Scheduled reports not going out', 'X', '2011-08-17 13:47:19', '', 'Not Logged In', 'phone'),
(375166, '8/17/2011', '10:06:16', '14:06:16', 4, 'CMP AUTO GROUP, LTD  ', 'Report not going out', 'X', '2011-08-17 11:09:56', '', 'Not Logged In', 'phone'),
(375170, '8/17/2011', '11:46:25', '15:46:25', 2, 'FIRSTCOMP WARWICK ', 'Trunk Definitions', 'X', '2011-08-17 13:42:51', '', 'Not Logged In', 'phone'),
(375173, '8/17/2011', '12:38:34', '16:38:34', 2, 'FRANKLIN COUNTY VIRGINIA     ', 'Abandoned Call Questions', 'X', '2011-08-17 13:53:51', '', 'Not Logged In', 'phone'),
(375176, '8/17/2011', '13:58:49', '17:58:49', 9, 'STATE OF MD DHR DSS CARROLL CO', 'Down System..Not collected since June 28th ', 'X', '2011-08-17 13:59:42', '', 'Not Logged In', 'phone'),
(375180, '8/17/2011', '16:31:58', '20:31:58', 2, 'EISENHOWER MEDICAL CENTER  ', 'Phone Number Search', 'X', '2011-08-18 08:14:16', '', 'Not Logged In', 'phone'),
(375182, '8/18/2011', '07:30:37', '11:30:37', 2, 'ERIE INSURANCE COMPANY   ', 'Login Trouble', 'X', '2011-08-18 08:11:45', '', 'Not Logged In', 'phone'),
(375185, '8/18/2011', '09:15:30', '13:15:30', 2, 'HAPPY STATE BANK  ', 'Unassigned & Misdialed', 'X', '2011-08-18 11:16:48', '', 'Not Logged In', 'phone'),
(375187, '8/18/2011', '10:01:11', '14:01:11', 9, 'CANCER TREATMENT CTR OF AMERIC', 'Down system has not collected any data since Aug 9th ', 'X', '2011-08-18 10:15:07', '', 'Not Logged In', 'phone'),
(375188, '8/18/2011', '10:17:12', '14:17:12', 4, 'KIRBY RISK  ', 'Help with directory import', 'X', '2011-08-18 11:19:45', '', 'Not Logged In', 'phone'),
(375189, '8/18/2011', '10:53:07', '14:53:07', 2, 'AMERICREDIT   ', 'User Management', 'X', '2011-08-18 11:22:23', '', 'Not Logged In', 'phone'),
(375190, '8/19/2011', '10:17:50', '14:17:50', 2, 'KINGS COUNTY HOSPITAL     ', 'SQL Server Migration', 'X', '2011-08-19 14:00:55', '', 'Not Logged In', 'phone'),
(375199, '8/18/2011', '15:14:24', '19:14:24', 4, 'SEABOARD MARINE', 'Help with finding report', 'X', '2011-08-19 07:54:50', '', 'Not Logged In', 'phone'),
(375206, '8/19/2011', '08:34:53', '12:34:53', 2, 'JOHNS HOPKINS HOME', 'Question on Microsoft patches ', 'X', '2011-08-19 08:38:21', '', 'Not Logged In', 'phone'),
(375207, '8/19/2011', '08:49:56', '12:49:56', 2, 'STREET.COM, INC (THE)     ', 'Help with setting up some users', 'X', '2011-08-19 09:13:44', '', 'Not Logged In', 'phone'),
(375210, '8/19/2011', '09:25:38', '13:25:38', 2, 'DYNAMEX INC   ', 'Help with setting up new user', 'X', '2011-08-19 12:10:19', '', 'Not Logged In', 'phone'),
(375213, '8/19/2011', '16:06:19', '20:06:19', 9, 'EDISON STATE COLLEGE  ', 'DOWN SYSTEM', 'X', '2011-08-19 16:44:49', '', 'Not Logged In', 'phone'),
(375215, '8/22/2011', '07:02:03', '11:02:03', 4, 'FORT SAM HOUSTON ISD     ', 'Help with editing auth codes', 'X', '2011-08-22 08:16:46', '', 'Not Logged In', 'phone'),
(375216, '8/22/2011', '07:07:06', '11:07:06', 9, 'JP MORGAN CHASE  main site', 'Multi-Client environment Down', 'X', '2011-08-22 07:26:06', '', 'Not Logged In', 'phone'),
(375217, '8/22/2011', '07:29:27', '11:29:27', 4, 'EL CAMINO HOSPITAL', 'Remediate ICMP', 'X', '2011-08-25 13:19:30', '', 'Not Logged In', 'phone'),
(375221, '8/22/2011', '08:56:45', '12:56:45', 4, 'INDIANA HEALTH CENTERS     ', '2 reports showing different amounts of calls made', 'X', '2011-08-22 12:07:10', '', 'Not Logged In', 'phone'),
(375223, '8/22/2011', '10:26:00', '14:26:00', 4, 'WEST CLINIC ', 'No CDR alarms', 'X', '2011-08-22 11:21:49', '', 'Not Logged In', 'phone'),
(375224, '8/22/2011', '11:17:00', '15:17:00', 4, 'UCAR NCAR    ', 'Wants to know if it is possible to automate a data push into this table', 'X', '2011-08-22 12:28:58', '', 'Not Logged In', 'phone'),
(375225, '8/22/2011', '11:47:39', '15:47:39', 9, 'HUBBELL POWER SYSTEMS   ', 'DOWN SYSTEM', 'X', '2011-08-22 12:05:37', '', 'Not Logged In', 'phone'),
(375226, '8/22/2011', '11:55:48', '15:55:48', 9, 'GENUINE PARTS COMPANY   ', 'Disk Space Cleanup', 'X', '2011-08-22 12:42:01', '', 'Not Logged In', 'phone'),
(375227, '8/22/2011', '12:46:20', '16:46:20', 2, 'CHILDRENS MEDICAL CENTER  ', 'Blank Reports on Demand', 'X', '2011-08-22 15:29:56', '', 'Not Logged In', 'phone'),
(375229, '8/22/2011', '13:36:07', '17:36:07', 9, 'MERITUS HEALTH   ', 'DOWN SYSTEM', 'X', '2011-08-22 15:00:26', '', 'Not Logged In', 'phone'),
(375239, '8/23/2011', '07:22:24', '11:22:24', 4, 'GEICO     ', 'LDAP Problems', 'X', '2011-08-23 08:23:41', '', 'Not Logged In', 'phone'),
(375247, '8/23/2011', '08:32:27', '12:32:27', 9, 'HUBBELL POWER SYSTEMS ', 'On August 10th he loaded his rate table for China since then his system is down', 'X', '2011-08-23 09:25:06', '', 'Not Logged In', 'phone'),
(375248, '8/23/2011', '08:58:19', '12:58:19', 9, 'JP MORGAN CHASE  main site    ', 'Error in Directory for reporting ', 'X', '2011-08-23 14:58:10', '', 'Not Logged In', 'phone'),
(375255, '8/23/2011', '09:53:17', '13:53:17', 4, 'SCHOLASTIC BOOK FAIR LAKE MARY', 'Unassigned people on detail report****note * Per notes in history we need to respond to critical issues within 2 hours (24 x 7) and to non-critical issues within 4 business hours (standard support hours)***', 'X', '2011-08-23 12:48:54', '', 'Not Logged In', 'phone'),
(375259, '8/23/2011', '10:37:19', '14:37:19', 2, 'WEST CLINIC     ', 'Password Trouble', 'X', '2011-08-23 13:19:23', '', 'Not Logged In', 'phone'),
(375265, '8/23/2011', '12:13:32', '16:13:32', 2, 'AMERITAS LIFE INSURANCE CORP  ', 'irpMain errors in report', 'X', '2011-08-23 14:33:15', '', 'Not Logged In', 'phone'),
(375271, '8/23/2011', '13:29:08', '17:29:08', 2, 'SHERATON DALLAS NORTH', 'Trace Inbound Call', 'X', '2011-08-24 07:33:23', '', 'Not Logged In', 'phone'),
(375272, '8/23/2011', '14:15:25', '18:15:25', 4, 'HAWAII NATIONAL BANK ', 'Help with report for dept to dept', 'X', '2011-08-23 14:28:32', '', 'Not Logged In', 'phone'),
(375274, '8/23/2011', '14:21:54', '18:21:54', 4, 'COLUMBIA INSURANCE    ', 'Help with Summary style report report is showing nothing ', 'X', '2011-08-23 14:38:42', '', 'Not Logged In', 'phone'),
(375279, '8/23/2011', '17:07:54', '21:07:54', 9, 'ARIZONA CARDINALS ', 'DOWN SYSTEM', 'X', '2011-08-25 15:43:36', '', 'Not Logged In', 'phone'),
(375280, '8/24/2011', '07:57:21', '11:57:21', 2, 'CHEMICAL ABSTRACT SERVICES    ', '911 Amarms not always emailing', 'X', '2011-08-24 13:49:01', '', 'Not Logged In', 'phone'),
(375282, '8/24/2011', '08:37:46', '12:37:46', 9, 'DAVID J JOSEPH COMPANY (DJJ) ', 'System not collecting all calls...also time is off on reports', 'X', '2011-08-24 08:41:58', '', 'Not Logged In', 'phone'),
(375283, '8/24/2011', '09:46:48', '13:46:48', 4, 'WORK FORCE OF CENTRAL FLORIDA ', 'Help with 911 Alerts', 'X', '2011-08-24 10:55:16', '', 'Not Logged In', 'phone'),
(375287, '8/24/2011', '10:38:29', '14:38:29', 2, 'AMERICREDIT ', 'Sumerized data report', 'X', '2011-08-24 11:05:01', '', 'Not Logged In', 'phone'),
(375289, '8/24/2011', '10:52:55', '14:52:55', 2, 'FREEPORT MCMORAN COPPER & GOLD', 'Web Report Frozen', 'X', '2011-08-24 13:01:13', '', 'Not Logged In', 'phone'),
(375292, '8/24/2011', '11:34:47', '15:34:47', 2, 'WEST CLINIC    ', '911 Alarms', 'X', '2011-08-24 14:32:16', '', 'Not Logged In', 'phone'),
(375295, '8/24/2011', '13:25:39', '17:25:39', 4, 'IAT GROUP HARCO  ', 'Create Ext range', 'X', '2011-08-24 15:14:59', '', 'Not Logged In', 'phone'),
(375300, '8/24/2011', '14:46:08', '18:46:08', 2, 'ILLINOIS MUNICIPAL RETIREMENT ', 'Explain isvsched', 'X', '2011-08-24 17:05:10', '', 'Not Logged In', 'phone'),
(375305, '8/24/2011', '16:55:49', '20:55:49', 4, 'JP MORGAN CHASE  main site   ', 'Directory Errors', 'X', '2011-08-24 17:00:56', '', 'Not Logged In', 'phone'),
(375307, '8/25/2011', '07:27:48', '11:27:48', 9, 'CITY OF SARASOTA POLICE DEPT  ', 'DOWN SYSTEM', 'X', '2011-08-25 08:02:29', '', 'Not Logged In', 'phone'),
(375318, '8/25/2011', '09:52:36', '13:52:36', 4, 'RUSH NORTH SHORE HOSPITAL   ', '1CB - Call Redirect Report Help', 'X', '2011-08-25 15:13:48', '', 'Not Logged In', 'phone'),
(375327, '8/25/2011', '12:04:00', '16:04:00', 2, 'CABELAS ', 'Autoreport not saving.', 'X', '2011-08-25 14:27:00', '', 'Not Logged In', 'phone'),
(375333, '8/25/2011', '13:40:23', '17:40:23', 4, 'WYNDHAM VACATION OWNERSHIP ', 'Help with  running a reports for 6 ext...User is on the  dashboard', 'X', '2011-08-25 14:23:43', '', 'Not Logged In', 'phone'),
(375349, '8/25/2011', '14:29:50', '18:29:50', 4, 'COLUMBIA INSURANCE', 'Not updating with LDAP', 'X', '2011-08-26 12:54:03', '', 'Not Logged In', 'phone'),
(375370, '8/25/2011', '15:55:34', '19:55:34', 2, 'WESTINGHOUSE CRANBERRY TWP', 'ACD Groups showing up unser unassigned', 'X', '2011-08-29 09:25:09', '', 'Not Logged In', 'phone'),
(375376, '8/26/2011', '07:22:21', '11:22:21', 9, 'DADE COUNTY AVIATION    ', 'Not processing data', 'X', '2011-08-26 07:46:16', '', 'Not Logged In', 'phone'),
(375377, '8/26/2011', '07:54:28', '11:54:28', 4, 'WE ENERGIES (MAIN SITE)   ', 'Wants to take out Dual Entries', 'X', '2011-08-29 14:39:45', '', 'Not Logged In', 'phone'),
(375383, '8/26/2011', '11:50:26', '15:50:26', 2, 'NCCI HOLDING ', 'Directory Errors when adding persons', 'X', '2011-08-29 14:39:52', '', 'Not Logged In', 'phone'),
(375385, '8/26/2011', '12:04:37', '16:04:37', 2, 'GILFORD SECURITIES', 'Multi-Extension User report.', 'X', '2011-08-29 15:58:36', '', 'Not Logged In', 'phone'),
(375389, '8/26/2011', '13:03:25', '17:03:25', 2, 'GIBBONS, DEDEO, DOLAN, GRIFFIN', 'DASHBOARD ACCESS', 'X', '2011-08-29 15:51:32', '', 'Not Logged In', 'phone'),
(375394, '8/26/2011', '14:50:42', '18:50:42', 2, 'COMPUTER ASSOCIATES  ', 'Information on CSV format report.', 'X', '2011-08-29 08:57:05', '', 'Not Logged In', 'phone'),
(375396, '8/26/2011', '15:46:21', '19:46:21', 2, 'TECK RESOURCES LIMITED  ', 'Rate Table Geolocation Issues', 'X', '2011-08-26 15:50:04', '', 'Not Logged In', 'phone'),
(375406, '8/29/2011', '10:46:58', '14:46:58', 4, 'PLAINS CAPITAL CORPORATION  ', 'Missing Data from Reports', 'X', '2011-08-31 14:44:48', '', 'Not Logged In', 'phone'),
(375408, '8/29/2011', '10:49:52', '14:49:52', 4, 'RUSSELL REYNOLDS ASSOCIATES IN', 'LDAP Problems', 'X', '2011-08-29 14:13:47', '', 'Not Logged In', 'phone'),
(375410, '8/29/2011', '11:12:02', '15:12:02', 9, 'SMITH SENIOR LIVING      ', 'Down System not collecting any data since 8/28/11', 'X', '2011-08-29 13:26:22', '', 'Not Logged In', 'phone'),
(375413, '8/29/2011', '12:28:05', '16:28:05', 4, 'HENDRICK MEDICAL CENTER  ', 'Multiple Errors on Control Center', 'X', '2011-08-29 14:43:18', '', 'Not Logged In', 'phone'),
(375414, '8/29/2011', '12:40:57', '16:40:57', 9, 'RESEARCH PHARMACEUTICALS SERVI', 'Down system not collected data since 8/25/11', 'X', '2011-08-29 13:37:15', '', 'Not Logged In', 'phone'),
(375417, '8/29/2011', '13:07:49', '17:07:49', 4, 'PUTNAM INVESTMENTS    ', 'Costing off from what they are being charged', 'X', '2011-08-30 07:38:11', '', 'Not Logged In', 'phone'),
(375419, '8/29/2011', '13:21:51', '17:21:51', 4, 'MIDLAND COUNTY  ', 'Change costing of Long distance calls', 'X', '2011-08-29 14:05:49', '', 'Not Logged In', 'phone'),
(375715, '8/29/2011', '15:32:47', '19:32:47', 2, 'CITY OF PEORIA  ', '911 Alarms', 'X', '2011-08-30 08:06:36', '', 'Not Logged In', 'phone'),
(375717, '8/29/2011', '15:41:17', '19:41:17', 4, 'NORTEL GOVT SOL-SOCIAL SEC LAB', 'Report problem after loading sp 4041', 'X', '2011-08-30 10:07:35', '', 'Not Logged In', 'phone'),
(375718, '8/29/2011', '15:53:55', '19:53:55', 4, 'TCF BANK LISLE IL (main svr)  ', 'Hard Disk reaching capacity.', 'X', '2011-08-30 07:40:26', '', 'Not Logged In', 'phone'),
(375719, '8/29/2011', '16:03:30', '20:03:30', 9, 'CBS STUDIO CENTER ', 'NOT COLLECTING', 'X', '2011-08-29 17:17:00', '', 'Not Logged In', 'phone'),
(375727, '8/30/2011', '09:53:30', '13:53:30', 9, 'CHRISTIAN HOMES INC         ', 'No CDR Alarms as of 8/28/11', 'X', '2011-08-30 10:01:45', '', 'Not Logged In', 'phone'),
(375748, '8/30/2011', '15:20:51', '19:20:51', 9, 'BUCHANAN INGERSOLL & ROONEY PC', 'DOWN SYSTEM', 'X', '2011-08-30 16:56:43', '', 'Not Logged In', 'phone'),
(375749, '8/30/2011', '15:56:08', '19:56:08', 9, 'COOK CHILDRENS MEDICAL CENTER ', 'Not Collecting data', 'X', '2011-08-31 10:10:10', '', 'Not Logged In', 'phone'),
(375764, '8/31/2011', '07:56:39', '11:56:39', 9, 'AMERITAS LIFE INSURANCE CORP  ', 'Down System no data for today', 'X', '2011-08-31 10:16:47', '', 'Not Logged In', 'phone'),
(375765, '8/31/2011', '08:03:37', '12:03:37', 9, 'LOVES COUNTRY STORES    ', 'Down System Not collecting any data', 'X', '2011-08-31 08:39:09', '', 'Not Logged In', 'phone'),
(375770, '8/31/2011', '09:26:56', '13:26:56', 4, 'WORK FORCE OF CENTRAL FLORIDA ', 'Help with running report for 3 ext', 'X', '2011-08-31 12:24:12', '', 'Not Logged In', 'phone'),
(375775, '8/31/2011', '11:16:00', '15:16:00', 9, 'TSA INFRASTRUCTURE ', 'Down system not showing any data on dashboard for one of his locations.(main site)', 'X', '2011-08-31 11:35:18', '', 'Not Logged In', 'phone'),
(375777, '8/31/2011', '11:29:43', '15:29:43', 9, 'BROOKHAVEN NATIONAL LABORATORY', 'No Data for Modual 80', 'X', '2011-08-31 11:39:25', '', 'Not Logged In', 'phone'),
(375780, '8/31/2011', '11:59:50', '15:59:50', 2, 'CABELAS      ', 'Cant explin abandoned and ext detail reports', 'X', '2011-08-31 13:00:29', '', 'Not Logged In', 'phone'),
(375783, '8/31/2011', '12:22:38', '16:22:38', 2, 'DADE COUNTY AVIATION  ', 'Alarms not firing emails off.', 'X', '2011-09-02 10:30:44', '', 'Not Logged In', 'phone'),
(375786, '8/31/2011', '13:38:28', '17:38:28', 9, 'CONFED. TRIBES, SILETZ INDIANS', 'Not processing data since 8/12/11', 'X', '2011-08-31 14:03:38', '', 'Not Logged In', 'phone'),
(375787, '8/31/2011', '14:46:08', '18:46:08', 2, 'CITY OF LUBBOCK ', 'Directory Changes Not Saving', 'X', '2011-08-31 15:11:24', '', 'Not Logged In', 'phone'),
(375790, '8/31/2011', '17:28:11', '21:28:11', 2, 'NIELSEN COMPANY MEXICO    ', 'Intl Rate Table Installation', 'X', '2011-09-02 12:31:01', '', 'Not Logged In', 'phone'),
(375795, '9/1/2011', '08:26:28', '12:26:28', 2, 'MASONIC CHARITY FOUNDATION ', 'Fixed charges too high', 'X', '2011-09-06 07:26:03', '', 'Not Logged In', 'phone'),
(375798, '9/1/2011', '09:55:02', '13:55:02', 4, 'FINLEY HOSPITAL           ', 'Help with changing call time ', 'X', '2011-09-01 10:40:33', '', 'Not Logged In', 'phone'),
(375800, '9/1/2011', '10:10:33', '14:10:33', 2, 'HUBBELL POWER SYSTEMS    ', 'Aiken DS not recording calls.  Asl Dashboard error', 'X', '2011-09-01 10:57:16', '', 'Not Logged In', 'phone'),
(375804, '9/1/2011', '10:42:53', '14:42:53', 4, 'ELMHURST MEMORIAL HOSPITAL', '', 'X', '2011-09-01 14:40:09', '', 'Not Logged In', 'phone'),
(375805, '9/1/2011', '10:48:43', '14:48:43', 4, 'ANGEL MEDICAL CENTER ', 'Error with re-process data', 'X', '2011-09-01 15:41:14', '', 'Not Logged In', 'phone'),
(375813, '9/1/2011', '14:42:00', '18:42:00', 2, 'MORAINE VALLEY COMM COLLEGE  ', 'whos getting email merge reports', 'X', '2011-09-06 07:54:55', '', 'Not Logged In', 'phone'),
(375814, '9/1/2011', '15:23:16', '19:23:16', 9, 'BLUE CROSS & BLUE SHIELD CHAPE', 'Error when running trunk group analysis reports', 'X', '2011-09-02 12:24:04', '', 'Not Logged In', 'phone'),
(375816, '9/2/2011', '07:03:36', '11:03:36', 2, 'MEDLINE INDUSTRIES MUNDELEIN  ', 'Help with installing Intl rtss', 'X', '2011-09-02 10:35:36', '', 'Not Logged In', 'phone'),
(375821, '9/2/2011', '13:53:39', '17:53:39', 4, 'WAUSAU TILE         ', 'RE-Install select on new pc', 'X', '2011-09-06 08:01:10', '', 'Not Logged In', 'phone'),
(375826, '9/2/2011', '11:31:43', '15:31:43', 4, 'UCAR NCAR  ', 'LD Call being charged as Local for one of his locations ', 'X', '2011-09-06 08:05:55', '', 'Not Logged In', 'phone'),
(375833, '9/2/2011', '13:56:26', '17:56:26', 9, 'BUTLER UNIVERSITY ', 'Down system no data past the 28th of August', 'X', '2011-09-02 14:35:34', '', 'Not Logged In', 'phone'),
(375837, '9/2/2011', '14:09:54', '18:09:54', 4, 'PHEAA ', 'Zero cost for calls', 'X', '2011-09-06 07:57:28', '', 'Not Logged In', 'phone'),
(375841, '9/2/2011', '16:34:29', '20:34:29', 2, 'BOY SCOUTS OF AMERICA    ', 'Wireless Charges', 'X', '2011-09-06 09:11:19', '', 'Not Logged In', 'phone'),
(375843, '9/6/2011', '09:08:47', '13:08:47', 2, 'INTER-AMERICAN DEVELOPMENT BAN', 'a report to all members of the company instead of sent the report only to the stakeholders. ', 'X', '2011-09-06 16:02:09', '', 'Not Logged In', 'phone'),
(375844, '9/15/2011', '15:32:27', '19:32:27', 2, 'ALLIANZ LIFE INSURANCE CO ', 'call manger upgrade', 'X', '2011-09-16 09:20:29', '', 'Not Logged In', 'phone'),
(375846, '9/6/2011', '08:32:40', '12:32:40', 9, 'DYNAMEX INC    ', 'No CDR Alarms', 'X', '2011-09-06 09:10:23', '', 'Not Logged In', 'phone'),
(375848, '9/6/2011', '08:40:58', '12:40:58', 2, 'POLK COUNTY PLAZA  ', 'No Callerid info on inbound calls', 'X', '2011-09-06 14:48:58', '', 'Not Logged In', 'phone'),
(375849, '9/6/2011', '15:14:42', '19:14:42', 2, 'POLK COUNTY PLAZA', 'Reports training', 'X', '2011-09-08 14:35:41', '', 'Not Logged In', 'phone'),
(375851, '9/6/2011', '09:01:55', '13:01:55', 2, 'DADE COUNTY AVIATION ', 'People are getting alarms for a service request number.', 'X', '2011-09-06 11:42:19', '', 'Not Logged In', 'phone'),
(375854, '9/7/2011', '07:36:14', '11:36:14', 2, 'INTER-AMERICAN DEVELOPMENT BAN', 'Calls costing wrong', 'X', '2011-09-08 08:00:11', '', 'Not Logged In', 'phone'),
(375855, '9/6/2011', '10:33:32', '14:33:32', 2, 'ALTRU HEALTH SYSTEM    ', 'Calls being costed as assistance.', 'X', '2011-09-06 11:46:31', '', 'Not Logged In', 'phone'),
(375856, '9/6/2011', '10:53:04', '14:53:04', 2, 'KIRBY RISK ', 'Report problems, needs to verify Dir DB import', 'X', '2011-09-07 12:40:54', '', 'Not Logged In', 'phone'),
(375862, '9/6/2011', '11:30:06', '15:30:06', 2, 'TCF BANK MINNEAPOLIS', 'Report on ext has no calls. Also wants to change DS mname.', 'X', '2011-09-06 15:26:40', '', 'Not Logged In', 'phone'),
(375863, '9/6/2011', '11:31:06', '15:31:06', 9, 'HENDRICK MEDICAL CENTER ', 'NOT PROCESSING', 'X', '2011-09-06 11:35:35', '', 'Not Logged In', 'phone'),
(375865, '9/6/2011', '11:44:46', '15:44:46', 9, 'TORRANCE MEMORIAL HOSPITAL    ', 'Cant login to Control Center', 'X', '2011-09-07 11:18:13', '', 'Not Logged In', 'phone'),
(375868, '9/6/2011', '14:29:05', '18:29:05', 2, 'STREET.COM, INC THE   ', 'AD not syncing', 'X', '2011-09-08 13:09:05', '', 'Not Logged In', 'phone'),
(375871, '9/6/2011', '16:24:05', '20:24:05', 2, 'LATHAM & WATKINS-LOS ANGELES C', 'Dashboard access', 'X', '2011-09-08 15:00:38', '', 'Not Logged In', 'phone'),
(375872, '9/7/2011', '07:32:31', '11:32:31', 4, 'INTER-AMERICAN DEVELOPMENT BAN', 'Incomplete information on report', 'X', '2011-09-08 10:07:50', '', 'Not Logged In', 'phone'),
(375879, '9/7/2011', '09:27:00', '13:27:00', 4, 'INDIANA HEALTH CENTERS   ', 'Help with transfered call report', 'X', '2011-09-07 13:13:42', '', 'Not Logged In', 'phone'),
(375889, '9/7/2011', '11:12:31', '15:12:31', 9, 'MINNEAPOLIS INST OF ARTS', 'Down System not collecting data since Aug 1st', 'X', '2011-09-07 11:24:06', '', 'Not Logged In', 'phone'),
(375906, '9/7/2011', '14:04:35', '18:04:35', 2, 'TEACHERS CREDIT UNION', 'Need to setup Hunt Group reports', 'X', '2011-09-08 07:47:06', '', 'Not Logged In', 'phone'),
(375908, '9/7/2011', '14:42:31', '18:42:31', 4, 'UNIVERSITY OF ARKANSAS FT SMIT', 'Server Capacity Errors', 'X', '2011-09-07 15:00:14', '', 'Not Logged In', 'phone'),
(375909, '9/7/2011', '14:46:58', '18:46:58', 2, 'WASHINGTON STATE UNIVERSITY ', 'Questions on abilities of Select', 'X', '2011-09-08 10:05:38', '', 'Not Logged In', 'phone'),
(375910, '9/8/2011', '10:54:32', '14:54:32', 4, 'HOLZER MEDICAL CENTER    ', 'SP4213 & Training', 'X', '2011-09-09 13:05:45', '', 'Not Logged In', 'phone'),
(375918, '9/7/2011', '15:36:14', '19:36:14', 4, 'ST JOSEPHS HOSPITAL MARSHFIELD', 'Systems check for reporting accurately', 'X', '2011-09-08 13:10:32', '', 'Not Logged In', 'phone'),
(375935, '9/8/2011', '14:27:10', '18:27:10', 2, 'AMERICAN PRECIOUS METALS EXCHA', 'Autoreport Setup & Help', 'X', '2011-09-08 15:42:13', '', 'Not Logged In', 'phone'),
(375936, '9/8/2011', '14:38:58', '18:38:58', 2, 'SPECTRUM HEALTH - GRAND RAPIDS', 'False Alarms', 'X', '2011-09-08 15:43:31', '', 'Not Logged In', 'phone'),
(375945, '9/9/2011', '10:26:53', '14:26:53', 9, 'CABELAS   ', 'Cannot process any records Error in IsvProcess IFW file group is full.', 'X', '2011-09-09 12:19:17', '', 'Not Logged In', 'phone'),
(375947, '9/9/2011', '11:17:51', '15:17:51', 9, 'INTER-AMERICAN DEVELOPMENT BAN', 'DOWN SYSTEM', 'X', '2011-09-12 09:23:30', '', 'Not Logged In', 'phone'),
(375957, '9/9/2011', '13:46:49', '17:46:49', 4, 'MO ARMY NATIONAL GUARD MAIN   ', 'Down System', 'X', '2011-09-09 13:55:29', '', 'Not Logged In', 'phone'),
(375958, '9/13/2011', '09:13:56', '13:13:56', 9, 'ORANGE CTY PUBLIC SCHOOLS EDUC', 'DOWN SYSTEM diagnostics ', 'X', '2011-09-13 10:47:24', '', 'Not Logged In', 'phone'),
(375959, '9/9/2011', '14:01:38', '18:01:38', 4, 'PAREXEL INTERNATIONAL, INC LOW', 'Check to see if they still need ', 'X', '2011-10-14 10:54:40', '', 'Not Logged In', 'phone'),
(375962, '9/9/2011', '15:51:23', '19:51:23', 9, 'TORRANCE MEMORIAL HOSPITA', 'Down again', 'X', '2011-09-12 13:27:40', '', 'Not Logged In', 'phone'),
(375965, '9/9/2011', '17:50:23', '21:50:23', 2, 'MCKINSEY & COMPANY', 'Local Costs web report bug', 'X', '2011-09-13 10:51:38', '', 'Not Logged In', 'phone'),
(375970, '9/12/2011', '08:17:03', '12:17:03', 4, 'HOUSATONIC COMMUNITY COLLEGE  ', 'Seeing Old Data on Report.', 'X', '2011-09-12 08:39:03', '', 'Not Logged In', 'phone'),
(375973, '9/12/2011', '08:47:15', '12:47:15', 9, 'JOHNSON DIVERSEY    ', 'Not Processing Data', 'X', '2011-09-12 09:41:12', '', 'Not Logged In', 'phone'),
(375974, '9/12/2011', '08:53:46', '12:53:46', 9, 'PALOS COMMUNITY HOSPITAL  ', 'Not collecting data since 9/11/11', 'X', '2011-09-12 09:33:21', '', 'Not Logged In', 'phone'),
(375977, '9/12/2011', '09:28:38', '13:28:38', 4, 'IOWA CLINICS        ', 'Help with report', 'X', '2011-09-12 12:39:35', '', 'Not Logged In', 'phone'),
(375985, '9/12/2011', '11:53:58', '15:53:58', 2, 'MGIC (MORTGAGE GUARANTY INS CO', 'Autoreports Missing ', 'X', '2011-09-12 13:17:05', '', 'Not Logged In', 'phone'),
(375987, '9/12/2011', '12:33:15', '16:33:15', 2, 'GEICO          `', 'OneTime charges', 'X', '2011-09-12 13:01:39', '', 'Not Logged In', 'phone'),
(375988, '9/12/2011', '12:14:06', '16:14:06', 4, 'WASHINGTON STATE UNIVERSITY ', 'SDN Translation issue', 'X', '2011-09-13 13:02:49', '', 'Not Logged In', 'phone'),
(375993, '9/12/2011', '12:34:56', '16:34:56', 4, 'LATHAM & WATKINS ATTORNEYS  ', 'Missing Records', 'X', '2011-09-12 13:14:21', '', 'Not Logged In', 'phone'),
(375994, '9/12/2011', '12:48:23', '16:48:23', 9, 'OUR LADY OF LOURDES REGIONAL M', 'Several Alarm messages', 'X', '2011-09-12 12:58:16', '', 'Not Logged In', 'phone'),
(375995, '9/12/2011', '13:21:55', '17:21:55', 9, 'CULTURAL MISSION OF THE ROYAL ', 'DOWN SYSTEM', 'X', '2011-09-12 13:36:38', '', 'Not Logged In', 'phone'),
(375996, '9/12/2011', '13:23:12', '17:23:12', 2, 'ELMHURST MEMORIAL HOSPITAL    ', 'Time on 911 Alarts calls is off', 'X', '2011-09-13 11:24:34', '', 'Not Logged In', 'phone'),
(375998, '9/12/2011', '13:38:28', '17:38:28', 2, 'CENTURY COLLEGE       ', 'LD Access Codes', 'X', '2011-09-13 16:12:49', '', 'Not Logged In', 'phone'),
(376003, '9/12/2011', '14:07:58', '18:07:58', 9, 'SW REGIONAL COUNCIL OF CARPENT', 'Down System', 'X', '2011-09-12 16:11:59', '', 'Not Logged In', 'phone'),
(376004, '9/12/2011', '14:34:39', '18:34:39', 4, 'TCF BANK LISLE IL (main svr)  ', 'Reports run by admin without data', 'X', '2011-09-13 10:33:44', '', 'Not Logged In', 'phone'),
(376008, '9/12/2011', '15:17:45', '19:17:45', 4, 'WYNDHAM VACATION OWNERSHIP  ', 'Error with reports', 'X', '2011-09-14 10:57:06', '', 'Not Logged In', 'phone'),
(376013, '9/13/2011', '08:35:07', '12:35:07', 2, 'HENDRICK MEDICAL CENTER ', 'Trunk Analysis', 'X', '2011-09-14 12:06:29', '', 'Not Logged In', 'phone'),
(376016, '9/13/2011', '09:42:59', '13:42:59', 2, 'BRANCH BANKING & TRUST ', 'Trunk Usage Report Issues', 'X', '2011-09-14 14:27:44', '', 'Not Logged In', 'phone'),
(376020, '9/13/2011', '10:28:36', '14:28:36', 2, 'NATIONWIDE MUTUAL INSURANCE mn', 'Summary reports listed as &#34;trash&#34;', 'X', '2011-09-14 11:54:48', '', 'Not Logged In', 'phone'),
(376022, '9/13/2011', '10:51:58', '14:51:58', 4, 'MCKINSEY & COMPANY            ', 'Install Intl Table', 'X', '2011-09-15 13:17:33', '', 'Not Logged In', 'phone'),
(376023, '9/13/2011', '11:21:18', '15:21:18', 4, 'CITY OF MACON     ', 'Help with report', 'X', '2011-09-14 09:35:41', '', 'Not Logged In', 'phone'),
(376024, '9/13/2011', '11:40:33', '15:40:33', 2, 'CENTURA HC    ', 'Missing Extension in report', 'X', '2011-09-13 13:32:18', '', 'Not Logged In', 'phone'),
(376027, '9/13/2011', '12:12:48', '16:12:48', 4, 'HILLSBOROUGH COUNTY 13TH     ', '911 Report time off', 'X', '2011-09-14 10:18:53', '', 'Not Logged In', 'phone'),
(376038, '9/13/2011', '15:03:38', '19:03:38', 2, 'SMITH & NEPHEW  ', 'Whats new SP 4041 training', 'X', '2011-09-15 13:32:42', '', 'Not Logged In', 'phone'),
(376047, '9/13/2011', '16:12:47', '20:12:47', 4, 'MPS GROUP ', 'Bill Back offices', 'X', '2011-09-14 16:13:23', '', 'Not Logged In', 'phone'),
(376052, '9/21/2011', '13:40:35', '17:40:35', 9, 'COMPUTER ASSOCIATES ', 'DOWN SYSTEM', 'X', '2011-09-21 14:37:20', '', 'Not Logged In', 'phone'),
(376054, '9/14/2011', '08:50:41', '12:50:41', 9, 'JOHNSON DIVERSEY  ', 'Down system site 5 not collecting', 'X', '2011-09-14 10:04:31', '', 'Not Logged In', 'phone'),
(376063, '9/14/2011', '11:14:18', '15:14:18', 4, 'RADFORD UNIVERSITY  ', 'Not able to log in to the web to run reports', 'X', '2011-09-14 14:51:15', '', 'Not Logged In', 'phone'),
(376065, '9/14/2011', '11:54:45', '15:54:45', 2, 'WK KELLOGG FOUNDATION ', 'Report data not valid', 'X', '2011-09-15 13:33:01', '', 'Not Logged In', 'phone'),
(376068, '9/14/2011', '12:20:42', '16:20:42', 9, 'TRIMBLE SUNNYVALE CA    ', 'DOWN SYSTEM', 'X', '2011-09-14 13:56:05', '', 'Not Logged In', 'phone'),
(376075, '9/14/2011', '10:23:06', '14:23:06', 9, 'ASSOCIA    ', 'Needs a call today ', 'X', '2011-09-14 10:52:20', '', 'Not Logged In', 'phone'),
(376076, '9/14/2011', '13:24:24', '17:24:24', 4, 'RUTGERS UNIVERSITY ', 'User not able ot login to the web...getting login failed for user', 'X', '2011-09-16 10:22:03', '', 'Not Logged In', 'phone'),
(376079, '9/14/2011', '14:15:38', '18:15:38', 9, 'GIBBONS, DEDEO, DOLAN, GRIFFIN', 'Calls from meeting room ext not being tracked', 'X', '2011-09-15 14:14:36', '', 'Not Logged In', 'phone'),
(376089, '9/15/2011', '08:47:58', '12:47:58', 2, 'DAVE & BUSTERS', 'Check site to see if they are set up for FTP Rate table download', 'X', '2011-09-16 09:23:19', '', 'Not Logged In', 'phone'),
(376102, '9/15/2011', '10:45:31', '14:45:31', 2, 'CULTURAL MISSION OF THE ROYAL ', 'Report Walkthrough ', 'X', '2011-09-16 07:19:13', '', 'Not Logged In', 'phone'),
(376104, '9/15/2011', '10:47:24', '14:47:24', 2, 'TAKATA  ', 'LD and Local calls switched', 'X', '2011-09-16 10:09:06', '', 'Not Logged In', 'phone'),
(376107, '9/15/2011', '12:11:48', '16:11:48', 2, 'INTER-AMERICAN DEVELOPMENT BAN', 'Blank Web Reports', 'X', '2011-09-16 10:31:42', '', 'Not Logged In', 'phone'),
(376110, '9/15/2011', '13:46:20', '17:46:20', 4, 'NATIONAL OPINION RESEARCH CTR ', 'Help with missing data', 'X', '2011-09-15 15:37:04', '', 'Not Logged In', 'phone'),
(376114, '9/15/2011', '14:20:48', '18:20:48', 4, 'ARTHUR J GALLAGHER & ASSOCIATE', 'Load rate table along with master rate table', 'X', '2011-09-16 12:57:57', '', 'Not Logged In', 'phone'),
(376115, '9/20/2011', '12:47:34', '16:47:34', 4, 'WK KELLOGG FOUNDATION    ', 'SP 4213 Install', 'X', '2011-09-20 12:59:33', '', 'Not Logged In', 'phone'),
(376118, '9/15/2011', '15:04:51', '19:04:51', 4, 'EISENHOWER MEDICAL CENTER ', 'Set up dedicated account', 'X', '2011-09-15 16:26:35', '', 'Not Logged In', 'phone'),
(376121, '9/15/2011', '16:05:58', '20:05:58', 9, 'VIRTUA HEALTH   ', 'DOWN SYSTEM', 'X', '2011-09-15 17:38:22', '', 'Not Logged In', 'phone'),
(376124, '9/28/2011', '09:52:03', '13:52:03', 4, 'RUTGERS UNIVERSITY', 'SP 4213 UPGRADE ALONG WITH UPDATING A TOTAL OF 4 REMOTE DESKTOPS.', 'X', '2011-10-24 11:40:16', '', 'Not Logged In', 'phone'),
(376127, '9/16/2011', '08:09:57', '12:09:57', 4, 'DUBOIS REGIONAL MEDICAL CENTER', 'CBA - Still in open queue', 'X', '2011-11-11 13:28:08', '', 'Not Logged In', 'phone'),
(376130, '9/16/2011', '09:23:19', '13:23:19', 9, 'COUNTY OF TULARE     ', 'DOWN SYSTEM NOT COLLECTED SINCE THE 1ST OF SEPT', 'X', '2011-09-16 09:58:17', '', 'Not Logged In', 'phone'),
(376131, '9/16/2011', '10:24:44', '14:24:44', 4, 'ARMSTRONG WORLD INDUSTRIES    ', 'NEW LOG IN NEEDED', 'X', '2011-09-16 10:49:58', '', 'Not Logged In', 'phone'),
(376133, '9/16/2011', '10:44:25', '14:44:25', 2, 'GREEN MOUNTAIN COFFEE ROASTERS', '911 TRUE ALERTS', 'X', '2011-09-16 11:06:25', '', 'Not Logged In', 'phone'),
(376134, '9/16/2011', '11:08:43', '15:08:43', 2, 'ANDREWS & KURTH HOUSTON', 'Go Over rate table cost ', 'X', '2011-09-16 13:24:30', '', 'Not Logged In', 'phone'),
(376142, '9/16/2011', '13:55:02', '17:55:02', 2, 'EMERSON ELECTRIC MEXICO   ', 'CBA - Still in open queue', 'X', '2011-11-09 13:41:44', '', 'Not Logged In', 'phone'),
(376147, '9/16/2011', '17:24:14', '21:24:14', 2, 'WASHINGTON STATE UNIVERSITY   ', 'SQL Diagnosis', 'X', '2011-09-19 09:46:24', '', 'Not Logged In', 'phone'),
(376149, '9/19/2011', '07:09:53', '11:09:53', 9, 'NATIONWIDE MUTUAL INSURANCE mn', 'DB Migration Help', 'X', '2011-09-19 08:35:49', '', 'Not Logged In', 'phone'),
(376151, '9/19/2011', '07:43:34', '11:43:34', 4, 'NATIONWIDE MUTUAL INS CANTON  ', 'Help with re-set login & password', 'X', '2011-09-19 09:40:50', '', 'Not Logged In', 'phone'),
(376152, '9/19/2011', '08:03:39', '12:03:39', 4, 'TRANSITIONS OPTICAL         ', 'When running reports on our call accounting software, there is no charge being made on outbound calls', 'X', '2011-09-19 10:05:02', '', 'Not Logged In', 'phone'),
(376159, '9/19/2011', '09:14:11', '13:14:11', 2, 'CBS STUDIO CENTER  ', 'To re-schedule a couple of Daily Directory Database imports & verify their operation ', 'X', '2011-09-19 10:09:03', '', 'Not Logged In', 'phone'),
(376160, '9/19/2011', '09:24:24', '13:24:24', 9, 'ILITCH HOLDINGS/LITTLE CAESAR ', 'Down System not collected since 9/14/11', 'X', '2011-09-19 12:19:46', '', 'Not Logged In', 'phone'),
(376161, '9/19/2011', '10:00:06', '14:00:06', 2, 'JOHNSON DIVERSEY SWEDEN  ', 'NO STATS OUTBO CALLS', 'X', '2011-09-19 12:23:24', '', 'Not Logged In', 'phone'),
(376164, '9/19/2011', '10:07:05', '14:07:05', 2, 'AMERITAS LIFE INSURANCE CORP  ', 'irpMain Timeout Error', 'X', '2011-09-19 13:27:13', '', 'Not Logged In', 'phone'),
(376168, '9/19/2011', '10:34:39', '14:34:39', 9, 'SCHOLASTIC BOOK FAIR LAKE MARY', 'Call Total Differences. Critical Customer:4HR RESPONSE REQUIRED ', 'X', '2011-09-19 11:53:09', '', 'Not Logged In', 'phone'),
(376170, '9/19/2011', '10:46:16', '14:46:16', 4, 'NATIONWIDE MUTUAL INSURANCE mn', 'Site data unavailable', 'X', '2011-09-19 12:14:00', '', 'Not Logged In', 'phone'),
(376174, '9/19/2011', '13:42:59', '17:42:59', 2, 'SCHOLASTIC BOOK FAIR LAKE MARY', 'DATA FOR USER NOT ACCURATE', 'X', '2011-09-19 15:48:53', '', 'Not Logged In', 'phone'),
(376177, '9/19/2011', '13:47:58', '17:47:58', 2, 'PRESBYTERIAN INTERCOMM HOSP   ', 'Archive Data missing', 'X', '2011-09-19 14:04:26', '', 'Not Logged In', 'phone'),
(376178, '9/20/2011', '08:07:23', '12:07:23', 2, 'CHRISTOPHER RURAL HEALTH', 'Did&#39;s not polling', 'X', '2011-09-20 10:31:31', '', 'Not Logged In', 'phone'),
(376183, '9/19/2011', '15:19:40', '19:19:40', 9, 'CROWNE PLAZA RAVINIA ', 'INTERFACE NOT POSTING CHARGES', 'X', '2011-09-20 07:05:20', '', 'Not Logged In', 'phone'),
(376185, '9/19/2011', '18:22:34', '22:22:34', 2, 'WHITMAN COLLEGE TECHNOLOGY SVC', 'SP 4213', 'X', '2011-09-20 07:46:13', '', 'Not Logged In', 'phone'),
(376187, '9/19/2011', '19:02:50', '23:02:50', 2, 'CBS STUDIO CENTER', 'Complete upgrade & set up new admin account', 'X', '2011-09-27 12:15:47', '', 'Not Logged In', 'phone'),
(376188, '9/20/2011', '07:11:21', '11:11:21', 4, 'TRANSITIONS OPTICAL           ', 'How to integrate the software to our AD', 'X', '2011-09-20 09:50:57', '', 'Not Logged In', 'phone'),
(376189, '9/20/2011', '08:03:57', '12:03:57', 4, 'REID HOSPITAL   ', 'Help with clean up directory', 'X', '2011-09-20 13:58:13', '', 'Not Logged In', 'phone'),
(376191, '9/20/2011', '08:37:49', '12:37:49', 2, 'HOLIDAY INN SAN FRAN CIVIC CTR', 'CAN NOT RUN REPORTS FROM YESTERDAY', 'X', '2011-09-20 13:35:53', '', 'Not Logged In', 'phone'),
(376196, '9/20/2011', '09:42:26', '13:42:26', 9, 'CHILDRENS MEDICAL CENTER ', 'Not collecting data...reports blank', 'X', '2011-09-20 10:14:00', '', 'Not Logged In', 'phone'),
(376201, '9/20/2011', '10:07:33', '14:07:33', 4, 'DAVE & BUSTERS', 'Rate tables did not get down loaded via FTP\r\n', 'X', '2011-09-20 14:11:45', '', 'Not Logged In', 'phone'),
(376203, '9/20/2011', '10:46:53', '14:46:53', 9, 'COX HOSPITAL   ', 'D: Drive filling up', 'X', '2011-09-20 10:55:29', '', 'Not Logged In', 'phone'),
(376215, '9/20/2011', '13:00:23', '17:00:23', 9, 'EBSCO PUBLISHING    ', 'DOWN SYSTEM', 'X', '2011-09-20 13:07:33', '', 'Not Logged In', 'phone'),
(376219, '9/20/2011', '14:15:25', '18:15:25', 9, 'NORTHWEST MISSISSIPPI COM CLG ', 'Down system as of yesterday', 'X', '2011-09-20 15:04:15', '', 'Not Logged In', 'phone'),
(376222, '9/20/2011', '14:34:04', '18:34:04', 4, 'WARNER MUSIC GROUP  ', 'Rate tables did not FTP to site.', 'X', '2011-09-20 16:39:11', '', 'Not Logged In', 'phone'),
(376234, '9/21/2011', '07:03:29', '11:03:29', 4, 'BREAKERS HOTEL ', 'Help with Scheduling some reports', 'X', '2011-09-21 10:13:44', '', 'Not Logged In', 'phone'),
(376235, '9/21/2011', '07:43:59', '11:43:59', 2, 'VA MIAMI ', 'Help with loading rate table', 'X', '2011-09-21 08:44:44', '', 'Not Logged In', 'phone'),
(376236, '9/21/2011', '08:18:49', '12:18:49', 2, 'RADFORD UNIVERSITY  ', 'ADD USERS', 'X', '2011-09-21 08:38:07', '', 'Not Logged In', 'phone'),
(376237, '9/21/2011', '09:04:02', '13:04:02', 4, 'EATON VANCE MANAGEMENT', 'Help with running reports for end to end calls', 'X', '2011-09-21 12:56:28', '', 'Not Logged In', 'phone'),
(376240, '9/22/2011', '06:53:50', '10:53:50', 2, 'ALL CHILDRENS HOSPITAL   ', 'SP 4213 & Training', 'X', '2011-09-27 12:12:37', '', 'Not Logged In', 'phone'),
