-- phpMyAdmin SQL Dump
-- version 3.3.9
-- http://www.phpmyadmin.net
--
-- Host: localhost
-- Generation Time: Mar 01, 2012 at 01:40 PM
-- Server version: 5.5.8
-- PHP Version: 5.3.5

SET SQL_MODE="NO_AUTO_VALUE_ON_ZERO";


/*!40101 SET @OLD_CHARACTER_SET_CLIENT=@@CHARACTER_SET_CLIENT */;
/*!40101 SET @OLD_CHARACTER_SET_RESULTS=@@CHARACTER_SET_RESULTS */;
/*!40101 SET @OLD_COLLATION_CONNECTION=@@COLLATION_CONNECTION */;
/*!40101 SET NAMES utf8 */;

--
-- Database: `dbase`
--

-- --------------------------------------------------------

--
-- Table structure for table `tickets`
--

CREATE TABLE IF NOT EXISTS `tickets` (
  `Ticket` int(7) NOT NULL,
  `Date` text NOT NULL,
  `STime` time NOT NULL,
  `ETA` time NOT NULL,
  `Priority` smallint(2) NOT NULL,
  `Site` text NOT NULL,
  `Comments` longtext,
  `Deleted` text,
  `Removed_Datetime` text NOT NULL,
  `removedby` text NOT NULL,
  PRIMARY KEY (`Ticket`)
) ENGINE=InnoDB DEFAULT CHARSET=latin1;

--
-- Dumping data for table `tickets`
--

INSERT INTO `tickets` (`Ticket`, `Date`, `STime`, `ETA`, `Priority`, `Site`, `Comments`, `Deleted`, `Removed_Datetime`, `removedby`) VALUES
(123, '1/9/2012', '10:18:20', '12:18:20', 2, 'Dennis Test', 'Dennis Test 1-9-12', 'X', '2012-01-09 10:20:24', ''),
(37892, '12/6/2011', '14:39:27', '16:39:27', 2, 'STATE OF MISSOURI   ', 'I&#39;m trying to generate a report in ISI to see the calls in a half-hour interval for the last 3 months. There are about 20 numbers that they want to look at. I found the report and tried to run it, but I keep getting the Timeout expired message even trying to run it for a day. I&#39;m going into the Control Center on the server to run the reports and trying both the Preview and Run Now buttons', 'X', '2011-12-06 14:42:48', ''),
(37932, '12/27/2011', '14:51:30', '16:51:30', 4, 'Site Name', '', 'X', '2011-12-27 14:51:58', ''),
(123456, '12/27/2011', '16:05:34', '18:05:34', 2, 'Test', 'Test Ticket', 'X', '2011-12-27 16:05:39', ''),
(199999, '12/28/2011', '07:08:58', '09:08:58', 2, 'TEST TICKET', 'Test ticket', 'X', '2011-12-28 08:38:14', ''),
(222222, '2/22/2012', '09:39:54', '11:39:54', 2, 'jimtest', 'test 2', 'X', '2012-02-22 11:04:56', 'jim'),
(317317, '11/22/2011', '11:28:01', '13:28:01', 4, 'OMNICARE', 'HAS TEN THOUSAND ACTIVE SYSTEM...THE UNASSIGNED IS FILLING SYSTEM UP...WHATS TO KNOW HOW TO STOP THIS...INCREASE LICSENS', 'X', '2011-11-22 13:35:44', ''),
(333333, '2/21/2012', '17:38:40', '19:38:40', 2, 'Jims Test Ticket', 'Testing Username removal', 'X', '2012-02-22 11:05:10', 'Not Logged In'),
(367852, '10/14/2011', '15:02:46', '17:02:46', 4, 'TENNECO AUTOMOTIVE  ', 'Buffer box swap out', 'X', '2011-10-14 15:44:28', ''),
(370340, '9/23/2011', '10:40:50', '12:40:50', 4, 'TCF BANK MINNEAPOLIS ', 'ISSUES RUNNING REPORT VIA DASHBOARD', 'X', '2011-09-23 11:13:52', ''),
(370775, '2/6/2012', '13:40:05', '15:40:05', 9, 'OUR LADY OF LOURDES REGIONAL', 'The SQL server log file has reached 92 GB. I need to purge the log file and keep it from growing this large in the future. Currently there is only 2GB free on that server. ', 'X', '2012-02-06 14:46:14', ''),
(371683, '8/19/2011', '17:19:53', '19:19:53', 4, 'COLQUITT REGIONAL MEDICAL CTR', 'CBA - Still in open queue', 'X', '2011-11-07 08:13:41', ''),
(372171, '7/18/2011', '10:29:05', '12:29:05', 2, 'CHAFFEY COLLEGE   ', 'R/A FROM PBM', 'X', '2011-07-25 17:49:31', ''),
(372228, '11/17/2011', '10:37:42', '12:37:42', 2, 'TEACHERS CREDIT UNION    ', 'CPU SPIKING', 'X', '2011-11-17 11:06:01', ''),
(372452, '7/12/2011', '08:27:11', '10:27:11', 4, 'CHILDRENS MEDICAL CENTER  ', '', 'X', ' ', ''),
(373116, '7/26/2011', '10:19:12', '12:19:12', 4, 'DAYTON FREIGHT ', 'CCB - Open Report Issues', 'X', '2011-08-18 14:48:22', ''),
(373302, '7/25/2011', '16:19:29', '18:19:29', 2, 'PLAINS CAPITAL', 'SP4041', 'X', '2011-07-26 15:51:28', ''),
(373511, '8/23/2011', '10:31:50', '12:31:50', 4, 'UNIVERSAL WEATHER & AVIATION', 'Re-set Password for attendant console.', 'X', '2011-08-23 10:43:03', ''),
(373593, '8/26/2011', '14:34:04', '16:34:04', 4, 'CAPITAL GROUP  ', 'Licenses Full', 'X', '2011-08-29 09:33:07', ''),
(373656, '7/6/2011', '14:30:16', '16:30:16', 2, 'MN NATIONAL GUARD SAINT PAUL ', 'RateTable not getting downloaded.', 'X', ' ', ''),
(373986, '7/6/2011', '09:32:03', '11:32:03', 9, 'JOHNSON DIVERSEY     ', 'System not processing any data', 'X', ' ', ''),
(373988, '8/4/2011', '09:46:11', '11:46:11', 2, 'CROASDAILE VILLAGE ', 'Remote Training', 'X', '2011-08-04 12:14:05', ''),
(373996, '7/18/2011', '07:47:22', '09:47:22', 2, 'MEDIAWHIZ   ', 'Call Manager Upgrade from 4.2 to 8.5 Select ver 8.1.3692 DB 3784', 'X', '2011-08-03 15:54:52', ''),
(374001, '7/8/2011', '11:52:45', '13:52:45', 2, 'CAPITAL GROUP ', 'SP4041', 'X', '2011-09-16 16:58:14', ''),
(374005, '7/11/2011', '15:08:14', '17:08:14', 4, 'LIZ CLAIBORNE N BERGEN     ', 'CCM Upgrade from 4.1.3 TO 7.1.3', 'X', ' ', ''),
(374007, '6/28/2011', '15:59:14', '17:59:14', 9, 'CDR MANAGED SERVICES', 'SERVER 2', 'X', ' ', ''),
(374012, '7/12/2011', '11:39:06', '13:39:06', 4, 'COUNTY OF FRESNO', 'Cell phone bill import', 'X', ' ', ''),
(374015, '8/8/2011', '15:14:13', '17:14:13', 2, 'ROTHSTEIN, KASS & COMPANY   ', 'Missing Tariff Update', 'X', '2011-08-08 15:30:39', ''),
(374023, '6/30/2011', '07:51:21', '09:51:21', 4, 'HMA-WUESTHOFF ROCKLEDGE MED CT', 'IP ADDRESS CHANGE', 'X', ' ', ''),
(374028, '6/30/2011', '07:51:56', '09:51:56', 2, 'WORK FORCE OF CENTRAL FLORIDA ', 'Abandoned Calls Report', 'X', ' ', ''),
(374034, '6/30/2011', '07:52:18', '09:52:18', 4, 'MCKINSEY & COMPANY', 'Tandem Call Matching', 'X', ' ', ''),
(374039, '6/30/2011', '10:44:52', '12:44:52', 4, 'B A E SYSTEMS', 'LD Calls showing as Local Calls\r\n', 'X', ' ', ''),
(374048, '7/25/2011', '10:12:52', '12:12:52', 4, 'PLAINS CAPITAL CORPORATION', 'sp 4041 Upgrade', 'X', ' ', ''),
(374049, '7/1/2011', '12:45:47', '14:45:47', 4, 'BOAT US ALEXANDRIA', '', 'X', ' ', ''),
(374055, '7/1/2011', '11:40:10', '13:40:10', 4, 'Badger State Univ', 'Reporting Questions', 'X', ' ', ''),
(374088, '7/1/2011', '13:05:06', '15:05:06', 4, 'CHAROLETTE COUNTY IT', '', 'X', ' ', ''),
(374114, '7/5/2011', '07:00:01', '09:00:01', 2, 'SALT LAKE COMMUNITY COLLEGES  ', 'Assist with setting up new user', 'X', ' ', ''),
(374115, '7/5/2011', '07:25:57', '09:25:57', 4, 'RUTGERS UNIVERSITY  ', 'Not able to access report portal', 'X', ' ', ''),
(374121, '7/5/2011', '09:44:31', '11:44:31', 4, 'AAA EAST CENTRAL     ', 'Not Collecting', 'X', ' ', ''),
(374123, '7/5/2011', '09:58:29', '11:58:29', 4, 'COMMSCOPE, INC. ', 'Activate site\r\n', 'X', ' ', ''),
(374124, '7/5/2011', '10:04:33', '12:04:33', 2, 'MORAINE VALLEY COMM COLLEGE   ', 'Down System', 'X', ' ', ''),
(374125, '7/5/2011', '10:27:11', '12:27:11', 2, 'AMERITAS LIFE INSURANCE CORP  ', 'Autoreport trouble.', 'X', ' ', ''),
(374128, '7/7/2011', '07:48:38', '09:48:38', 4, 'MEMORIAL HOSPITAL & HEALTH SYS', 'R/A FROM DES', 'X', ' ', ''),
(374130, '7/5/2011', '11:18:12', '13:18:12', 4, 'TAHITI VILLAGE VACATION   ', '', 'X', ' ', ''),
(374133, '7/5/2011', '12:12:59', '14:12:59', 4, 'CA NATIONAL GUARD SACRAMENTO  ', 'Auth Codes', 'X', ' ', ''),
(374136, '7/5/2011', '13:20:47', '15:20:47', 9, 'PALOS COMMUNITY HOSPITAL    ', 'DOWN SYSTEM', 'X', ' ', ''),
(374139, '7/5/2011', '14:10:27', '16:10:27', 4, 'ST BARNABAS SBO     ', '', 'X', ' ', ''),
(374145, '7/5/2011', '16:38:15', '18:38:15', 9, 'EXPRESS, LLC   ', 'HDD FULL', 'X', ' ', ''),
(374146, '7/5/2011', '17:03:11', '19:03:11', 2, 'ALEXIAN BROTHERS MED CTR BIEST', 'Post-install Web errors', 'X', ' ', ''),
(374147, '7/5/2011', '17:53:06', '19:53:06', 9, 'GILEAD SCIENCES INC   ', 'Logs not collecting.', 'X', ' ', ''),
(374149, '7/6/2011', '08:37:34', '10:37:34', 9, 'ARMSTRONG WORLD INDUSTRIES ', 'Down System ', 'X', ' ', ''),
(374150, '7/6/2011', '08:57:56', '10:57:56', 9, 'NORTHWEST MISSISSIPPI COM CLG ', 'System not processing since 6/25/11...getting errors in isvprocess', 'X', ' ', ''),
(374153, '7/6/2011', '09:55:40', '11:55:40', 4, 'COVANTAGE CREDIT UNION    ', 'no cdr alarms incorrect', 'X', ' ', ''),
(374155, '7/6/2011', '10:37:38', '12:37:38', 2, 'SHERMAN HOSPITAL', 'AUTOREPORT SETTINGS', 'X', ' ', ''),
(374157, '7/6/2011', '11:38:56', '13:38:56', 2, 'EISENHOWER MEDICAL CENTER     ', 'UNDEFINED GATEWAYS', 'X', ' ', ''),
(374158, '7/6/2011', '17:40:18', '19:40:18', 2, 'EISENHOWER MEDICAL CENTER   ', 'R/A FROM DES', 'X', ' ', ''),
(374159, '7/6/2011', '11:57:25', '13:57:25', 2, 'TEACHERS CREDIT UNION ', 'Autoreports & Directory Management', 'X', ' ', ''),
(374161, '7/6/2011', '12:53:40', '14:53:40', 9, 'PRESBYTERIAN INTERCOMM HOSP   ', 'DOWN SYSTEM', 'X', ' ', ''),
(374164, '7/6/2011', '13:42:39', '15:42:39', 2, 'WORK FORCE OF CENTRAL FLORIDA ', 'Call Transfer Report help', 'X', ' ', ''),
(374166, '7/6/2011', '14:38:32', '16:38:32', 4, 'TOWN OF NORTH HEMPSTEAD TOWN H', 'Add user so they can run reports of the from the web', 'X', ' ', ''),
(374168, '7/6/2011', '15:39:14', '17:39:14', 4, 'WASHINGTON STATE UNIVERSITY   ', 'Assist with runnig report for one time charge', 'X', ' ', ''),
(374171, '7/6/2011', '16:01:38', '18:01:38', 2, 'CABELAS              ', 'Call Forwarding Issues', 'X', ' ', ''),
(374175, '7/7/2011', '07:19:35', '09:19:35', 9, 'OUR LADY OF BELLEFONTE HOSP', 'MISSING DATA', 'X', ' ', ''),
(374177, '7/7/2011', '10:07:04', '12:07:04', 9, 'COLORADO COMMUNITY COLLEGE ', 'DOWN SYSTEM', 'X', ' ', ''),
(374184, '7/7/2011', '12:50:35', '14:50:35', 9, 'CITY OF ANDERSON', 'DOWN SYSTEM', 'X', ' ', ''),
(374186, '7/7/2011', '13:18:00', '15:18:00', 2, 'FORT SAM HOUSTON ISD  ', 'AUTH CODES ', 'X', ' ', ''),
(374188, '7/7/2011', '14:16:23', '16:16:23', 2, 'OHIO STATE LOTTERY      ', 'Autoreport Emailing assistance', 'X', ' ', ''),
(374191, '7/7/2011', '15:34:10', '17:34:10', 4, 'Childrens National ', 'Rate table expired error', 'X', ' ', ''),
(374195, '7/11/2011', '15:25:27', '17:25:27', 9, 'STATE OF MD-BOWIE #1 ADMIN    ', 'Down System', 'X', ' ', ''),
(374196, '7/8/2011', '08:45:44', '10:45:44', 4, 'WYNDHAM VACATION OWNERSHIP    ', '', 'X', ' ', ''),
(374207, '7/8/2011', '10:01:02', '12:01:02', 2, 'MIDLAND COUNTY  ', '', 'X', ' ', ''),
(374209, '7/8/2011', '11:13:31', '13:13:31', 2, 'COLLIN COUNTY COMMUNITY COLLEG', 'CTI Route point issue', 'X', ' ', ''),
(374215, '7/8/2011', '13:58:57', '15:58:57', 2, 'LIFE ALERT EMERGENCY RESPONSE ', 'HUNT GROUPS', 'X', ' ', ''),
(374222, '7/8/2011', '15:25:51', '17:25:51', 2, 'UCAR NCAR   ', 'Rate table questions', 'X', ' ', ''),
(374230, '7/11/2011', '08:50:50', '10:50:50', 2, 'AMERICREDIT    ', 'SFTP Questions', 'X', ' ', ''),
(374233, '7/11/2011', '09:02:11', '11:02:11', 4, 'CALAMOS INVESTMENTS ', 'DATASOURCE CONFIG', 'X', ' ', ''),
(374237, '7/11/2011', '09:58:39', '11:58:39', 2, 'HUBBELL POWER SYSTEMS      ', 'SMTP & Email changes', 'X', ' ', ''),
(374238, '7/11/2011', '10:08:39', '12:08:39', 4, 'WESTINGHOUSE CRANBERRY TWP  ', '', 'X', ' ', ''),
(374240, '7/11/2011', '10:50:18', '12:50:18', 9, 'ANDREWS & KURTH HOUSTON    ', 'All Remote collections Failing', 'X', ' ', ''),
(374242, '7/11/2011', '11:14:09', '13:14:09', 2, 'CITY OF PEORIA  ', '911 ALARMS', 'X', ' ', ''),
(374245, '7/11/2011', '13:03:57', '15:03:57', 4, 'TECK RESOURCES LIMITED   ', 'Costing all off', 'X', ' ', ''),
(374247, '7/11/2011', '18:50:28', '20:50:28', 4, 'IDAHO STATE POLICE  ', 'Error in logs', 'X', ' ', ''),
(374249, '7/12/2011', '06:54:24', '08:54:24', 9, 'Johnson Diversey', 'Unable to process reports for all sites', 'X', ' ', ''),
(374254, '7/12/2011', '09:35:47', '11:35:47', 4, 'AVX CORPORATION', '', 'X', ' ', ''),
(374259, '7/12/2011', '10:02:28', '12:02:28', 4, 'RAPPAHANNOCK ELECTRIC COOP    ', '', 'X', ' ', ''),
(374260, '7/12/2011', '10:12:15', '12:12:15', 2, 'TSA INFRASTRUCTURE ', 'Assistance with RT update', 'X', ' ', ''),
(374262, '7/12/2011', '10:56:00', '12:56:00', 4, 'BOY SCOUTS OF AMERICA   ', 'Att Importr issues', 'X', ' ', ''),
(374263, '7/12/2011', '11:02:25', '13:02:25', 2, 'CULTURAL MISSION OF THE ROYAL ', 'System crashes several times', 'X', ' ', ''),
(374264, '7/12/2011', '11:21:02', '13:21:02', 4, 'BENTLEY COLLEGE    ', 'Cant Login', 'X', ' ', ''),
(374266, '7/12/2011', '12:09:18', '14:09:18', 2, 'PUTNAM INVESTMENTS  ', '', 'X', ' ', ''),
(374275, '7/13/2011', '07:20:05', '09:20:05', 4, 'VISA - FOSTER CITY  (main)    ', 'Active Stations Count', 'X', ' ', ''),
(374277, '7/13/2011', '08:23:15', '10:23:15', 4, 'Boat US', 'Trunk Analysis Report questions', 'X', ' ', ''),
(374286, '7/13/2011', '11:35:59', '13:35:59', 4, 'METROPOLITAN WATER DIST. HQ   ', 'FAILED EXPORT', 'X', ' ', ''),
(374287, '7/13/2011', '12:03:01', '14:03:01', 9, 'KETTERING MEDICAL CENTER  ', 'DOWN SYSTEM', 'X', ' ', ''),
(374288, '7/13/2011', '12:12:30', '14:12:30', 2, 'CAPITAL GROUP    ', 'Directory assistance.', 'X', ' ', ''),
(374289, '7/13/2011', '12:25:22', '14:25:22', 9, 'MAMMOTH MOUNTAIN SKI RESORT ', 'MISSING INB CDR', 'X', ' ', ''),
(374290, '7/13/2011', '12:59:02', '14:59:02', 2, 'TOWN OF NORTH HEMPSTEAD TOWN H', 'Explain why they need rate tables', 'X', ' ', ''),
(374292, '7/13/2011', '13:06:52', '15:06:52', 2, 'STATE OF OR  ', 'Processing 100K calls', 'X', ' ', ''),
(374295, '7/13/2011', '13:16:09', '15:16:09', 4, 'HILTON GRAND VACATION CO', 'wants to be able to Collect zero Duration caalls', 'X', ' ', ''),
(374297, '7/14/2011', '07:51:07', '09:51:07', 4, 'RUTGERS UNIVERSITY        ', 'Costing incorrectly for a internal call', 'X', ' ', ''),
(374298, '7/14/2011', '09:31:29', '11:31:29', 2, 'ESSEX COUNTY CORRECTIONAL  ', '', 'X', ' ', ''),
(374310, '7/14/2011', '10:57:57', '12:57:57', 4, 'RE SOURCES USA', 'Help with Report', 'X', ' ', ''),
(374312, '7/14/2011', '11:56:05', '13:56:05', 2, 'STATE OF ARIZONA - ADOA      ', 'CALL COSTING', 'X', ' ', ''),
(374314, '7/14/2011', '12:31:32', '14:31:32', 2, 'UNION LEAGUE CLUB OF CHICAGO  ', 'Summary Report Help', 'X', ' ', ''),
(374317, '7/14/2011', '14:37:26', '16:37:26', 2, 'HAWAII NATIONAL BANK    ', 'TIME DIFFERENCE', 'X', ' ', ''),
(374320, '7/14/2011', '16:35:16', '18:35:16', 2, 'UNIVERSITY OF ARKANSAS FT SMIT', 'DIRECTORY FULL', 'X', ' ', ''),
(374322, '7/14/2011', '16:59:49', '18:59:49', 9, 'US DEPARTMENT OF JUSTICE ', 'DOWN SYSTEM', 'X', ' ', ''),
(374324, '7/14/2011', '17:27:48', '19:27:48', 2, 'EISENHOWER MEDICAL CENTER    ', 'Phone Number Search', 'X', ' ', ''),
(374328, '7/15/2011', '07:52:15', '09:52:15', 2, 'Roswell Park', 'Web Reports menu blank', 'X', ' ', ''),
(374329, '7/15/2011', '08:27:21', '10:27:21', 2, 'STREET.COM, INC (THE)', 'Report error', 'X', ' ', ''),
(374332, '7/15/2011', '12:21:34', '14:21:34', 2, 'EISENHOWER MEDICAL CENTER ', 'Web user access, need to get his working', 'X', ' ', ''),
(374333, '7/15/2011', '12:20:29', '14:20:29', 9, 'EDISON STATE COLLEGE', 'Down', 'X', ' ', ''),
(374335, '7/18/2011', '06:38:32', '08:38:32', 9, 'LEE MEMORIAL HEALTH SYSTEM    ', 'Control Center not updating', 'X', ' ', ''),
(374338, '7/18/2011', '09:21:26', '11:21:26', 2, 'HILLSBOROUGH COUNTY 13TH', 'PASSWORD TROUBLE', 'X', ' ', ''),
(374340, '7/18/2011', '10:00:06', '12:00:06', 4, 'AMERICREDIT   ', 'Web Authentication issues', 'X', ' ', ''),
(374342, '7/18/2011', '10:12:26', '12:12:26', 2, 'WESTINGHOUSE CRANBERRY TWP', 'EXPLAIN RAW CDR ', 'X', ' ', ''),
(374343, '7/18/2011', '10:22:02', '12:22:02', 4, 'EISENHOWER MEDICAL CENTER     ', 'Help with report', 'X', ' ', ''),
(374346, '7/18/2011', '12:55:46', '14:55:46', 2, 'CITY OF DENTON TECHNOLOGY SVCS', 'Service dead after every saturday at midnight durring windows updates', 'X', ' ', ''),
(374353, '7/18/2011', '16:00:54', '18:00:54', 9, 'CROWNE PLAZA HOUSTON WEST  ', 'PMS ISSUES', 'X', ' ', ''),
(374356, '7/19/2011', '07:42:03', '09:42:03', 2, 'CANCER TREATMENT CTR OF AMERIC', 'Missing data on report', 'X', ' ', ''),
(374358, '7/19/2011', '08:00:47', '10:00:47', 9, 'AMERICREDIT   ', 'Error collecting AVAYA RSP data', 'X', ' ', ''),
(374359, '7/19/2011', '09:55:57', '11:55:57', 9, 'CENTRE COLLEGE DANVILLE KY   ', 'Not collecting due to change in Routers', 'X', ' ', ''),
(374361, '7/19/2011', '08:43:43', '10:43:43', 4, 'WEST TEXAS A&M UNIVERSITY    ', 'Assist with report', 'X', ' ', ''),
(374365, '7/19/2011', '11:06:18', '13:06:18', 2, 'WOODHULL MEDICAL CENTER ', 'Phone number search.', 'X', ' ', ''),
(374366, '7/19/2011', '11:42:09', '13:42:09', 4, 'LENDER PROCESSING SERVICES', 'Error with login ', 'X', ' ', ''),
(374367, '7/19/2011', '12:03:59', '14:03:59', 4, 'HEALTHCARE PARTNERS  ', 'Datasource trouble', 'X', ' ', ''),
(374368, '7/19/2011', '13:23:41', '15:23:41', 2, 'SHATTUCK PLAZA HOTEL  ', 'NO CDR alarm issues', 'X', ' ', ''),
(374371, '7/19/2011', '15:49:41', '17:49:41', 2, 'SECURIAN FINANCIAL GROUP   ', 'Upgrade questions - NO NOTES IN TICKET.', 'X', ' ', ''),
(374372, '7/19/2011', '18:59:33', '20:59:33', 2, 'EISENHOWER MEDICAL CENTER', 'Company Logo Display', 'X', ' ', ''),
(374375, '7/20/2011', '08:40:18', '10:40:18', 4, 'RUTGERS UNIVERSITY ', 'Rollover ext help', 'X', ' ', ''),
(374384, '7/20/2011', '10:50:28', '12:50:28', 4, 'EDISON STATE COLLEGE', 'Help with reports rotating on a select group of records', 'X', ' ', ''),
(374387, '8/9/2011', '10:37:23', '12:37:23', 2, 'UNION SQUARE EYE CARE INC.    ', '1hr Training left', 'X', '2011-10-17 15:18:20', ''),
(374390, '7/20/2011', '13:42:34', '15:42:34', 9, 'LENDER PROCESSING SERVICES', 'No Data on Reports', 'X', ' ', ''),
(374392, '7/21/2011', '10:29:01', '12:29:01', 9, 'OUR LADY OF BELLEFONTE HOSP', 'RE-INSTALLATION OF SELECT 8.0', 'X', ' ', ''),
(374397, '7/20/2011', '14:44:44', '16:44:44', 2, 'GENOPTIX    ', 'Delete unassigned ext', 'X', ' ', ''),
(374401, '7/20/2011', '15:13:56', '17:13:56', 2, 'GENUINE PARTS COMPANY', 'Explain Call Transfer Reports', 'X', ' ', ''),
(374402, '7/29/2011', '15:31:43', '17:31:43', 2, 'SECURIAN FINANCIAL GROUP      ', 'SP4041', 'X', '2011-07-29 15:59:45', ''),
(374405, '7/20/2011', '16:23:46', '18:23:46', 2, 'MEDICAL COLLEGE OF WI     ', 'Call Costing Questions', 'X', ' ', ''),
(374408, '7/21/2011', '08:16:43', '10:16:43', 2, 'TALMER BANK AND TRUST   ', 'Needs assistance with reports on her call trees', 'X', ' ', ''),
(374413, '7/21/2011', '10:00:07', '12:00:07', 2, 'CLASSIFIED VENTURES       ', '0 CALL SUMMARY', 'X', ' ', ''),
(374701, '7/21/2011', '10:32:01', '12:32:01', 2, 'MEDICAL COLLEGE OF WI ', 'Assistance Moving Gateways', 'X', ' ', ''),
(374702, '7/21/2011', '11:56:10', '13:56:10', 9, 'SPECTRUM HEALTH - GRAND RAPIDS', 'DOWN SYSTEM', 'X', ' ', ''),
(374704, '7/21/2011', '12:47:19', '14:47:19', 2, 'AMERITAS LIFE INSURANCE CORP  ', 'Rate Table Error Message', 'X', ' ', ''),
(374706, '7/21/2011', '12:58:48', '14:58:48', 9, 'SONY COMPUTER ENTERTAINMENT', 'Foster City (DS1) no calls since June', 'X', ' ', ''),
(374707, '7/21/2011', '12:59:31', '14:59:31', 4, 'CAREERBUILDER    ', 'Reporting Statistics.', 'X', ' ', ''),
(374709, '7/21/2011', '14:09:23', '16:09:23', 4, 'CITY OF TYLER ', 'DIAGNOSE ISSUES', 'X', ' ', ''),
(374714, '7/21/2011', '16:12:54', '18:12:54', 2, 'WEST TEXAS A&M UNIVERSITY ', 'Report Walkthrough', 'X', ' ', ''),
(374716, '7/21/2011', '17:59:19', '19:59:19', 4, 'CLASSIFIED VENTURES', 'Directory Objects', 'X', '2011-07-26 15:51:49', ''),
(374717, '7/22/2011', '09:16:09', '11:16:09', 9, 'POMONA SCHOOL ED CENTER ', 'System has been down since hte 14th ', 'X', ' ', ''),
(374725, '7/22/2011', '12:18:05', '14:18:05', 2, 'CHRISTIAN BROADCASTING NETWORK', 'Tennessee Call Costing', 'X', ' ', ''),
(374726, '7/25/2011', '16:20:40', '18:20:40', 9, 'AR NATIONAL GUARD', 'DOWN SYSTEM', 'X', '2011-07-26 08:34:04', ''),
(374732, '7/25/2011', '07:15:18', '09:15:18', 4, 'GENUINE PARTS COMPANY   ', '****Trial Order*** Costing Issue', 'X', ' ', ''),
(374739, '7/25/2011', '08:48:15', '10:48:15', 2, 'JP MORGAN CHASE', 'Maumbi Cisco site not recording all calls on old system', 'X', '2011-07-26 08:34:54', ''),
(374740, '7/25/2011', '09:09:58', '11:09:58', 9, 'JOHNSON DIVERSEY  ', 'No Cdr on Reports', 'X', '2011-07-25 16:21:09', ''),
(374743, '7/27/2011', '15:16:10', '17:16:10', 4, 'LOCK HAVEN UNIVERISITY    ', 'Re-install Select 8.1', 'X', '2011-07-29 16:05:37', ''),
(374746, '7/25/2011', '10:28:37', '12:28:37', 4, 'PUBLIX CREDIT UNION    ', 'Alerts not working', 'X', '2011-07-25 16:21:14', ''),
(374748, '7/25/2011', '10:35:18', '12:35:18', 4, 'TCF BANK LISLE IL (main svr)  ', 'Scheduled report missing all but 1 ext ', 'X', '2011-07-26 13:45:50', ''),
(374749, '7/25/2011', '10:42:11', '12:42:11', 2, 'PHILADELPHIA INSURANCE CO.', 'Summary Gate problems', 'X', '2011-07-26 15:52:09', ''),
(374750, '7/25/2011', '10:54:00', '12:54:00', 4, 'BOAT US ALEXANDRIA  ', 'Looking to track a number', 'X', '2011-07-27 07:41:46', ''),
(374751, '7/25/2011', '11:33:38', '13:33:38', 9, 'COUNTY OF TULARE ', 'DOWN SYSTEM', 'X', '2011-07-25 16:22:20', ''),
(374752, '7/25/2011', '11:37:51', '13:37:51', 2, 'CATERPILLAR FINANCIAL SERVICES', 'Reports for new extensions are blank', 'X', '2011-07-27 07:44:21', ''),
(374754, '7/25/2011', '13:39:36', '15:39:36', 2, 'ASSOCIATED BANC CORP ', 'Wed CaCenter Dir DB error when adding a location', 'X', '2011-07-27 13:17:47', ''),
(374755, '7/25/2011', '14:09:49', '16:09:49', 9, 'WESTINGHOUSE CRANBERRY TWP', 'One time charges not correct.  Darlene called back on this', 'X', '2011-07-25 16:21:26', ''),
(374757, '7/25/2011', '16:39:13', '18:39:13', 9, 'CITY OF WEST HOLLYWOOD  ', 'DOWN SYSTEM', 'X', '2011-07-25 17:14:36', ''),
(374758, '7/25/2011', '17:07:10', '19:07:10', 2, 'EYE CLINIC OF WISCONSIN', 'Directory Management', 'X', '2011-07-26 14:24:44', ''),
(374760, '7/26/2011', '07:44:26', '09:44:26', 4, 'GENUINE PARTS COMPANY ', 'unable to purge some directory objects', 'X', '2011-07-26 11:02:43', ''),
(374766, '7/26/2011', '09:05:42', '11:05:42', 9, 'CHICAGO BOARD OPTIONS EXCHANGE', 'No data collected for today', 'X', '2011-07-26 11:27:24', ''),
(374768, '7/26/2011', '09:12:13', '11:12:13', 2, 'KINGS COUNTY HOSPITAL', 'Moving VM Question', 'X', '2011-07-26 15:57:18', ''),
(374771, '7/26/2011', '09:51:43', '11:51:43', 4, 'DIRECT EDGE ', 'Help with configuring reports', 'X', '2011-07-27 09:56:53', ''),
(374772, '7/26/2011', '10:09:51', '12:09:51', 2, 'RUTGERS UNIVERSITY   ', 'Web Server event viewer error', 'X', '2011-07-27 13:33:07', ''),
(374775, '7/26/2011', '10:37:21', '12:37:21', 2, 'ING WHOLESALE BANKING ', 'Extension Auto-add not updating', 'X', '2011-07-27 13:51:17', ''),
(374776, '7/26/2011', '11:14:19', '13:14:19', 2, 'TENNECO AUTOMOTIVE  ', 'BBOX reconfigure', 'X', '2011-07-27 13:56:22', ''),
(374782, '8/1/2011', '10:22:42', '12:22:42', 2, 'ALTRU HEALTH SYSTEM ', 'Missing Backups since 7/13', 'X', '2011-08-01 15:54:04', ''),
(374786, '7/27/2011', '08:15:28', '10:15:28', 2, 'Geico', 'Duplicate Exts in Dir DB', 'X', '2011-07-27 13:51:54', ''),
(374787, '7/27/2011', '08:36:07', '10:36:07', 2, 'COUNTY OF GALVESTON  ', 'Trouble adding username', 'X', '2011-07-27 14:12:42', ''),
(374788, '7/27/2011', '09:47:08', '11:47:08', 2, 'Corinthian Colleges', 'Since SP 4041 installed the CaCenter Run Now button is missing on reports', 'X', '2011-07-27 11:06:28', ''),
(374789, '8/10/2011', '11:24:36', '13:24:36', 4, 'KS NATIONAL GUARD TOPEKA', 'Domain name changed on VM', 'X', '2011-08-11 14:35:52', ''),
(374791, '7/27/2011', '09:45:55', '11:45:55', 9, 'WOODHULL MEDICAL CENTER  ', 'Cannot connect to the DB', 'X', '2011-07-27 10:22:32', ''),
(374792, '8/18/2011', '09:25:48', '11:25:48', 4, 'TRANSCORR LLC ', 'Software Server Move', 'X', '2011-08-18 11:13:43', ''),
(374793, '7/27/2011', '09:59:33', '11:59:33', 2, 'NATIONAL FUTURES ASSOC', 'Information Only', 'X', '2011-07-27 14:24:46', ''),
(374795, '7/29/2011', '15:24:38', '17:24:38', 9, 'CROWNE PLAZA CABANA PALO ALTO ', 'DOWN SYSTEM', 'X', '2011-07-29 15:53:37', ''),
(374797, '7/27/2011', '10:29:21', '12:29:21', 9, 'SIERRA PACIFIC POWER main site', 'DOWN SYSTEM', 'X', '2011-07-27 11:52:51', ''),
(374802, '7/28/2011', '07:24:07', '09:24:07', 2, 'CITY OF ANDERSON  ', 'Cisco Dir import errors, not updating', 'X', '2011-08-02 10:41:18', ''),
(374803, '7/28/2011', '08:08:48', '10:08:48', 9, 'PUTNAM INVESTMENTS ', 'Down, No CDR ALarms', 'X', '2011-07-28 08:42:23', ''),
(374804, '7/28/2011', '08:41:35', '10:41:35', 2, 'The Street', 'Time zones wrong on some reports', 'X', '2011-07-29 14:05:09', ''),
(374805, '7/28/2011', '09:12:10', '11:12:10', 9, 'PALOS COMMUNITY HOSPITAL', 'No CDR Alarm for DS2', 'X', '2011-07-28 12:59:47', ''),
(374809, '7/28/2011', '10:01:18', '12:01:18', 2, 'EISENHOWER MEDICAL CENTER ', 'IsvExports will not start', 'X', '2011-07-28 14:30:32', ''),
(374812, '7/28/2011', '17:02:55', '19:02:55', 2, 'SMITH SENIOR LIVING ', 'Install Select 8.1', 'X', '2011-08-03 13:02:42', ''),
(374813, '7/28/2011', '12:09:48', '14:09:48', 2, 'CATERPILLAR FINANCIAL SERVICES', 'Digit Filtering', 'X', '2011-07-29 08:29:58', ''),
(374815, '7/28/2011', '13:30:38', '15:30:38', 9, 'HMA WUESTHOFF ROCKLEDGE MED CT', 'All 3 DSs getting No CDR Alarms', 'X', '2011-07-29 07:53:22', ''),
(374816, '7/28/2011', '13:23:46', '15:23:46', 9, 'MO ARMY NATIONAL GUARD MAIN ', 'Kansas City only recording internal calls after new PRI installed', 'X', '2011-07-28 14:07:49', ''),
(374817, '7/28/2011', '14:00:47', '16:00:47', 2, 'WESTINGHOUSE CRANBERRY TWP', 'Dashboard Dir filter tree view not working', 'X', '2011-07-29 14:29:34', ''),
(374823, '7/28/2011', '16:16:38', '18:16:38', 4, 'DRIVETIME   ', 'Calls being filtered', 'X', '2011-07-29 11:46:51', ''),
(374824, '7/28/2011', '16:40:03', '18:40:03', 2, 'LATHAM & WATKINS-LOS ANGELES C', 'Report Viewing User Settings', 'X', '2011-08-01 16:07:15', ''),
(374825, '7/29/2011', '07:08:39', '09:08:39', 2, 'SHERMAN HOSPITAL', 'Forgot PW,need to run repts', 'X', '2011-07-29 07:25:29', ''),
(374826, '7/29/2011', '08:56:43', '10:56:43', 9, 'FLORIDA COMMUNITY COLLEGE', 'Stopped Collecting Data', 'X', '2011-07-29 11:06:37', ''),
(374827, '7/29/2011', '08:43:47', '10:43:47', 9, 'TAKATA', 'Last calls processed on 7-12-11', 'X', '2011-07-29 11:27:06', ''),
(374828, '7/29/2011', '09:27:37', '11:27:37', 2, 'COUNTY OF GALVESTON', 'New user cannot change PW', 'X', '2011-08-01 16:04:51', ''),
(374839, '7/29/2011', '11:01:29', '13:01:29', 2, 'CITY OF DAVIS ', 'Export Error ', 'X', '2011-08-01 11:18:12', ''),
(374840, '7/29/2011', '11:03:33', '13:03:33', 9, 'DYNAMEX INC      ', 'CONTROL CENTER', 'X', '2011-08-02 15:03:53', ''),
(374841, '7/29/2011', '11:04:47', '13:04:47', 2, 'DYNAMEX INC ', 'HUNT GROUPS', 'X', '2011-08-02 15:04:03', ''),
(374842, '7/29/2011', '11:06:45', '13:06:45', 2, 'DYNAMEX INC', 'Duplicate Calls', 'X', '2011-08-02 15:03:58', ''),
(374843, '7/29/2011', '11:44:43', '13:44:43', 2, 'NRECA ARLINGTON VA ', 'RATES WAY TOO HIGH', 'X', '2011-08-02 11:42:33', ''),
(374846, '7/29/2011', '13:54:13', '15:54:13', 2, 'COUNTY OF WOOD    ', 'Transfered calls detaile report timing out', 'X', '2011-08-05 13:32:20', ''),
(374864, '8/1/2011', '07:51:26', '09:51:26', 2, 'AMERICREDIT', 'Need to get Web authentication working after upgrade on Select.', 'X', '2011-08-02 16:47:32', ''),
(374865, '8/1/2011', '08:13:01', '10:13:01', 2, 'OWENS & MINOR ', 'Questions on costing internal calls', 'X', '2011-08-03 10:57:12', ''),
(374866, '8/1/2011', '08:36:27', '10:36:27', 9, 'CDR MANAGED SERVICES SERVER 2 ', 'Avaya ip office switch, the records below are going to the g file ', 'X', '2011-08-03 09:27:12', ''),
(374870, '8/2/2011', '15:20:43', '17:20:43', 2, 'HOLZER MEDICAL CENTER   ', 'REMOTE TRAINING ', 'X', '2011-08-03 13:20:22', ''),
(374871, '8/1/2011', '10:24:09', '12:24:09', 9, 'SERVICE MASTER MEMPHIS   ', 'HDD FULL', 'X', '2011-08-01 14:00:00', ''),
(374874, '8/1/2011', '10:53:51', '12:53:51', 9, 'DES MOINES IND. COMMUNITY SCHL', 'DOWN SYSTEM', 'X', '2011-08-01 11:04:17', ''),
(374877, '8/17/2011', '16:20:42', '18:20:42', 4, 'EISENHOWER MEDICAL CENTER  ', 'Autoreports Attachment', 'X', '2011-08-18 08:13:13', ''),
(374880, '8/1/2011', '11:53:10', '13:53:10', 2, 'MOODYS CORPORATION   ', 'SP3863 causes server crash', 'X', '2011-08-02 11:54:38', ''),
(374881, '8/1/2011', '12:16:51', '14:16:51', 4, 'LENDER PROCESSING SERVICES    ', 'MAX LICENSES', 'X', '2011-08-02 09:57:49', ''),
(374883, '8/1/2011', '12:39:47', '14:39:47', 2, 'AMERITAS LIFE INSURANCE CORP  ', 'AUTOREPORTS', 'X', '2011-08-01 15:59:23', ''),
(374885, '8/1/2011', '12:45:38', '14:45:38', 2, 'GALE DIV OF CENGAGE LEARNING  ', 'Explain ACD/NACD', 'X', '2011-08-04 11:46:48', ''),
(374886, '8/1/2011', '13:31:38', '15:31:38', 9, 'RESEARCH PHARMACEUTICALS', 'No calls recorded for today. ', 'X', '2011-08-02 09:56:40', ''),
(374887, '8/1/2011', '13:04:31', '15:04:31', 2, 'HOSPICE OF THE COMFORTER, INC', 'Cal going to VM not recording', 'X', '2011-08-04 13:28:26', ''),
(374889, '8/1/2011', '14:48:03', '16:48:03', 2, 'TAKATA    ', 'Web User Security Settings', 'X', '2011-08-16 11:04:03', ''),
(374893, '8/1/2011', '15:36:31', '17:36:31', 4, 'STATE BAR OF CALIFORNIA   ', 'FIXED CHARGES', 'X', '2011-08-10 10:44:55', ''),
(374894, '8/1/2011', '16:24:14', '18:24:14', 2, 'RBC CAPITAL MARKETS CORP', 'Missing Data in Report', 'X', '2011-08-02 11:29:35', ''),
(374895, '8/1/2011', '16:37:08', '18:37:08', 9, 'DENTON COUNTY      ', 'DOWN SYSTEM', 'X', '2011-08-01 16:47:13', ''),
(374896, '8/1/2011', '16:44:40', '18:44:40', 9, 'CORINTHIAN COLLEGES  ', 'DOWN SYSTEM', 'X', '2011-08-02 11:29:56', ''),
(374898, '8/2/2011', '08:34:55', '10:34:55', 2, 'PUTNAM INVESTMENTS', 'Costing too high.', 'X', '2011-08-02 13:17:20', ''),
(374900, '8/2/2011', '10:20:48', '12:20:48', 4, 'STATE U. AT MORRISVILLE ', 'AUTOREPORTS ERROR', 'X', '2011-08-02 11:35:19', ''),
(374902, '8/2/2011', '13:20:19', '15:20:19', 4, 'CURBELL - ORCHARD PARK NY', 'DOWN SYSTEM DIAGNOSIS', 'X', '2011-08-03 12:40:37', ''),
(374906, '8/2/2011', '11:07:20', '13:07:20', 2, 'TRINITY UNIVERSITY  ', 'EXTENSION DIGITS', 'X', '2011-08-09 11:24:01', ''),
(374910, '8/2/2011', '13:44:32', '15:44:32', 2, 'WESTINGHOUSE', 'Needs to configure Report Portal', 'X', '2011-08-03 14:04:48', ''),
(374912, '8/2/2011', '14:40:45', '16:40:45', 4, 'AMERICREDIT', 'Analytical reprts for VM calls show 0 calls after SP4041', 'X', '2011-08-10 11:03:25', ''),
(374914, '8/2/2011', '14:52:24', '16:52:24', 4, 'ST MARGARET HOSPITAL', 'Billing Description Help', 'X', '2011-08-04 07:50:04', ''),
(374917, '8/2/2011', '15:27:14', '17:27:14', 2, 'TORRANCE MEMORIAL HOSPITAL   ', 'IFW AUTOREPORTS NOT WORKING', 'X', '2011-08-03 11:49:53', ''),
(374919, '8/2/2011', '17:07:32', '19:07:32', 9, 'CITY OF LUBBOCK  ', 'Directory Setup', 'X', '2011-08-03 08:11:10', ''),
(374920, '8/2/2011', '18:40:18', '20:40:18', 2, 'SALEM-KEIZER PUBLIC SCHOOLS ', 'Blank Autoreports', 'X', '2011-08-03 08:06:02', ''),
(374925, '8/3/2011', '09:33:31', '11:33:31', 9, 'ST JOSEPHS HOSPITAL MARSHFIELD', 'Down, no calls processing', 'X', '2011-08-03 09:37:48', ''),
(374927, '8/5/2011', '10:39:59', '12:39:59', 9, 'HORIZON SOLUTIONS CORP ', 'CUCM 8 Upgrade', 'X', '2011-08-05 13:14:06', ''),
(374928, '8/3/2011', '09:55:19', '11:55:19', 2, 'CHRISTIAN BROADCASTING NETWORK', 'Autoreports Help', 'X', '2011-08-04 13:31:59', ''),
(374931, '8/3/2011', '10:49:51', '12:49:51', 2, 'STATE OF MD-DIST COURT OF MD  ', 'Not stripping digits dialed', 'X', '2011-08-03 11:05:31', ''),
(374933, '8/3/2011', '10:58:30', '12:58:30', 2, 'DORAL ARROWWOOD ', 'INT Call Tracking', 'X', '2011-08-03 15:10:15', ''),
(374938, '8/3/2011', '12:45:04', '14:45:04', 2, 'ST VINCENT MARTEN HOUSE ', 'RT update error', 'X', '2011-08-04 12:41:19', ''),
(374940, '8/3/2011', '14:35:54', '16:35:54', 4, 'STEPTOE & JOHNSON ', 'CUCM 8 UPGRADE for 8-6-11', 'X', '2011-08-05 07:25:20', ''),
(374941, '8/3/2011', '13:45:37', '15:45:37', 9, 'STEPTOE & JOHNSON', 'Last calls recorded on 7-14-11.', 'X', '2011-08-03 14:54:47', ''),
(374942, '8/3/2011', '14:23:42', '16:23:42', 2, 'CLASSIFIED VENTURES', 'Error when running reports.', 'X', '2011-08-03 15:22:25', ''),
(374945, '8/3/2011', '15:42:48', '17:42:48', 2, 'CITY OF EL PASO ', 'Reports incomplete', 'X', '2011-08-04 13:37:36', ''),
(374946, '8/3/2011', '16:08:42', '18:08:42', 4, 'JP MORGAN CHASE  main site  ', 'Multi-server CDR', 'X', '2011-08-04 11:08:32', ''),
(374947, '8/3/2011', '17:29:22', '19:29:22', 2, 'BOY SCOUTS OF AMERICA   ', 'Delete Wireless Charges', 'X', '2011-08-05 15:31:47', ''),
(374948, '8/3/2011', '17:35:07', '19:35:07', 4, 'MCKINSEY & COMPANY', 'Rejected Calls', 'X', '2011-08-04 07:58:35', ''),
(374949, '8/4/2011', '08:00:41', '10:00:41', 2, 'EBSCO PUBLISHING', 'SQL error in Event Viewer.', 'X', '2011-08-09 11:24:25', ''),
(374951, '8/4/2011', '09:36:21', '11:36:21', 9, 'UNION SQUARE EYE CARE INC.   ', 'No calls recording.', 'X', '2011-08-04 10:43:19', ''),
(374952, '8/4/2011', '09:47:43', '11:47:43', 2, 'PAN AMERICAN HEALTH ORG', 'Undefined Extensions', 'X', '2011-08-04 14:26:06', ''),
(374953, '8/4/2011', '11:00:14', '13:00:14', 4, 'BASS PRO SHOPS', 'Sizeup Assistance', 'X', '2011-08-04 11:16:24', ''),
(374954, '8/4/2011', '11:27:17', '13:27:17', 9, 'ALPERT & ALPERT IRON & METAL ', '8-3 calls recording over & over', 'X', '2011-08-04 12:00:24', ''),
(374955, '8/4/2011', '12:06:29', '14:06:29', 2, 'TORRANCE MEMORIAL HOSPITAL   ', 'User Password Changes', 'X', '2011-08-04 15:19:34', ''),
(374957, '8/4/2011', '14:15:35', '16:15:35', 9, 'DYNAMEX INC   ', 'Down, cannot access Control center', 'X', '2011-08-05 07:23:20', ''),
(374958, '8/4/2011', '14:26:37', '16:26:37', 2, 'MARSHFIELD CLINIC', 'Departments showing 0 calls on monthly reports', 'X', '2011-08-05 08:05:34', ''),
(374959, '8/4/2011', '15:45:28', '17:45:28', 2, 'PHILADELPHIA INSURANCE CO.  ', 'Directory Edits', 'X', '2011-08-08 16:16:35', ''),
(374960, '8/4/2011', '16:48:39', '18:48:39', 9, 'ANSCHUTZ KANSAS CITY ARENA', 'CUCM Upgrade Issues', 'X', '2011-08-04 16:51:03', ''),
(374961, '8/4/2011', '15:54:54', '17:54:54', 2, 'ANDERSON TRUCKING SERVICE ', 'Blank Reports', 'X', '2011-08-04 16:38:54', ''),
(374972, '8/5/2011', '10:21:10', '12:21:10', 4, 'APEX INFORMATION SYSTEMS  ', '', 'X', '2011-08-05 11:12:51', ''),
(374975, '8/5/2011', '10:52:56', '12:52:56', 2, 'ST BARNABAS COM MEDICAL CENTER', 'Email Filesize Errors', 'X', '2011-08-05 14:08:09', ''),
(374977, '8/5/2011', '11:51:29', '13:51:29', 4, 'INTER-AMERICAN DEVELOPMENT BAN', 'Licenses Exceeded', 'X', '2011-08-09 08:06:49', ''),
(374978, '8/12/2011', '14:55:03', '16:55:03', 9, 'MAKAHA RESORT GOLF CLUB       ', 'PMS SYSTEM DOWN', 'X', '2011-08-12 17:46:17', ''),
(374983, '8/5/2011', '13:03:58', '15:03:58', 2, 'ERIE INSURANCE COMPANY ', '', 'X', '2011-08-08 14:56:23', ''),
(374986, '8/5/2011', '14:46:00', '16:46:00', 2, 'UNION LEAGUE CLUB OF CHICAGO  ', 'Abandoned Call Autoreport help', 'X', '2011-08-09 11:24:53', ''),
(374989, '8/9/2011', '10:09:09', '12:09:09', 4, 'BRANCH BANKING & TRUST   ', 'LDAP IMPORT', 'X', '2011-08-09 10:48:22', ''),
(374990, '8/8/2011', '07:28:27', '09:28:27', 9, 'GAINESVILLE REGIONAL UTILITIES', 'Not processed any data for over a week', 'X', '2011-08-08 08:10:29', ''),
(374998, '8/8/2011', '08:47:41', '10:47:41', 4, 'GEICO ', '', 'X', '2011-08-09 08:09:14', ''),
(375000, '8/8/2011', '09:06:00', '11:06:00', 9, 'MUNCIE POWER PRODUCTS INC.  ', 'No CDR Collected', 'X', '2011-08-08 09:13:12', ''),
(375002, '8/8/2011', '09:42:20', '11:42:20', 2, 'MCKINSEY & COMPANY ', 'Question on SQL 2008 R2', 'X', '2011-08-09 09:49:25', ''),
(375003, '8/8/2011', '11:19:13', '13:19:13', 4, 'RETIREMENT SYSTEMS OF ALABAMA ', 'User License Maxed out by Unassigned users', 'X', '2011-08-08 11:54:55', ''),
(375005, '8/8/2011', '13:08:59', '15:08:59', 2, 'FOREST PHARMACEUTICALS        ', 'DB Sync', 'X', '2011-08-09 09:48:51', ''),
(375006, '8/8/2011', '13:11:46', '15:11:46', 2, 'ST MARGARET HOSPITAL', 'CLIENT NOT WORKING', 'X', '2011-08-09 09:37:52', ''),
(375008, '8/8/2011', '13:43:57', '15:43:57', 4, 'CITY OF DENTON TECHNOLOGY SVCS', '', 'X', '2011-08-09 08:08:40', ''),
(375014, '8/8/2011', '15:30:50', '17:30:50', 2, 'ROTHSTEIN, KASS & COMPANY', 'Missing Tariff Update', 'X', '2011-08-09 13:55:39', ''),
(375018, '8/9/2011', '07:48:57', '09:48:57', 9, 'AMERICAN PRECIOUS METALS EXCHA', 'No data on Graph', 'X', '2011-08-09 08:02:31', ''),
(375021, '8/9/2011', '10:00:42', '12:00:42', 2, 'CLASSIFIED VENTURES ', 'Excel Report Format', 'X', '2011-08-09 13:23:50', ''),
(375022, '8/9/2011', '10:37:40', '12:37:40', 2, 'BUCHANAN INGERSOLL & ROONEY PC', 'Fresh IFW Install', 'X', '2011-08-09 11:25:12', ''),
(375027, '8/9/2011', '10:46:28', '12:46:28', 2, 'LIGHTHOUSE GROUP  ', 'Web Report Errors', 'X', '2011-08-09 10:56:18', ''),
(375029, '8/9/2011', '11:05:07', '13:05:07', 2, 'BUCHANAN INGERSOLL & ROONEY PC', 'REMOTE TRAINING', 'X', '2011-08-09 11:52:10', ''),
(375044, '8/9/2011', '13:39:15', '15:39:15', 4, 'GRAHAM CAPITAL MANAGEMENT', 'Adding additional trunk', 'X', '2011-08-09 13:41:32', ''),
(375052, '8/9/2011', '16:17:23', '18:17:23', 2, 'BASS PRO SHOPS  ', 'LICENSE KEY UPDATE', 'X', '2011-08-09 16:28:29', ''),
(375060, '8/10/2011', '09:35:22', '11:35:22', 4, 'AMERITAS LIFE INSURANCE CORP', 'Issue with Rate tables via FTP, 10 Dig numbers filling up Unassigned, Call costing of Inbound calls', 'X', '2011-08-10 16:10:21', ''),
(375061, '8/10/2011', '09:39:49', '11:39:49', 2, 'WYNDHAM VACATION OWNERSHIP  ', 'Web users cannot login using Windows Authentication', 'X', '2011-08-10 09:57:09', ''),
(375066, '8/10/2011', '10:40:38', '12:40:38', 2, 'OKLAHOMA HEART HOSPITAL  ', 'Help with abandon call report', 'X', '2011-08-10 12:21:55', ''),
(375068, '8/10/2011', '11:23:26', '13:23:26', 2, 'MCKINSEY & COMPANY  ', 'Excel Format Issues', 'X', '2011-08-10 12:02:27', ''),
(375075, '8/11/2011', '06:47:01', '08:47:01', 9, 'KAMEHAMEHA SCHOOLS ', 'DOWN SYSTEM', 'X', '2011-08-11 08:18:12', ''),
(375076, '8/11/2011', '07:56:16', '09:56:16', 4, 'RESEARCH PHARMACEUTICALS SERVI', 'Cannot Access Web', 'X', '2011-08-11 11:22:38', ''),
(375077, '8/11/2011', '08:20:25', '10:20:25', 9, 'BARNES & NOBLE COLLEGE  ', 'DOWN SYSTEM', 'X', '2011-08-11 09:05:39', ''),
(375078, '8/11/2011', '08:27:44', '10:27:44', 2, 'COOK INCORPORATED ', 'CallManager IP Change', 'X', '2011-08-11 12:59:51', ''),
(375083, '8/11/2011', '11:47:12', '13:47:12', 9, 'HILTON - SAN FRANCISCO     ', 'Down System..Not posting any calls to any of the rooms', 'X', '2011-08-11 12:00:18', ''),
(375085, '8/11/2011', '12:41:15', '14:41:15', 4, 'SOUTHERN IL HEALTHCARE  ', 'Extension Detail Report shows calls in the future', 'X', '2011-08-11 13:25:54', ''),
(375086, '8/11/2011', '13:36:20', '15:36:20', 4, 'AMERICAN PRECIOUS METALS EXCHA', 'Reporting Questions', 'X', '2011-08-11 14:36:01', ''),
(375090, '8/11/2011', '15:17:08', '17:17:08', 9, 'RETIREMENT SYSTEMS OF ALABAMA ', 'Customer Called Back on LDAP', 'X', '2011-09-06 14:00:47', ''),
(375099, '8/12/2011', '08:33:30', '10:33:30', 4, 'CONDE NAST PUBLICATIONS', 'AD Questions', 'X', '2011-08-12 10:52:38', ''),
(375100, '8/12/2011', '08:36:43', '10:36:43', 4, 'FRANKLIN COUNTY CHILDRENS SVCS', 'SQL Failure with SA & INFORTEL Password', 'X', '2011-08-12 13:17:43', ''),
(375106, '8/12/2011', '10:11:08', '12:11:08', 9, 'JOHNSON DIVERSEY   ', 'DOWN SYSTEM', 'X', '2011-08-12 10:31:04', ''),
(375115, '8/12/2011', '12:58:50', '14:58:50', 4, 'AMERICREDIT ', 'Help with Reclassify of toll free call', 'X', '2011-08-12 14:20:23', ''),
(375116, '8/12/2011', '13:02:58', '15:02:58', 9, 'ANDERSON TRUCKING SERVICE ', 'No Data on Report', 'X', '2011-08-12 13:41:03', ''),
(375117, '8/12/2011', '13:43:11', '15:43:11', 9, 'LENDER PROCESSING SERVICES    ', 'Not processing all information', 'X', '2011-08-12 14:36:05', ''),
(375118, '8/12/2011', '13:57:45', '15:57:45', 4, 'VISA - FOSTER CITY  (main)    ', 'Verify system size ', 'X', '2011-08-12 15:41:29', ''),
(375119, '8/12/2011', '14:49:51', '16:49:51', 9, 'GEORGE BUSH INTERCONTINAL AIRPORT', 'BBOX FULL', 'X', '2011-08-12 15:06:37', ''),
(375121, '8/12/2011', '16:37:53', '18:37:53', 2, 'CORINTHIAN COLLEGES', 'Extension Digits', 'X', '2011-08-17 13:31:22', ''),
(375123, '8/12/2011', '17:10:41', '19:10:41', 2, 'UCAR NCAR ', 'STRIP + CHARACTER', 'X', '2011-08-15 08:16:29', ''),
(375126, '8/15/2011', '07:48:41', '09:48:41', 4, 'HGT/ VANTAGE HEALTH GROUP  ', 'Getting error:The process cannot access the file C;usersadministratorlocal	emp1Allied Urology.pdf because it is being used by another process.', 'X', '2011-08-15 08:44:52', ''),
(375128, '8/15/2011', '09:01:20', '11:01:20', 2, 'GENUINE PARTS COMPANY    ', 'Questions on report views', 'X', '2011-08-15 09:03:47', ''),
(375129, '8/15/2011', '09:09:36', '11:09:36', 4, 'FINLEY HOSPITAL        ', 'LD Calls incorrect city name ', 'X', '2011-08-15 13:52:43', ''),
(375130, '8/15/2011', '09:16:07', '11:16:07', 9, 'STATE OF MD DISABILITY DETERMI', 'Down System no data on graph', 'X', '2011-08-15 11:18:54', ''),
(375134, '8/16/2011', '07:05:25', '09:05:25', 2, 'ANOKA COUNTY GOVERNMENT', 'Print out International pricing', 'X', '2011-08-16 08:42:55', ''),
(375135, '8/16/2011', '07:36:48', '09:36:48', 4, 'WORK FORCE OF CENTRAL FLORIDA ', 'Getting 911 alarms that were never made', 'X', '2011-08-16 07:40:32', ''),
(375139, '8/16/2011', '09:00:38', '11:00:38', 4, 'MERITUS HEALTH ', 'Buffer polling changed ', 'X', '2011-08-16 11:59:47', ''),
(375141, '8/16/2011', '10:17:10', '12:17:10', 9, 'CENTRAL GARDEN & PET  ', 'Not Collecting Data...Additional open issues from Upgrade', 'X', '2011-08-16 12:48:00', ''),
(375144, '12/12/2011', '09:40:51', '11:40:51', 2, 'BHP BILLITON-main   ', 'SP 4304 Upgrade', 'X', '2011-12-14 08:25:45', ''),
(375145, '9/2/2011', '09:01:24', '11:01:24', 2, 'EBSCO PUBLISHING  ', 'SP 4213 Upgrade', 'X', '2011-09-08 11:03:09', ''),
(375150, '8/16/2011', '13:52:29', '15:52:29', 9, 'RAYTHEON COMPANY IIS   ', 'Down System ...No Data being collected ', 'X', '2011-08-16 14:46:41', ''),
(375151, '8/16/2011', '14:46:16', '16:46:16', 2, 'NATIONAL FUTURES ASSOC.  ', 'FTP & SQL Questions', 'X', '2011-08-16 15:25:43', ''),
(375152, '8/16/2011', '15:24:48', '17:24:48', 2, 'IVANS', 'Report & Summary Gates questions', 'X', '2011-08-17 08:16:10', ''),
(375156, '9/19/2011', '08:44:16', '10:44:16', 9, 'FAIRMONT HOTEL WASHINGTON DC  ', 'Down System not collecting any data for the past few days\r\n', 'X', '2011-09-19 10:07:17', ''),
(375157, '8/16/2011', '16:34:30', '18:34:30', 9, 'WY NATIONAL GUARD CHEYENN MAIN', 'DOWN SYSTEM', 'X', '2011-08-16 17:19:39', ''),
(375158, '8/16/2011', '17:43:52', '19:43:52', 2, 'COUNTY OF FRESNO FRESNO CA    ', 'CUCM Diagram', 'X', '2011-08-17 13:33:41', ''),
(375159, '8/17/2011', '09:01:52', '11:01:52', 9, 'FRANKLIN COUNTY VIRGINIA      ', 'Down system not collected since 8/4', 'X', '2011-08-17 09:28:45', ''),
(375160, '8/17/2011', '09:10:37', '11:10:37', 4, 'AMERICREDIT ', 'How to export all the extension listed in Unassigned to excel', 'X', '2011-08-17 09:28:34', ''),
(375161, '8/17/2011', '09:32:00', '11:32:00', 4, 'KFORCE  ', 'W3WP.EXE Process using most of the resources', 'X', '2011-08-17 10:44:32', ''),
(375162, '8/17/2011', '09:34:10', '11:34:10', 4, 'COMPUTER ASSOCIATES', 'Calls being reported incorrectly', 'X', '2011-08-17 10:13:29', ''),
(375164, '8/17/2011', '09:53:12', '11:53:12', 2, 'DONA ANA COMMUNITY COLLEGE    ', 'FTP Rate table setup', 'X', '2011-08-17 10:39:46', ''),
(375165, '8/17/2011', '10:02:25', '12:02:25', 2, 'INTERCONTINENTAL HOTEL BOSTON ', 'Scheduled reports not going out', 'X', '2011-08-17 13:47:19', ''),
(375166, '8/17/2011', '10:06:16', '12:06:16', 4, 'CMP AUTO GROUP, LTD  ', 'Report not going out', 'X', '2011-08-17 11:09:56', ''),
(375170, '8/17/2011', '11:46:25', '13:46:25', 2, 'FIRSTCOMP WARWICK ', 'Trunk Definitions', 'X', '2011-08-17 13:42:51', ''),
(375173, '8/17/2011', '12:38:34', '14:38:34', 2, 'FRANKLIN COUNTY VIRGINIA     ', 'Abandoned Call Questions', 'X', '2011-08-17 13:53:51', ''),
(375176, '8/17/2011', '13:58:49', '15:58:49', 9, 'STATE OF MD DHR DSS CARROLL CO', 'Down System..Not collected since June 28th ', 'X', '2011-08-17 13:59:42', ''),
(375180, '8/17/2011', '16:31:58', '18:31:58', 2, 'EISENHOWER MEDICAL CENTER  ', 'Phone Number Search', 'X', '2011-08-18 08:14:16', ''),
(375182, '8/18/2011', '07:30:37', '09:30:37', 2, 'ERIE INSURANCE COMPANY   ', 'Login Trouble', 'X', '2011-08-18 08:11:45', ''),
(375185, '8/18/2011', '09:15:30', '11:15:30', 2, 'HAPPY STATE BANK  ', 'Unassigned & Misdialed', 'X', '2011-08-18 11:16:48', ''),
(375187, '8/18/2011', '10:01:11', '12:01:11', 9, 'CANCER TREATMENT CTR OF AMERIC', 'Down system has not collected any data since Aug 9th ', 'X', '2011-08-18 10:15:07', ''),
(375188, '8/18/2011', '10:17:12', '12:17:12', 4, 'KIRBY RISK  ', 'Help with directory import', 'X', '2011-08-18 11:19:45', ''),
(375189, '8/18/2011', '10:53:07', '12:53:07', 2, 'AMERICREDIT   ', 'User Management', 'X', '2011-08-18 11:22:23', ''),
(375190, '8/19/2011', '10:17:50', '12:17:50', 2, 'KINGS COUNTY HOSPITAL     ', 'SQL Server Migration', 'X', '2011-08-19 14:00:55', ''),
(375199, '8/18/2011', '15:14:24', '17:14:24', 4, 'SEABOARD MARINE', 'Help with finding report', 'X', '2011-08-19 07:54:50', ''),
(375206, '8/19/2011', '08:34:53', '10:34:53', 2, 'JOHNS HOPKINS HOME', 'Question on Microsoft patches ', 'X', '2011-08-19 08:38:21', ''),
(375207, '8/19/2011', '08:49:56', '10:49:56', 2, 'STREET.COM, INC (THE)     ', 'Help with setting up some users', 'X', '2011-08-19 09:13:44', ''),
(375210, '8/19/2011', '09:25:38', '11:25:38', 2, 'DYNAMEX INC   ', 'Help with setting up new user', 'X', '2011-08-19 12:10:19', ''),
(375213, '8/19/2011', '16:06:19', '18:06:19', 9, 'EDISON STATE COLLEGE  ', 'DOWN SYSTEM', 'X', '2011-08-19 16:44:49', ''),
(375215, '8/22/2011', '07:02:03', '09:02:03', 4, 'FORT SAM HOUSTON ISD     ', 'Help with editing auth codes', 'X', '2011-08-22 08:16:46', ''),
(375216, '8/22/2011', '07:07:06', '09:07:06', 9, 'JP MORGAN CHASE  main site', 'Multi-Client environment Down', 'X', '2011-08-22 07:26:06', ''),
(375217, '8/22/2011', '07:29:27', '09:29:27', 4, 'EL CAMINO HOSPITAL', 'Remediate ICMP', 'X', '2011-08-25 13:19:30', ''),
(375221, '8/22/2011', '08:56:45', '10:56:45', 4, 'INDIANA HEALTH CENTERS     ', '2 reports showing different amounts of calls made', 'X', '2011-08-22 12:07:10', ''),
(375223, '8/22/2011', '10:26:00', '12:26:00', 4, 'WEST CLINIC ', 'No CDR alarms', 'X', '2011-08-22 11:21:49', ''),
(375224, '8/22/2011', '11:17:00', '13:17:00', 4, 'UCAR NCAR    ', 'Wants to know if it is possible to automate a data push into this table', 'X', '2011-08-22 12:28:58', ''),
(375225, '8/22/2011', '11:47:39', '13:47:39', 9, 'HUBBELL POWER SYSTEMS   ', 'DOWN SYSTEM', 'X', '2011-08-22 12:05:37', ''),
(375226, '8/22/2011', '11:55:48', '13:55:48', 9, 'GENUINE PARTS COMPANY   ', 'Disk Space Cleanup', 'X', '2011-08-22 12:42:01', ''),
(375227, '8/22/2011', '12:46:20', '14:46:20', 2, 'CHILDRENS MEDICAL CENTER  ', 'Blank Reports on Demand', 'X', '2011-08-22 15:29:56', ''),
(375229, '8/22/2011', '13:36:07', '15:36:07', 9, 'MERITUS HEALTH   ', 'DOWN SYSTEM', 'X', '2011-08-22 15:00:26', ''),
(375239, '8/23/2011', '07:22:24', '09:22:24', 4, 'GEICO     ', 'LDAP Problems', 'X', '2011-08-23 08:23:41', ''),
(375247, '8/23/2011', '08:32:27', '10:32:27', 9, 'HUBBELL POWER SYSTEMS ', 'On August 10th he loaded his rate table for China since then his system is down', 'X', '2011-08-23 09:25:06', ''),
(375248, '8/23/2011', '08:58:19', '10:58:19', 9, 'JP MORGAN CHASE  main site    ', 'Error in Directory for reporting ', 'X', '2011-08-23 14:58:10', ''),
(375255, '8/23/2011', '09:53:17', '11:53:17', 4, 'SCHOLASTIC BOOK FAIR LAKE MARY', 'Unassigned people on detail report****note * Per notes in history we need to respond to critical issues within 2 hours (24 x 7) and to non-critical issues within 4 business hours (standard support hours)***', 'X', '2011-08-23 12:48:54', ''),
(375259, '8/23/2011', '10:37:19', '12:37:19', 2, 'WEST CLINIC     ', 'Password Trouble', 'X', '2011-08-23 13:19:23', ''),
(375265, '8/23/2011', '12:13:32', '14:13:32', 2, 'AMERITAS LIFE INSURANCE CORP  ', 'irpMain errors in report', 'X', '2011-08-23 14:33:15', ''),
(375271, '8/23/2011', '13:29:08', '15:29:08', 2, 'SHERATON DALLAS NORTH', 'Trace Inbound Call', 'X', '2011-08-24 07:33:23', ''),
(375272, '8/23/2011', '14:15:25', '16:15:25', 4, 'HAWAII NATIONAL BANK ', 'Help with report for dept to dept', 'X', '2011-08-23 14:28:32', ''),
(375274, '8/23/2011', '14:21:54', '16:21:54', 4, 'COLUMBIA INSURANCE    ', 'Help with Summary style report report is showing nothing ', 'X', '2011-08-23 14:38:42', ''),
(375279, '8/23/2011', '17:07:54', '19:07:54', 9, 'ARIZONA CARDINALS ', 'DOWN SYSTEM', 'X', '2011-08-25 15:43:36', ''),
(375280, '8/24/2011', '07:57:21', '09:57:21', 2, 'CHEMICAL ABSTRACT SERVICES    ', '911 Amarms not always emailing', 'X', '2011-08-24 13:49:01', ''),
(375282, '8/24/2011', '08:37:46', '10:37:46', 9, 'DAVID J JOSEPH COMPANY (DJJ) ', 'System not collecting all calls...also time is off on reports', 'X', '2011-08-24 08:41:58', ''),
(375283, '8/24/2011', '09:46:48', '11:46:48', 4, 'WORK FORCE OF CENTRAL FLORIDA ', 'Help with 911 Alerts', 'X', '2011-08-24 10:55:16', ''),
(375287, '8/24/2011', '10:38:29', '12:38:29', 2, 'AMERICREDIT ', 'Sumerized data report', 'X', '2011-08-24 11:05:01', ''),
(375289, '8/24/2011', '10:52:55', '12:52:55', 2, 'FREEPORT MCMORAN COPPER & GOLD', 'Web Report Frozen', 'X', '2011-08-24 13:01:13', ''),
(375292, '8/24/2011', '11:34:47', '13:34:47', 2, 'WEST CLINIC    ', '911 Alarms', 'X', '2011-08-24 14:32:16', ''),
(375295, '8/24/2011', '13:25:39', '15:25:39', 4, 'IAT GROUP HARCO  ', 'Create Ext range', 'X', '2011-08-24 15:14:59', ''),
(375300, '8/24/2011', '14:46:08', '16:46:08', 2, 'ILLINOIS MUNICIPAL RETIREMENT ', 'Explain isvsched', 'X', '2011-08-24 17:05:10', ''),
(375305, '8/24/2011', '16:55:49', '18:55:49', 4, 'JP MORGAN CHASE  main site   ', 'Directory Errors', 'X', '2011-08-24 17:00:56', ''),
(375307, '8/25/2011', '07:27:48', '09:27:48', 9, 'CITY OF SARASOTA POLICE DEPT  ', 'DOWN SYSTEM', 'X', '2011-08-25 08:02:29', ''),
(375318, '8/25/2011', '09:52:36', '11:52:36', 4, 'RUSH NORTH SHORE HOSPITAL   ', '1CB - Call Redirect Report Help', 'X', '2011-08-25 15:13:48', ''),
(375327, '8/25/2011', '12:04:00', '14:04:00', 2, 'CABELAS ', 'Autoreport not saving.', 'X', '2011-08-25 14:27:00', ''),
(375333, '8/25/2011', '13:40:23', '15:40:23', 4, 'WYNDHAM VACATION OWNERSHIP ', 'Help with  running a reports for 6 ext...User is on the  dashboard', 'X', '2011-08-25 14:23:43', ''),
(375349, '8/25/2011', '14:29:50', '16:29:50', 4, 'COLUMBIA INSURANCE', 'Not updating with LDAP', 'X', '2011-08-26 12:54:03', ''),
(375370, '8/25/2011', '15:55:34', '17:55:34', 2, 'WESTINGHOUSE CRANBERRY TWP', 'ACD Groups showing up unser unassigned', 'X', '2011-08-29 09:25:09', ''),
(375376, '8/26/2011', '07:22:21', '09:22:21', 9, 'DADE COUNTY AVIATION    ', 'Not processing data', 'X', '2011-08-26 07:46:16', ''),
(375377, '8/26/2011', '07:54:28', '09:54:28', 4, 'WE ENERGIES (MAIN SITE)   ', 'Wants to take out Dual Entries', 'X', '2011-08-29 14:39:45', ''),
(375383, '8/26/2011', '11:50:26', '13:50:26', 2, 'NCCI HOLDING ', 'Directory Errors when adding persons', 'X', '2011-08-29 14:39:52', ''),
(375385, '8/26/2011', '12:04:37', '14:04:37', 2, 'GILFORD SECURITIES', 'Multi-Extension User report.', 'X', '2011-08-29 15:58:36', ''),
(375389, '8/26/2011', '13:03:25', '15:03:25', 2, 'GIBBONS, DEDEO, DOLAN, GRIFFIN', 'DASHBOARD ACCESS', 'X', '2011-08-29 15:51:32', ''),
(375394, '8/26/2011', '14:50:42', '16:50:42', 2, 'COMPUTER ASSOCIATES  ', 'Information on CSV format report.', 'X', '2011-08-29 08:57:05', ''),
(375396, '8/26/2011', '15:46:21', '17:46:21', 2, 'TECK RESOURCES LIMITED  ', 'Rate Table Geolocation Issues', 'X', '2011-08-26 15:50:04', ''),
(375406, '8/29/2011', '10:46:58', '12:46:58', 4, 'PLAINS CAPITAL CORPORATION  ', 'Missing Data from Reports', 'X', '2011-08-31 14:44:48', ''),
(375408, '8/29/2011', '10:49:52', '12:49:52', 4, 'RUSSELL REYNOLDS ASSOCIATES IN', 'LDAP Problems', 'X', '2011-08-29 14:13:47', '');
INSERT INTO `tickets` (`Ticket`, `Date`, `STime`, `ETA`, `Priority`, `Site`, `Comments`, `Deleted`, `Removed_Datetime`, `removedby`) VALUES
(375410, '8/29/2011', '11:12:02', '13:12:02', 9, 'SMITH SENIOR LIVING      ', 'Down System not collecting any data since 8/28/11', 'X', '2011-08-29 13:26:22', ''),
(375413, '8/29/2011', '12:28:05', '14:28:05', 4, 'HENDRICK MEDICAL CENTER  ', 'Multiple Errors on Control Center', 'X', '2011-08-29 14:43:18', ''),
(375414, '8/29/2011', '12:40:57', '14:40:57', 9, 'RESEARCH PHARMACEUTICALS SERVI', 'Down system not collected data since 8/25/11', 'X', '2011-08-29 13:37:15', ''),
(375417, '8/29/2011', '13:07:49', '15:07:49', 4, 'PUTNAM INVESTMENTS    ', 'Costing off from what they are being charged', 'X', '2011-08-30 07:38:11', ''),
(375419, '8/29/2011', '13:21:51', '15:21:51', 4, 'MIDLAND COUNTY  ', 'Change costing of Long distance calls', 'X', '2011-08-29 14:05:49', ''),
(375715, '8/29/2011', '15:32:47', '17:32:47', 2, 'CITY OF PEORIA  ', '911 Alarms', 'X', '2011-08-30 08:06:36', ''),
(375717, '8/29/2011', '15:41:17', '17:41:17', 4, 'NORTEL GOVT SOL-SOCIAL SEC LAB', 'Report problem after loading sp 4041', 'X', '2011-08-30 10:07:35', ''),
(375718, '8/29/2011', '15:53:55', '17:53:55', 4, 'TCF BANK LISLE IL (main svr)  ', 'Hard Disk reaching capacity.', 'X', '2011-08-30 07:40:26', ''),
(375719, '8/29/2011', '16:03:30', '18:03:30', 9, 'CBS STUDIO CENTER ', 'NOT COLLECTING', 'X', '2011-08-29 17:17:00', ''),
(375727, '8/30/2011', '09:53:30', '11:53:30', 9, 'CHRISTIAN HOMES INC         ', 'No CDR Alarms as of 8/28/11', 'X', '2011-08-30 10:01:45', ''),
(375748, '8/30/2011', '15:20:51', '17:20:51', 9, 'BUCHANAN INGERSOLL & ROONEY PC', 'DOWN SYSTEM', 'X', '2011-08-30 16:56:43', ''),
(375749, '8/30/2011', '15:56:08', '17:56:08', 9, 'COOK CHILDRENS MEDICAL CENTER ', 'Not Collecting data', 'X', '2011-08-31 10:10:10', ''),
(375764, '8/31/2011', '07:56:39', '09:56:39', 9, 'AMERITAS LIFE INSURANCE CORP  ', 'Down System no data for today', 'X', '2011-08-31 10:16:47', ''),
(375765, '8/31/2011', '08:03:37', '10:03:37', 9, 'LOVES COUNTRY STORES    ', 'Down System Not collecting any data', 'X', '2011-08-31 08:39:09', ''),
(375770, '8/31/2011', '09:26:56', '11:26:56', 4, 'WORK FORCE OF CENTRAL FLORIDA ', 'Help with running report for 3 ext', 'X', '2011-08-31 12:24:12', ''),
(375775, '8/31/2011', '11:16:00', '13:16:00', 9, 'TSA INFRASTRUCTURE ', 'Down system not showing any data on dashboard for one of his locations.(main site)', 'X', '2011-08-31 11:35:18', ''),
(375777, '8/31/2011', '11:29:43', '13:29:43', 9, 'BROOKHAVEN NATIONAL LABORATORY', 'No Data for Modual 80', 'X', '2011-08-31 11:39:25', ''),
(375780, '8/31/2011', '11:59:50', '13:59:50', 2, 'CABELAS      ', 'Cant explin abandoned and ext detail reports', 'X', '2011-08-31 13:00:29', ''),
(375783, '8/31/2011', '12:22:38', '14:22:38', 2, 'DADE COUNTY AVIATION  ', 'Alarms not firing emails off.', 'X', '2011-09-02 10:30:44', ''),
(375786, '8/31/2011', '13:38:28', '15:38:28', 9, 'CONFED. TRIBES, SILETZ INDIANS', 'Not processing data since 8/12/11', 'X', '2011-08-31 14:03:38', ''),
(375787, '8/31/2011', '14:46:08', '16:46:08', 2, 'CITY OF LUBBOCK ', 'Directory Changes Not Saving', 'X', '2011-08-31 15:11:24', ''),
(375790, '8/31/2011', '17:28:11', '19:28:11', 2, 'NIELSEN COMPANY MEXICO    ', 'Intl Rate Table Installation', 'X', '2011-09-02 12:31:01', ''),
(375795, '9/1/2011', '08:26:28', '10:26:28', 2, 'MASONIC CHARITY FOUNDATION ', 'Fixed charges too high', 'X', '2011-09-06 07:26:03', ''),
(375798, '9/1/2011', '09:55:02', '11:55:02', 4, 'FINLEY HOSPITAL           ', 'Help with changing call time ', 'X', '2011-09-01 10:40:33', ''),
(375800, '9/1/2011', '10:10:33', '12:10:33', 2, 'HUBBELL POWER SYSTEMS    ', 'Aiken DS not recording calls.  Asl Dashboard error', 'X', '2011-09-01 10:57:16', ''),
(375804, '9/1/2011', '10:42:53', '12:42:53', 4, 'ELMHURST MEMORIAL HOSPITAL', '', 'X', '2011-09-01 14:40:09', ''),
(375805, '9/1/2011', '10:48:43', '12:48:43', 4, 'ANGEL MEDICAL CENTER ', 'Error with re-process data', 'X', '2011-09-01 15:41:14', ''),
(375813, '9/1/2011', '14:42:00', '16:42:00', 2, 'MORAINE VALLEY COMM COLLEGE  ', 'whos getting email merge reports', 'X', '2011-09-06 07:54:55', ''),
(375814, '9/1/2011', '15:23:16', '17:23:16', 9, 'BLUE CROSS & BLUE SHIELD CHAPE', 'Error when running trunk group analysis reports', 'X', '2011-09-02 12:24:04', ''),
(375816, '9/2/2011', '07:03:36', '09:03:36', 2, 'MEDLINE INDUSTRIES MUNDELEIN  ', 'Help with installing Intl rtss', 'X', '2011-09-02 10:35:36', ''),
(375821, '9/2/2011', '13:53:39', '15:53:39', 4, 'WAUSAU TILE         ', 'RE-Install select on new pc', 'X', '2011-09-06 08:01:10', ''),
(375826, '9/2/2011', '11:31:43', '13:31:43', 4, 'UCAR NCAR  ', 'LD Call being charged as Local for one of his locations ', 'X', '2011-09-06 08:05:55', ''),
(375833, '9/2/2011', '13:56:26', '15:56:26', 9, 'BUTLER UNIVERSITY ', 'Down system no data past the 28th of August', 'X', '2011-09-02 14:35:34', ''),
(375837, '9/2/2011', '14:09:54', '16:09:54', 4, 'PHEAA ', 'Zero cost for calls', 'X', '2011-09-06 07:57:28', ''),
(375841, '9/2/2011', '16:34:29', '18:34:29', 2, 'BOY SCOUTS OF AMERICA    ', 'Wireless Charges', 'X', '2011-09-06 09:11:19', ''),
(375843, '9/6/2011', '09:08:47', '11:08:47', 2, 'INTER-AMERICAN DEVELOPMENT BAN', 'a report to all members of the company instead of sent the report only to the stakeholders. ', 'X', '2011-09-06 16:02:09', ''),
(375844, '9/15/2011', '15:32:27', '17:32:27', 2, 'ALLIANZ LIFE INSURANCE CO ', 'call manger upgrade', 'X', '2011-09-16 09:20:29', ''),
(375846, '9/6/2011', '08:32:40', '10:32:40', 9, 'DYNAMEX INC    ', 'No CDR Alarms', 'X', '2011-09-06 09:10:23', ''),
(375848, '9/6/2011', '08:40:58', '10:40:58', 2, 'POLK COUNTY PLAZA  ', 'No Callerid info on inbound calls', 'X', '2011-09-06 14:48:58', ''),
(375849, '9/6/2011', '15:14:42', '17:14:42', 2, 'POLK COUNTY PLAZA', 'Reports training', 'X', '2011-09-08 14:35:41', ''),
(375851, '9/6/2011', '09:01:55', '11:01:55', 2, 'DADE COUNTY AVIATION ', 'People are getting alarms for a service request number.', 'X', '2011-09-06 11:42:19', ''),
(375854, '9/7/2011', '07:36:14', '09:36:14', 2, 'INTER-AMERICAN DEVELOPMENT BAN', 'Calls costing wrong', 'X', '2011-09-08 08:00:11', ''),
(375855, '9/6/2011', '10:33:32', '12:33:32', 2, 'ALTRU HEALTH SYSTEM    ', 'Calls being costed as assistance.', 'X', '2011-09-06 11:46:31', ''),
(375856, '9/6/2011', '10:53:04', '12:53:04', 2, 'KIRBY RISK ', 'Report problems, needs to verify Dir DB import', 'X', '2011-09-07 12:40:54', ''),
(375862, '9/6/2011', '11:30:06', '13:30:06', 2, 'TCF BANK MINNEAPOLIS', 'Report on ext has no calls. Also wants to change DS mname.', 'X', '2011-09-06 15:26:40', ''),
(375863, '9/6/2011', '11:31:06', '13:31:06', 9, 'HENDRICK MEDICAL CENTER ', 'NOT PROCESSING', 'X', '2011-09-06 11:35:35', ''),
(375865, '9/6/2011', '11:44:46', '13:44:46', 9, 'TORRANCE MEMORIAL HOSPITAL    ', 'Cant login to Control Center', 'X', '2011-09-07 11:18:13', ''),
(375868, '9/6/2011', '14:29:05', '16:29:05', 2, 'STREET.COM, INC THE   ', 'AD not syncing', 'X', '2011-09-08 13:09:05', ''),
(375871, '9/6/2011', '16:24:05', '18:24:05', 2, 'LATHAM & WATKINS-LOS ANGELES C', 'Dashboard access', 'X', '2011-09-08 15:00:38', ''),
(375872, '9/7/2011', '07:32:31', '09:32:31', 4, 'INTER-AMERICAN DEVELOPMENT BAN', 'Incomplete information on report', 'X', '2011-09-08 10:07:50', ''),
(375879, '9/7/2011', '09:27:00', '11:27:00', 4, 'INDIANA HEALTH CENTERS   ', 'Help with transfered call report', 'X', '2011-09-07 13:13:42', ''),
(375889, '9/7/2011', '11:12:31', '13:12:31', 9, 'MINNEAPOLIS INST OF ARTS', 'Down System not collecting data since Aug 1st', 'X', '2011-09-07 11:24:06', ''),
(375906, '9/7/2011', '14:04:35', '16:04:35', 2, 'TEACHERS CREDIT UNION', 'Need to setup Hunt Group reports', 'X', '2011-09-08 07:47:06', ''),
(375908, '9/7/2011', '14:42:31', '16:42:31', 4, 'UNIVERSITY OF ARKANSAS FT SMIT', 'Server Capacity Errors', 'X', '2011-09-07 15:00:14', ''),
(375909, '9/7/2011', '14:46:58', '16:46:58', 2, 'WASHINGTON STATE UNIVERSITY ', 'Questions on abilities of Select', 'X', '2011-09-08 10:05:38', ''),
(375910, '9/8/2011', '10:54:32', '12:54:32', 4, 'HOLZER MEDICAL CENTER    ', 'SP4213 & Training', 'X', '2011-09-09 13:05:45', ''),
(375918, '9/7/2011', '15:36:14', '17:36:14', 4, 'ST JOSEPHS HOSPITAL MARSHFIELD', 'Systems check for reporting accurately', 'X', '2011-09-08 13:10:32', ''),
(375935, '9/8/2011', '14:27:10', '16:27:10', 2, 'AMERICAN PRECIOUS METALS EXCHA', 'Autoreport Setup & Help', 'X', '2011-09-08 15:42:13', ''),
(375936, '9/8/2011', '14:38:58', '16:38:58', 2, 'SPECTRUM HEALTH - GRAND RAPIDS', 'False Alarms', 'X', '2011-09-08 15:43:31', ''),
(375945, '9/9/2011', '10:26:53', '12:26:53', 9, 'CABELAS   ', 'Cannot process any records Error in IsvProcess IFW file group is full.', 'X', '2011-09-09 12:19:17', ''),
(375947, '9/9/2011', '11:17:51', '13:17:51', 9, 'INTER-AMERICAN DEVELOPMENT BAN', 'DOWN SYSTEM', 'X', '2011-09-12 09:23:30', ''),
(375957, '9/9/2011', '13:46:49', '15:46:49', 4, 'MO ARMY NATIONAL GUARD MAIN   ', 'Down System', 'X', '2011-09-09 13:55:29', ''),
(375958, '9/13/2011', '09:13:56', '11:13:56', 9, 'ORANGE CTY PUBLIC SCHOOLS EDUC', 'DOWN SYSTEM diagnostics ', 'X', '2011-09-13 10:47:24', ''),
(375959, '9/9/2011', '14:01:38', '16:01:38', 4, 'PAREXEL INTERNATIONAL, INC LOW', 'Check to see if they still need ', 'X', '2011-10-14 10:54:40', ''),
(375962, '9/9/2011', '15:51:23', '17:51:23', 9, 'TORRANCE MEMORIAL HOSPITA', 'Down again', 'X', '2011-09-12 13:27:40', ''),
(375965, '9/9/2011', '17:50:23', '19:50:23', 2, 'MCKINSEY & COMPANY', 'Local Costs web report bug', 'X', '2011-09-13 10:51:38', ''),
(375970, '9/12/2011', '08:17:03', '10:17:03', 4, 'HOUSATONIC COMMUNITY COLLEGE  ', 'Seeing Old Data on Report.', 'X', '2011-09-12 08:39:03', ''),
(375973, '9/12/2011', '08:47:15', '10:47:15', 9, 'JOHNSON DIVERSEY    ', 'Not Processing Data', 'X', '2011-09-12 09:41:12', ''),
(375974, '9/12/2011', '08:53:46', '10:53:46', 9, 'PALOS COMMUNITY HOSPITAL  ', 'Not collecting data since 9/11/11', 'X', '2011-09-12 09:33:21', ''),
(375977, '9/12/2011', '09:28:38', '11:28:38', 4, 'IOWA CLINICS        ', 'Help with report', 'X', '2011-09-12 12:39:35', ''),
(375985, '9/12/2011', '11:53:58', '13:53:58', 2, 'MGIC (MORTGAGE GUARANTY INS CO', 'Autoreports Missing ', 'X', '2011-09-12 13:17:05', ''),
(375987, '9/12/2011', '12:33:15', '14:33:15', 2, 'GEICO          `', 'OneTime charges', 'X', '2011-09-12 13:01:39', ''),
(375988, '9/12/2011', '12:14:06', '14:14:06', 4, 'WASHINGTON STATE UNIVERSITY ', 'SDN Translation issue', 'X', '2011-09-13 13:02:49', ''),
(375993, '9/12/2011', '12:34:56', '14:34:56', 4, 'LATHAM & WATKINS ATTORNEYS  ', 'Missing Records', 'X', '2011-09-12 13:14:21', ''),
(375994, '9/12/2011', '12:48:23', '14:48:23', 9, 'OUR LADY OF LOURDES REGIONAL M', 'Several Alarm messages', 'X', '2011-09-12 12:58:16', ''),
(375995, '9/12/2011', '13:21:55', '15:21:55', 9, 'CULTURAL MISSION OF THE ROYAL ', 'DOWN SYSTEM', 'X', '2011-09-12 13:36:38', ''),
(375996, '9/12/2011', '13:23:12', '15:23:12', 2, 'ELMHURST MEMORIAL HOSPITAL    ', 'Time on 911 Alarts calls is off', 'X', '2011-09-13 11:24:34', ''),
(375998, '9/12/2011', '13:38:28', '15:38:28', 2, 'CENTURY COLLEGE       ', 'LD Access Codes', 'X', '2011-09-13 16:12:49', ''),
(376003, '9/12/2011', '14:07:58', '16:07:58', 9, 'SW REGIONAL COUNCIL OF CARPENT', 'Down System', 'X', '2011-09-12 16:11:59', ''),
(376004, '9/12/2011', '14:34:39', '16:34:39', 4, 'TCF BANK LISLE IL (main svr)  ', 'Reports run by admin without data', 'X', '2011-09-13 10:33:44', ''),
(376008, '9/12/2011', '15:17:45', '17:17:45', 4, 'WYNDHAM VACATION OWNERSHIP  ', 'Error with reports', 'X', '2011-09-14 10:57:06', ''),
(376013, '9/13/2011', '08:35:07', '10:35:07', 2, 'HENDRICK MEDICAL CENTER ', 'Trunk Analysis', 'X', '2011-09-14 12:06:29', ''),
(376016, '9/13/2011', '09:42:59', '11:42:59', 2, 'BRANCH BANKING & TRUST ', 'Trunk Usage Report Issues', 'X', '2011-09-14 14:27:44', ''),
(376020, '9/13/2011', '10:28:36', '12:28:36', 2, 'NATIONWIDE MUTUAL INSURANCE mn', 'Summary reports listed as &#34;trash&#34;', 'X', '2011-09-14 11:54:48', ''),
(376022, '9/13/2011', '10:51:58', '12:51:58', 4, 'MCKINSEY & COMPANY            ', 'Install Intl Table', 'X', '2011-09-15 13:17:33', ''),
(376023, '9/13/2011', '11:21:18', '13:21:18', 4, 'CITY OF MACON     ', 'Help with report', 'X', '2011-09-14 09:35:41', ''),
(376024, '9/13/2011', '11:40:33', '13:40:33', 2, 'CENTURA HC    ', 'Missing Extension in report', 'X', '2011-09-13 13:32:18', ''),
(376027, '9/13/2011', '12:12:48', '14:12:48', 4, 'HILLSBOROUGH COUNTY 13TH     ', '911 Report time off', 'X', '2011-09-14 10:18:53', ''),
(376038, '9/13/2011', '15:03:38', '17:03:38', 2, 'SMITH & NEPHEW  ', 'Whats new SP 4041 training', 'X', '2011-09-15 13:32:42', ''),
(376047, '9/13/2011', '16:12:47', '18:12:47', 4, 'MPS GROUP ', 'Bill Back offices', 'X', '2011-09-14 16:13:23', ''),
(376052, '9/21/2011', '13:40:35', '15:40:35', 9, 'COMPUTER ASSOCIATES ', 'DOWN SYSTEM', 'X', '2011-09-21 14:37:20', ''),
(376054, '9/14/2011', '08:50:41', '10:50:41', 9, 'JOHNSON DIVERSEY  ', 'Down system site 5 not collecting', 'X', '2011-09-14 10:04:31', ''),
(376063, '9/14/2011', '11:14:18', '13:14:18', 4, 'RADFORD UNIVERSITY  ', 'Not able to log in to the web to run reports', 'X', '2011-09-14 14:51:15', ''),
(376065, '9/14/2011', '11:54:45', '13:54:45', 2, 'WK KELLOGG FOUNDATION ', 'Report data not valid', 'X', '2011-09-15 13:33:01', ''),
(376068, '9/14/2011', '12:20:42', '14:20:42', 9, 'TRIMBLE SUNNYVALE CA    ', 'DOWN SYSTEM', 'X', '2011-09-14 13:56:05', ''),
(376075, '9/14/2011', '10:23:06', '12:23:06', 9, 'ASSOCIA    ', 'Needs a call today ', 'X', '2011-09-14 10:52:20', ''),
(376076, '9/14/2011', '13:24:24', '15:24:24', 4, 'RUTGERS UNIVERSITY ', 'User not able ot login to the web...getting login failed for user', 'X', '2011-09-16 10:22:03', ''),
(376079, '9/14/2011', '14:15:38', '16:15:38', 9, 'GIBBONS, DEDEO, DOLAN, GRIFFIN', 'Calls from meeting room ext not being tracked', 'X', '2011-09-15 14:14:36', ''),
(376089, '9/15/2011', '08:47:58', '10:47:58', 2, 'DAVE & BUSTERS  ', 'Check site to see if they are set up for FTP Rate table download', 'X', '2011-09-16 09:23:19', ''),
(376102, '9/15/2011', '10:45:31', '12:45:31', 2, 'CULTURAL MISSION OF THE ROYAL ', 'Report Walkthrough ', 'X', '2011-09-16 07:19:13', ''),
(376104, '9/15/2011', '10:47:24', '12:47:24', 2, 'TAKATA  ', 'LD and Local calls switched', 'X', '2011-09-16 10:09:06', ''),
(376107, '9/15/2011', '12:11:48', '14:11:48', 2, 'INTER-AMERICAN DEVELOPMENT BAN', 'Blank Web Reports', 'X', '2011-09-16 10:31:42', ''),
(376110, '9/15/2011', '13:46:20', '15:46:20', 4, 'NATIONAL OPINION RESEARCH CTR ', 'Help with missing data', 'X', '2011-09-15 15:37:04', ''),
(376114, '9/15/2011', '14:20:48', '16:20:48', 4, 'ARTHUR J GALLAGHER & ASSOCIATE', 'Load rate table along with master rate table', 'X', '2011-09-16 12:57:57', ''),
(376115, '9/20/2011', '12:47:34', '14:47:34', 4, 'WK KELLOGG FOUNDATION    ', 'SP 4213 Install', 'X', '2011-09-20 12:59:33', ''),
(376118, '9/15/2011', '15:04:51', '17:04:51', 4, 'EISENHOWER MEDICAL CENTER ', 'Set up dedicated account', 'X', '2011-09-15 16:26:35', ''),
(376121, '9/15/2011', '16:05:58', '18:05:58', 9, 'VIRTUA HEALTH   ', 'DOWN SYSTEM', 'X', '2011-09-15 17:38:22', ''),
(376124, '9/28/2011', '09:52:03', '11:52:03', 4, 'RUTGERS UNIVERSITY', 'SP 4213 UPGRADE ALONG WITH UPDATING A TOTAL OF 4 REMOTE DESKTOPS.', 'X', '2011-10-24 11:40:16', ''),
(376127, '9/16/2011', '08:09:57', '10:09:57', 4, 'DUBOIS REGIONAL MEDICAL CENTER', 'CBA - Still in open queue', 'X', '2011-11-11 13:28:08', ''),
(376130, '9/16/2011', '09:23:19', '11:23:19', 9, 'COUNTY OF TULARE     ', 'DOWN SYSTEM NOT COLLECTED SINCE THE 1ST OF SEPT', 'X', '2011-09-16 09:58:17', ''),
(376131, '9/16/2011', '10:24:44', '12:24:44', 4, 'ARMSTRONG WORLD INDUSTRIES    ', 'NEW LOG IN NEEDED', 'X', '2011-09-16 10:49:58', ''),
(376133, '9/16/2011', '10:44:25', '12:44:25', 2, 'GREEN MOUNTAIN COFFEE ROASTERS', '911 TRUE ALERTS', 'X', '2011-09-16 11:06:25', ''),
(376134, '9/16/2011', '11:08:43', '13:08:43', 2, 'ANDREWS & KURTH HOUSTON', 'Go Over rate table cost ', 'X', '2011-09-16 13:24:30', ''),
(376142, '9/16/2011', '13:55:02', '15:55:02', 2, 'EMERSON ELECTRIC MEXICO   ', 'CBA - Still in open queue', 'X', '2011-11-09 13:41:44', ''),
(376147, '9/16/2011', '17:24:14', '19:24:14', 2, 'WASHINGTON STATE UNIVERSITY   ', 'SQL Diagnosis', 'X', '2011-09-19 09:46:24', ''),
(376149, '9/19/2011', '07:09:53', '09:09:53', 9, 'NATIONWIDE MUTUAL INSURANCE mn', 'DB Migration Help', 'X', '2011-09-19 08:35:49', ''),
(376151, '9/19/2011', '07:43:34', '09:43:34', 4, 'NATIONWIDE MUTUAL INS CANTON  ', 'Help with re-set login & password', 'X', '2011-09-19 09:40:50', ''),
(376152, '9/19/2011', '08:03:39', '10:03:39', 4, 'TRANSITIONS OPTICAL         ', 'When running reports on our call accounting software, there is no charge being made on outbound calls', 'X', '2011-09-19 10:05:02', ''),
(376159, '9/19/2011', '09:14:11', '11:14:11', 2, 'CBS STUDIO CENTER  ', 'To re-schedule a couple of Daily Directory Database imports & verify their operation ', 'X', '2011-09-19 10:09:03', ''),
(376160, '9/19/2011', '09:24:24', '11:24:24', 9, 'ILITCH HOLDINGS/LITTLE CAESAR ', 'Down System not collected since 9/14/11', 'X', '2011-09-19 12:19:46', ''),
(376161, '9/19/2011', '10:00:06', '12:00:06', 2, 'JOHNSON DIVERSEY SWEDEN  ', 'NO STATS OUTBO CALLS', 'X', '2011-09-19 12:23:24', ''),
(376164, '9/19/2011', '10:07:05', '12:07:05', 2, 'AMERITAS LIFE INSURANCE CORP  ', 'irpMain Timeout Error', 'X', '2011-09-19 13:27:13', ''),
(376168, '9/19/2011', '10:34:39', '12:34:39', 9, 'SCHOLASTIC BOOK FAIR LAKE MARY', 'Call Total Differences. Critical Customer:4HR RESPONSE REQUIRED ', 'X', '2011-09-19 11:53:09', ''),
(376170, '9/19/2011', '10:46:16', '12:46:16', 4, 'NATIONWIDE MUTUAL INSURANCE mn', 'Site data unavailable', 'X', '2011-09-19 12:14:00', ''),
(376174, '9/19/2011', '13:42:59', '15:42:59', 2, 'SCHOLASTIC BOOK FAIR LAKE MARY', 'DATA FOR USER NOT ACCURATE', 'X', '2011-09-19 15:48:53', ''),
(376177, '9/19/2011', '13:47:58', '15:47:58', 2, 'PRESBYTERIAN INTERCOMM HOSP   ', 'Archive Data missing', 'X', '2011-09-19 14:04:26', ''),
(376178, '9/20/2011', '08:07:23', '10:07:23', 2, 'CHRISTOPHER RURAL HEALTH', 'Did&#39;s not polling', 'X', '2011-09-20 10:31:31', ''),
(376183, '9/19/2011', '15:19:40', '17:19:40', 9, 'CROWNE PLAZA RAVINIA ', 'INTERFACE NOT POSTING CHARGES', 'X', '2011-09-20 07:05:20', ''),
(376185, '9/19/2011', '18:22:34', '20:22:34', 2, 'WHITMAN COLLEGE TECHNOLOGY SVC', 'SP 4213', 'X', '2011-09-20 07:46:13', ''),
(376187, '9/19/2011', '19:02:50', '21:02:50', 2, 'CBS STUDIO CENTER', 'Complete upgrade & set up new admin account', 'X', '2011-09-27 12:15:47', ''),
(376188, '9/20/2011', '07:11:21', '09:11:21', 4, 'TRANSITIONS OPTICAL           ', 'How to integrate the software to our AD', 'X', '2011-09-20 09:50:57', ''),
(376189, '9/20/2011', '08:03:57', '10:03:57', 4, 'REID HOSPITAL   ', 'Help with clean up directory', 'X', '2011-09-20 13:58:13', ''),
(376191, '9/20/2011', '08:37:49', '10:37:49', 2, 'HOLIDAY INN SAN FRAN CIVIC CTR', 'CAN NOT RUN REPORTS FROM YESTERDAY', 'X', '2011-09-20 13:35:53', ''),
(376196, '9/20/2011', '09:42:26', '11:42:26', 9, 'CHILDRENS MEDICAL CENTER ', 'Not collecting data...reports blank', 'X', '2011-09-20 10:14:00', ''),
(376201, '9/20/2011', '10:07:33', '12:07:33', 4, 'DAVE & BUSTERS ', 'Rate tables did not get down loaded via FTP\r\n', 'X', '2011-09-20 14:11:45', ''),
(376203, '9/20/2011', '10:46:53', '12:46:53', 9, 'COX HOSPITAL   ', 'D: Drive filling up', 'X', '2011-09-20 10:55:29', ''),
(376215, '9/20/2011', '13:00:23', '15:00:23', 9, 'EBSCO PUBLISHING    ', 'DOWN SYSTEM', 'X', '2011-09-20 13:07:33', ''),
(376219, '9/20/2011', '14:15:25', '16:15:25', 9, 'NORTHWEST MISSISSIPPI COM CLG ', 'Down system as of yesterday', 'X', '2011-09-20 15:04:15', ''),
(376222, '9/20/2011', '14:34:04', '16:34:04', 4, 'WARNER MUSIC GROUP  ', 'Rate tables did not FTP to site.', 'X', '2011-09-20 16:39:11', ''),
(376234, '9/21/2011', '07:03:29', '09:03:29', 4, 'BREAKERS HOTEL ', 'Help with Scheduling some reports', 'X', '2011-09-21 10:13:44', ''),
(376235, '9/21/2011', '07:43:59', '09:43:59', 2, 'VA MIAMI ', 'Help with loading rate table', 'X', '2011-09-21 08:44:44', ''),
(376236, '9/21/2011', '08:18:49', '10:18:49', 2, 'RADFORD UNIVERSITY  ', 'ADD USERS', 'X', '2011-09-21 08:38:07', ''),
(376237, '9/21/2011', '09:04:02', '11:04:02', 4, 'EATON VANCE MANAGEMENT', 'Help with running reports for end to end calls', 'X', '2011-09-21 12:56:28', ''),
(376240, '9/22/2011', '06:53:50', '08:53:50', 2, 'ALL CHILDRENS HOSPITAL   ', 'SP 4213 & Training', 'X', '2011-09-27 12:12:37', ''),
(376245, '9/21/2011', '10:47:47', '12:47:47', 9, 'WATERFRONT INTERNATIONAL LTD  ', 'Down system ...not collected since April', 'X', '2011-09-21 10:57:14', ''),
(376251, '9/21/2011', '11:04:13', '13:04:13', 4, 'TECK RESOURCES LIMITED  ', 'Help with import ', 'X', '2011-09-21 12:31:49', ''),
(376258, '9/21/2011', '12:17:12', '14:17:12', 4, 'BUCHANAN INGERSOLL & ROONEY PC', 'CAN NOT FIND DATA IN DIRECTORY DATABASE', 'X', '2011-09-21 12:54:20', ''),
(376259, '9/21/2011', '12:38:18', '14:38:18', 2, 'ST MARY MEDICAL CENTER', 'Dir DB full cannot add users', 'X', '2011-09-22 08:52:58', ''),
(376264, '9/21/2011', '14:07:44', '16:07:44', 4, 'PIEDMONT NATURAL GAS PNG ', 'CPU SPIKE everyday', 'X', '2011-09-22 11:55:02', ''),
(376273, '9/22/2011', '07:56:30', '09:56:30', 2, 'FLORIDA COMMUNITY COLLEGE AT J', 'LD Vendor Change', 'X', '2011-09-22 08:55:41', ''),
(376279, '9/22/2011', '09:24:51', '11:24:51', 4, 'ST JOSEPHS HOSPITAL', 'COLLECTING DATA BUT UNABLE TO READ', 'X', '2011-09-22 10:08:08', ''),
(376280, '9/22/2011', '09:20:33', '11:20:33', 9, 'COX ENTERPRISES  ATLANTA GA', 'DATASOURCE DOWN', 'X', '2011-09-22 09:30:24', ''),
(376281, '9/22/2011', '09:26:54', '11:26:54', 2, 'HERITAGE VALLEY HEALTH SYSTEM ', 'TRYING TO EXPORT CSV FILE GETTING ERROR', 'X', '2011-09-22 09:44:01', ''),
(376285, '9/22/2011', '10:10:17', '12:10:17', 2, 'LIZ CLAIBORNE N BERGEN', '911 alarm time differences', 'X', '2011-09-22 11:05:27', ''),
(376290, '9/22/2011', '10:17:21', '12:17:21', 9, 'HOUSTON AIRPORT SYSTEM  ', 'Down system buffer boxes not polling data', 'X', '2011-09-22 11:50:56', ''),
(376303, '9/22/2011', '12:32:37', '14:32:37', 2, 'NIELSEN COMPANY MEXICO  ', 'CBA - Still in open queue', 'X', '2011-11-04 14:02:47', ''),
(376311, '9/22/2011', '15:01:47', '17:01:47', 2, 'CARLOW COLLEGE  ', 'unable to locate data for report', 'X', '2011-09-23 14:29:41', ''),
(376319, '9/23/2011', '09:07:09', '11:07:09', 2, 'DECATUR MEMORIAL HOSPITAL', 'SHOULD REPORTS RUN THE SAME AFTER CERTAIN NUMBERS HAVE BEEN MOVED TO NEW SYSTEM? AVAYA TO 9751 ROLM', 'X', '2011-09-23 14:32:55', ''),
(376323, '9/23/2011', '09:04:03', '11:04:03', 4, 'ANDREWS & KURTH HOUSTON ', 'PROCESSING FAILED AFTER UPDATE ON WEDNESDAY', 'X', '2011-09-23 14:25:46', ''),
(376336, '9/23/2011', '09:48:14', '11:48:14', 2, 'HMA-WUESTHOFF ROCKLEDGE MED CT', 'CBA - Still in open queue', 'X', '2011-11-04 13:20:26', ''),
(376338, '9/23/2011', '10:26:40', '12:26:40', 9, 'GEICO', 'ROLLBACK SP4041', 'X', '2011-09-23 10:38:44', ''),
(376346, '9/23/2011', '11:06:25', '13:06:25', 9, 'ARTHUR J GALLAGHER & ASSOCIATE', 'ISSUES TRYING TO CONNECT TO SERVER IN THE BROWSER ON THE CMP', 'X', '2011-09-27 12:12:29', ''),
(376347, '9/23/2011', '11:11:45', '13:11:45', 2, 'STRACK & VAN TIL', 'ODBC SQL SERVER DRIVER TIMEOUT EXPERED IS THE ERROR MESSAGE', 'X', '2011-09-23 15:48:24', ''),
(376349, '9/23/2011', '12:10:43', '14:10:43', 4, 'HEALTH FIRST', 'Trunk Configuration', 'X', '2011-09-23 15:08:08', ''),
(376351, '9/23/2011', '13:11:06', '15:11:06', 2, 'BROOKLYN ACADEMY OF MUSIC  ', 'Data missing in reports', 'X', '2011-09-23 15:01:16', ''),
(376352, '9/23/2011', '13:10:20', '15:10:20', 2, 'FITZ PATRICK GRANDE CNT HOTEL ', 'IFW 5.5 Lost Pasword ', 'X', '2011-09-23 13:31:02', ''),
(376354, '9/23/2011', '13:26:32', '15:26:32', 9, 'MIDLAND COUNTY   ', 'DAILY STATSS NOT SHOWING 253 RECORDS ON HOLD', 'X', '2011-09-23 13:30:57', ''),
(376362, '9/23/2011', '14:52:27', '16:52:27', 2, 'REID HOSPITAL ', 'OPEN DISC SPACE ON SERVER', 'X', '2011-09-26 07:54:44', ''),
(376366, '9/23/2011', '15:51:37', '17:51:37', 2, 'VERIDIAN CREDIT UNION ', 'CAN HE PULL REPORTS FROM HIS ROUTING PATTERN', 'X', '2011-09-23 16:48:46', ''),
(376368, '9/29/2011', '15:02:19', '17:02:19', 9, 'BEST WESTERN SEA CLIFF INN    ', 'Down System IFW System not talking to PMS', 'X', '2011-09-29 15:18:03', ''),
(376371, '9/23/2011', '16:48:55', '18:48:55', 2, 'WEST CLINIC   ', 'NOT PICKING UP NEW PHONE RECORDS', 'X', '2011-09-26 07:50:11', ''),
(376372, '9/23/2011', '17:30:07', '19:30:07', 4, 'UTAH RETIREMENT SYSTEMS ', 'PDF Report Errors', 'X', '2011-09-27 10:31:50', ''),
(376374, '9/26/2011', '07:56:14', '09:56:14', 4, 'AMERICAN PRECIOUS METALS EXCHA', 'Delete report.', 'X', '2011-09-26 08:31:07', ''),
(376375, '9/26/2011', '08:00:03', '10:00:03', 4, 'COMPUTER ASSOCIATES    ', 'Problems with reports', 'X', '2011-09-26 09:52:26', ''),
(376378, '9/26/2011', '09:22:49', '11:22:49', 9, 'MOORINGS THE    ', 'Down System not collected since 9/15/11', 'X', '2011-09-26 12:42:37', ''),
(376382, '9/26/2011', '11:02:11', '13:02:11', 9, 'AMERITAS LIFE INSURANCE CORP  ', 'Down System Not collecting data getting 2 different collection errors', 'X', '2011-09-26 11:55:58', ''),
(376384, '9/26/2011', '12:00:25', '14:00:25', 4, 'HOLZER MEDICAL CENTER', 'Transfered call report help', 'X', '2011-09-27 08:32:20', ''),
(376385, '9/26/2011', '12:11:57', '14:11:57', 9, 'POMONA SCHOOL ED CENTER   ', 'NOT PULLING RECORDS FROM ANY OF THE SITES HE HAS DOES NOT KNOW LAST DATE RECORDS WERE RECORDED', 'X', '2011-09-26 12:50:56', ''),
(376386, '9/26/2011', '12:29:21', '14:29:21', 9, 'US DEPT OF TRANSPORTATION  ', 'DS2 and DS3 no calls processing.', 'X', '2011-09-26 12:54:37', ''),
(376389, '9/26/2011', '13:13:07', '15:13:07', 4, 'AAA OHIO MOTORISTS ASSOCIATION', 'Password change error', 'X', '2011-09-28 11:24:18', ''),
(376391, '9/26/2011', '14:04:58', '16:04:58', 2, 'RESEARCH PHARMACEUTICALS SERVI', 'Can not find number in the system to reassing to a new extention...triewd to creat new extention but was unable', 'X', '2011-09-27 07:30:36', ''),
(376718, '9/26/2011', '14:14:17', '16:14:17', 2, 'GEORGE BUSH INTERCONTINAL AIRP', 'NEEDS SUMMARY OF REPORTS FOR THE LAST THREE MONTHS', 'X', '2011-09-27 10:43:52', ''),
(376731, '9/26/2011', '17:29:02', '19:29:02', 4, 'KAISER PERMANENTE RIVERSIDE   ', 'Directory Diagnosis', 'X', '2011-09-27 10:35:03', ''),
(376733, '9/27/2011', '07:36:20', '09:36:20', 4, 'DIRECT EDGE       ', 'Help with cleaning up directory', 'X', '2011-09-28 14:08:19', ''),
(376735, '9/27/2011', '08:24:20', '10:24:20', 4, 'CAPACITY OF TEXAS     ', 'when I pull the reports it shows zero abandoned calls since the data started being collected.  I need to make sure that data is being collected    ', 'X', '2011-09-28 10:46:23', ''),
(376737, '9/27/2011', '09:13:52', '11:13:52', 4, 'COMPUTER ASSOCIATES    ', 'When working with xls reports, you cannot sum the durations unless you save the xls file', 'X', '2011-09-30 07:59:21', ''),
(376753, '9/27/2011', '10:37:14', '12:37:14', 2, 'GREEN MOUNTAIN COFFEE ROASTERS', 'CAN NOT CONNECT TO DASHBOARD', 'X', '2011-09-28 11:26:12', ''),
(376754, '9/27/2011', '11:03:46', '13:03:46', 2, 'CDR MANAGED SERVICES SERVER 2 ', 'DOWN SYSTEM', 'X', '2011-09-28 12:47:03', ''),
(376756, '9/27/2011', '12:52:08', '14:52:08', 2, 'COUNTY OF LEHIGH  ', 'CLEAN OUT DATA IN UNASSIGNED NUMBERS', 'X', '2011-09-28 13:31:51', ''),
(376758, '9/27/2011', '13:18:54', '15:18:54', 4, '15 CRAIGSIDE    ', 'TROUBLE INSTALLING TARIFF CD', 'X', '2011-09-28 09:34:28', ''),
(376759, '9/27/2011', '13:27:04', '15:27:04', 2, 'GEICO  ', 'WANTS TO SET A FIXED COST', 'X', '2011-09-28 13:49:09', ''),
(376762, '9/27/2011', '14:30:18', '16:30:18', 2, 'STATE OF MISSOURI   ', 'DATA RETRIEVAL AND CALL COST INFO', 'X', '2011-09-28 11:22:47', ''),
(376764, '9/27/2011', '14:55:52', '16:55:52', 9, 'ARAMCO SERVICES COMPANY   ', 'DATA NOT PULLING', 'X', '2011-09-28 09:01:08', ''),
(376767, '9/27/2011', '15:34:26', '17:34:26', 4, 'LAKE HOSPITAL SYSTEM INC   ', 'Help delete duplicate entries', 'X', '2011-09-29 09:13:14', ''),
(376769, '9/27/2011', '17:25:49', '19:25:49', 2, 'MUDD ADVERTISING', 'Autoreports not working', 'X', '2011-09-28 08:03:16', ''),
(376770, '9/28/2011', '08:02:05', '10:02:05', 9, 'MARRIOTT OWNERSHIP RESORTS INC', 'Buffer box full no data going to control center since 9/24/11', 'X', '2011-09-28 11:10:19', ''),
(376777, '9/28/2011', '11:13:40', '13:13:40', 2, 'BURNS & WILCOX    ', 'NEEDS TO KNOW WHAT THE LATEST SUPPORTED VERSION OF SEQUEL SERVER IS', 'X', '2011-09-28 11:16:26', ''),
(376779, '9/28/2011', '11:54:30', '13:54:30', 9, 'BRIDGES RESORT & RACQUET CLUB', 'hospitality interface is not working', 'X', '2011-09-28 13:31:48', ''),
(376780, '9/28/2011', '12:42:09', '14:42:09', 9, 'ILLINOIS INSTITUTE OF TECH. ', 'No calls processed since 9-17-11', 'X', '2011-09-28 12:46:06', ''),
(376781, '9/28/2011', '13:05:55', '15:05:55', 2, 'WYNDHAM VACATION OWNERSHIP ', 'PULLING DATA BUT THERE ARE 6 NUMBERS THAT ARE NOT AND WANTS TO INCLUDE THESE IN REPORTS', 'X', '2011-09-30 08:03:53', ''),
(376784, '9/28/2011', '13:53:17', '15:53:17', 2, 'AAA OHIO MOTORISTS ASSOCIATION', 'TROUBLESHOOTING CDR', 'X', '2011-09-28 14:21:26', ''),
(376787, '9/28/2011', '14:25:35', '16:25:35', 9, 'SANDATA TECHNOLOGIES', 'CANNOT LOAD DASHBOARD', 'X', '2011-09-29 07:54:45', ''),
(376788, '9/28/2011', '14:31:32', '16:31:32', 9, 'STATE OF MD DISABILITY DETERMI', 'NO CDR BEING COLLECTED', 'X', '2011-09-28 15:43:26', ''),
(376790, '10/3/2011', '13:53:33', '15:53:33', 9, 'OMNI METAL CRAFT CORP.', 'Down system after loading sp 4213', 'X', '2011-10-03 15:53:37', ''),
(376791, '9/28/2011', '15:16:07', '17:16:07', 4, 'TEACHERS CREDIT UNION  ', 'Directory clean up help', 'X', '2011-09-29 11:19:00', ''),
(376797, '9/29/2011', '08:05:50', '10:05:50', 4, 'CROASDAILE VILLAGE ', 'Can&#39;t login to the control center', 'X', '2011-09-29 08:55:45', ''),
(376798, '9/29/2011', '08:20:53', '10:20:53', 2, 'AMERICAN PRECIOUS METALS EXCHA', 'ERROR MESSAGE', 'X', '2011-09-29 12:50:33', ''),
(376802, '9/29/2011', '09:27:39', '11:27:39', 4, 'GEICO ', 'EITHER MULTIPLYING IT OR NOT SHOWING AT ALL WHEN BILL IS PROCESSED', 'X', '2011-09-30 09:56:39', ''),
(376817, '9/29/2011', '11:39:30', '13:39:30', 4, 'WYNDHAM VACATION OWNERSHIP  ', 'Error when running report', 'X', '2011-09-29 12:42:31', ''),
(376818, '9/29/2011', '11:42:32', '13:42:32', 4, 'UNIVERSITY CLUB OF CHICAGO  ', 'Help check price on calls for all rooms', 'X', '2011-09-29 14:25:24', ''),
(376822, '9/29/2011', '13:37:11', '15:37:11', 9, 'LIGHTHOUSE GROUP    ', 'Can&#39;t connect to database.', 'X', '2011-09-29 14:26:51', ''),
(376823, '9/29/2011', '13:45:00', '15:45:00', 2, 'CANCER TREATMENT CTR OF AMERIC', 'CREATE REPORT HOW TO ', 'X', '2011-09-30 08:18:22', ''),
(376840, '9/30/2011', '08:38:54', '10:38:54', 9, 'HILLSBOROUGH COUNTY 13TH ', 'Down system nothing in FTP Folder ', 'X', '2011-09-30 09:09:39', ''),
(376841, '9/30/2011', '08:45:40', '10:45:40', 2, 'COLUMBIA INSURANCE ', 'Outbound Call Report', 'X', '2011-09-30 09:32:48', ''),
(376853, '9/30/2011', '14:24:22', '16:24:22', 4, 'STATE UTAH COURTS  ', 'Help with site add', 'X', '2011-10-03 10:55:29', ''),
(376855, '9/30/2011', '14:29:14', '16:29:14', 9, 'SEABOARD MARINE ', 'Down System not collecting data for 3 of his sites', 'X', '2011-09-30 15:25:41', ''),
(376856, '9/30/2011', '14:36:09', '16:36:09', 4, 'THALES COMMUNICATIONS INC    ', 'NO DATA ON CALLS RECEIVED', 'X', '2011-10-03 14:19:18', ''),
(376860, '10/3/2011', '07:29:32', '09:29:32', 9, 'TRANSCORR LLC        ', 'No Data on scheduled  report.', 'X', '2011-10-03 07:51:28', ''),
(376862, '10/3/2011', '08:05:09', '10:05:09', 9, 'STATE OF MINNESOTA       ', 'Reports blank', 'X', '2011-10-03 08:52:54', ''),
(376869, '10/3/2011', '09:23:21', '11:23:21', 4, 'STATE OF OREGON DEPT OF REV ', 'Costing off for all calls', 'X', '2011-10-04 14:25:44', ''),
(376888, '10/3/2011', '12:58:58', '14:58:58', 9, 'ALLIED SOLUTIONS  ', 'Down System, No data on reports...reports blank', 'X', '2011-10-03 13:39:52', ''),
(376894, '10/3/2011', '13:19:57', '15:19:57', 4, 'METRO TRANSIT AUTHORITY       ', 'Getting error 404 when running reports', 'X', '2011-10-04 09:55:37', ''),
(376895, '10/3/2011', '14:09:06', '16:09:06', 4, 'CAREERBUILDER     ', 'Incorrect information on reports', 'X', '2011-10-04 10:46:42', ''),
(376902, '10/3/2011', '14:54:34', '16:54:34', 4, 'CITY OF DENTON TECHNOLOGY SVCS', 'No INFORMATION ON REPORT FR A EXT', 'X', '2011-10-03 15:51:11', ''),
(376904, '10/3/2011', '14:57:39', '16:57:39', 4, 'PRESBYTERIAN INTERCOMM HOSP', 'isvprocess will not start error timer elaps ping.', 'X', '2011-10-03 15:44:05', ''),
(376907, '10/3/2011', '17:52:12', '19:52:12', 9, 'UNITRIN INC ', 'POWER OUTAGE SEPT 21-22 NO DATA HAS BEEN COLLECTED SINCE HOPING TO FIND DATA ', 'X', '2011-10-04 12:16:32', ''),
(376911, '10/4/2011', '09:40:21', '11:40:21', 4, 'ROTHSTEIN, KASS & COMPANY   ', 'Rate table expire error', 'X', '2011-10-05 10:47:14', ''),
(376918, '10/4/2011', '10:56:47', '12:56:47', 2, 'TEAM QUEST  ', 'Duplicate 911 Alarms', 'X', '2011-10-05 10:46:23', ''),
(376919, '10/4/2011', '11:11:09', '13:11:09', 9, 'ICMA RETIREMENT CORP  ', 'NOT PULLING REPORTS/COLLECTING DATA SINCE SEPTEMBER', 'X', '2011-10-04 11:24:52', ''),
(376922, '10/7/2011', '08:54:36', '10:54:36', 4, 'TRANSCORR LLC', 'Report Help', 'X', '2011-10-07 14:32:32', ''),
(376923, '10/4/2011', '13:14:10', '15:14:10', 2, 'NATIONAL FUTURES ASSOC. ', 'need some guidance in running a report of accumulation of reports that lists concurrent calls between our offices. Please contact me at your earliest opportunity. ', 'X', '2011-10-05 11:58:53', ''),
(376924, '10/4/2011', '13:55:18', '15:55:18', 2, 'POLK COUNTY BOCC/IMPER COMMI  ', 'Site 2 not recording 911 calls...ran rport from January 2010 until today and only two calls show...these calls are reporting as inbound and not info as they should...SSS', 'X', '2011-10-05 08:44:39', ''),
(376925, '10/4/2011', '14:41:50', '16:41:50', 9, 'MERITUS HEALTH     ', 'Not Collecting data', 'X', '2011-10-04 16:21:24', ''),
(376928, '10/4/2011', '16:06:19', '18:06:19', 2, 'OWENS & MINOR   ', 'MISSING DATA FROM REPORT AND ALSO WANTS TO RUN TRUNK  WONDER IF SHE CAN DO ALL AT THE SAME TIME', 'X', '2011-10-05 12:03:05', ''),
(376929, '10/4/2011', '16:21:50', '18:21:50', 2, 'STATE OF MISSOURI   ', 'Phone Number Mask', 'X', '2011-10-05 08:40:11', ''),
(376934, '10/4/2011', '17:32:52', '19:32:52', 9, 'TELESIS COMMUNITY CREDIT UNION', 'NOT PULLING DATA SINCE 28TH OF LAST MONTH STARTED AFTER ATTEMPT TO UPDATE TARIFF', 'X', '2011-10-05 10:12:04', ''),
(376936, '10/5/2011', '08:37:51', '10:37:51', 4, 'LORAS COLLEGE   DUBUQUE IA    ', 'Help with new adding new NPA', 'X', '2011-10-05 12:06:34', ''),
(376937, '10/5/2011', '09:08:44', '11:08:44', 4, 'PHEAA   ', 'Zero out rtss', 'X', '2011-10-05 09:37:26', ''),
(376938, '10/5/2011', '09:32:50', '11:32:50', 4, 'ROCKINGHAM MEMORIAL   ', ' help with Locating some call records', 'X', '2011-10-05 10:09:40', ''),
(376939, '10/5/2011', '10:00:42', '12:00:42', 4, 'TSA INFRASTRUCTURE   ', 'Report help', 'X', '2011-10-05 12:11:25', ''),
(376940, '10/5/2011', '10:09:24', '12:09:24', 2, 'DYNAMEX INC   ', 'RUN REPORT BUT NOTHING SHOWING WHEN ATTEMPTING TO VIEW', 'X', '2011-10-05 12:24:56', ''),
(376941, '10/5/2011', '10:29:45', '12:29:45', 9, 'GEICO   ', 'NO DATA SHOWING SINCE 9/8 FOR PREVIOUS REPORTS ', 'X', '2011-10-05 10:40:00', ''),
(376944, '10/5/2011', '11:04:24', '13:04:24', 2, 'COLUMBIA INSURANCE    ', 'Reports not matching with contact center and Select system', 'X', '2011-10-05 13:25:17', ''),
(376945, '10/5/2011', '11:52:33', '13:52:33', 4, 'EISENHOWER MEDICAL CENTER  ', 'Can&#39;t login to control center', 'X', '2011-10-05 13:13:34', ''),
(376946, '10/5/2011', '12:55:26', '14:55:26', 9, 'UNITED ASSOCIATION    ', 'DOWN SYSTEM', 'X', '2011-10-05 13:07:40', ''),
(376948, '10/6/2011', '07:34:07', '09:34:07', 2, 'CONNER STRONG COMPANIES', 'Help with running report', 'X', '2011-10-10 13:15:35', ''),
(376949, '10/5/2011', '13:59:27', '15:59:27', 2, 'HARNETT COUNTY    ', 'Bill from Centry link is different from select Report', 'X', '2011-10-06 08:05:42', ''),
(376954, '10/5/2011', '15:53:27', '17:53:27', 9, 'NATIONAL SAFETY COUNCIL', 'Down, no calls processing in over 30 days', 'X', '2011-10-05 16:11:29', ''),
(376956, '10/5/2011', '16:29:02', '18:29:02', 9, 'OHANA WAIKIKI BEACHCOMBER     ', 'DOWN SYSTEM', 'X', '2011-10-05 17:48:25', ''),
(376957, '10/5/2011', '16:32:35', '18:32:35', 4, 'DRS TECHNICAL SERVICES, INC ', 'DOWN SYSTEM', 'X', '2011-10-05 17:40:20', ''),
(376958, '10/5/2011', '17:59:06', '19:59:06', 2, 'HOTEL SETAI    ', 'RECEIVING ALARMS...NEED TO CHECK WHY', 'X', '2011-10-06 07:04:36', ''),
(376959, '10/6/2011', '07:05:00', '09:05:00', 9, 'SPECTRUM HEALTH - GRAND RAPIDS', 'Down system not cdr since yesterday.', 'X', '2011-10-06 07:44:28', ''),
(376961, '10/6/2011', '09:06:59', '11:06:59', 4, 'MERITUS HEALTH  ', 'Loading sp 4213', 'X', '2011-10-06 13:59:33', ''),
(376965, '10/6/2011', '09:37:12', '11:37:12', 4, 'MPS GROUP     ', 'Help with importing Directory', 'X', '2011-10-06 12:38:09', ''),
(376967, '10/6/2011', '10:38:02', '12:38:02', 9, 'ANOKA COUNTY GOVERNMENT ', 'No CDR for Highway and Lino Lakes ', 'X', '2011-10-06 10:46:11', ''),
(376971, '10/6/2011', '11:52:38', '13:52:38', 4, 'TEKNION  ', 'MOVED CALL MANAGER NEEDS ASST CONFIGURING', 'X', '2011-10-06 14:38:23', ''),
(376974, '10/6/2011', '12:32:23', '14:32:23', 9, 'MANCHESTER COLLEGE  ', ': Our Infotel system has not been tracking calls since 6/21 and our rate table may be expired. ', 'X', '2011-10-06 14:39:00', ''),
(376976, '10/6/2011', '12:58:50', '14:58:50', 2, 'ROTHSTEIN, KASS & COMPANY   ', 'WANT TO SET UP A LOG IN WHICH WILL ONLY HAVE RUNNING REPORTS RIGHTS.\r\n\r\nREPORT ERROR ', 'X', '2011-10-10 09:11:04', ''),
(376978, '10/6/2011', '14:21:52', '16:21:52', 4, 'CLASSIFIED VENTURES     ', 'Time on reports off', 'X', '2011-10-06 14:41:54', ''),
(376980, '10/6/2011', '15:38:49', '17:38:49', 9, 'PAREXEL INTERNATIONAL, INC LOW', 'Down System', 'X', '2011-10-07 09:44:26', ''),
(376981, '10/6/2011', '15:47:25', '17:47:25', 4, 'ANDREWS & KURTH HOUSTON     ', 'Change password for bbox', 'X', '2011-10-10 13:14:20', ''),
(376983, '10/6/2011', '17:56:12', '19:56:12', 9, 'SONY COMPUTER ENTERTAINMENT AM', 'DOWN SYSTEM', 'X', '2011-10-07 09:46:04', ''),
(376998, '10/7/2011', '10:46:43', '12:46:43', 4, 'ACG1 MASTER FOLDER  ', 'Report Issues', 'X', '2011-10-11 14:31:51', ''),
(377002, '10/7/2011', '11:30:44', '13:30:44', 4, 'WEST TEXAS A&M UNIVERSITY     ', 'Internal calls charging and costing as LD...\r\n****Customer wants a call on Monday*****', 'X', '2011-10-10 12:49:44', ''),
(377004, '10/7/2011', '12:16:50', '14:16:50', 9, 'DEUTSCHE BANK CHICAGO', 'DOWN SYSTEM', 'X', '2011-10-07 12:37:02', ''),
(377006, '10/7/2011', '12:40:19', '14:40:19', 4, 'QUEST SOFTWARE    ', 'Trouble deleting users in the directory DB', 'X', '2011-10-07 13:09:23', ''),
(377008, '10/7/2011', '13:16:04', '15:16:04', 4, 'CENTURY COLLEGE   ', 'WANTS TO ADD ACCESS CODES TO LONG DISTANCE CALLS FOR REPORTING', 'X', '2011-10-10 12:46:20', ''),
(377019, '10/10/2011', '09:47:00', '11:47:00', 4, 'ST JOSEPHS HOSPITAL', 'CBA - Still in open queue', 'X', '2011-11-11 13:45:02', ''),
(377020, '10/10/2011', '09:53:46', '11:53:46', 2, 'HIGHLAND PARK HOSPITAL', 'Help with 911 call ', 'X', '2011-10-10 15:54:20', ''),
(377030, '10/10/2011', '10:36:15', '12:36:15', 9, 'LATHAM & WATKINS-LOS ANGELES C', 'down system', 'X', '2011-10-10 12:33:43', ''),
(377031, '10/10/2011', '10:41:50', '12:41:50', 2, 'INSTITUTIONAL INVESTOR INC. ', 'INACCURATE TIME ON REPORTS', 'X', '2011-10-10 12:38:15', ''),
(377032, '10/10/2011', '11:44:38', '13:44:38', 4, 'FINLEY HOSPITAL  ', 'Hunt group access issues', 'X', '2011-10-11 10:15:19', ''),
(377044, '10/10/2011', '14:20:16', '16:20:16', 4, 'UNION CENTRAL LIFE ', 'Can&#39;t login ', 'X', '2011-10-11 10:47:39', ''),
(377045, '10/10/2011', '14:23:56', '16:23:56', 9, 'SUTTON PLACE HOTEL    ', 'Down system', 'X', '2011-10-10 14:26:29', ''),
(377048, '10/10/2011', '16:42:51', '18:42:51', 9, 'QUEST SOFTWARE ', 'DOWN SYSTEM', 'X', '2011-10-10 17:59:11', ''),
(377049, '10/10/2011', '16:58:22', '18:58:22', 4, 'ARTHUR J GALLAGHER & ASSOCIATE', 'Error message...&#34;error occcured during pre log in hand shake&#34;.', 'X', '2011-10-11 08:32:56', ''),
(377050, '10/10/2011', '17:07:46', '19:07:46', 2, 'ASSOCIATED BANC CORP STEVENS P', 'IP ADDRESS CHANGE ', 'X', '2011-10-11 08:48:30', ''),
(377051, '10/11/2011', '07:48:03', '09:48:03', 4, 'DIRECT EDGE  ', 'Adding additional information to his IPPCC port', 'X', '2011-10-11 11:02:35', ''),
(377053, '10/11/2011', '08:35:40', '10:35:40', 4, 'WORK FORCE OF CENTRAL FLORIDA ', 'people&#39;s names on  report not correct to the ext they are associated to ', 'X', '2011-10-11 11:27:12', ''),
(377056, '10/12/2011', '12:25:59', '14:25:59', 4, 'E-DATA SOLUTIONS', 'Directory database issues', 'X', '2011-10-12 13:52:15', ''),
(377059, '10/11/2011', '09:25:31', '11:25:31', 2, 'VOLUNTEER STATE COMMUNITY COLL', 'Help re-set password for user', 'X', '2011-10-11 10:38:01', ''),
(377061, '10/11/2011', '09:29:51', '11:29:51', 9, 'CANCER TREATMENT CTR OF AMERIC', 'Has not collected data from Sept 27 until today 10/11/11', 'X', '2011-10-11 09:41:34', ''),
(377065, '10/11/2011', '10:53:52', '12:53:52', 4, 'LEE MEMORIAL HEALTH SYSTEM  ', 'Tried to import but failed', 'X', '2011-10-11 14:32:00', ''),
(377066, '10/11/2011', '11:41:19', '13:41:19', 2, 'WESTINGHOUSE CRANBERRY TWP ', 'WRONG DATA SHOWING IN ASSIGNED AREA', 'X', '2011-10-11 14:33:15', ''),
(377067, '10/11/2011', '12:02:22', '14:02:22', 2, 'OUR LADY OF BELLEFONTE HOSP   ', 'nortel not collecting since the 6th...isv not processing...not going to control center and updating', 'X', '2011-10-11 14:47:22', ''),
(377068, '10/11/2011', '12:14:31', '14:14:31', 2, 'CENTRAL GARDEN & PET    ', 'SPACE ALLOCATION ERROR', 'X', '2011-10-12 08:12:13', ''),
(377072, '10/11/2011', '13:35:34', '15:35:34', 2, 'WELLCARE         ', 'data storage...needs to know how long data is stored', 'X', '2011-10-11 15:50:11', ''),
(377073, '10/11/2011', '13:50:10', '15:50:10', 4, 'MAXIM HEALTHCARE SERVICES, INC', 'Not seeing outbound calls', 'X', '2011-10-11 14:50:16', ''),
(377077, '10/11/2011', '14:54:58', '16:54:58', 9, 'PERFORMANCE TRUST     ', 'Down system no data past 30 days', 'X', '2011-10-11 15:47:50', ''),
(377078, '10/12/2011', '07:06:51', '09:06:51', 4, 'ING WHOLESALE BANKING   ', 'CDR Not matching what is on the reports', 'X', '2011-10-12 08:17:38', ''),
(377079, '10/12/2011', '08:20:20', '10:20:20', 4, 'COLQUITT REGIONAL MEDICAL CTR ', 'Monthly report cost off', 'X', '2011-10-12 14:04:56', ''),
(377085, '10/12/2011', '10:12:31', '12:12:31', 4, 'INTERCHURCH CENTER     ', 'Alarms for the future', 'X', '2011-10-12 11:53:05', ''),
(377087, '10/12/2011', '11:45:39', '13:45:39', 2, 'PLAINS CAPITAL CORPORATION    ', 'The report management is having trouble connecting to our smtp1.pcb.corp 10.10.50.21 or smpt2.pcb.corp 10.2.7.221', 'X', '2011-10-12 12:30:56', ''),
(377089, '10/12/2011', '12:29:14', '14:29:14', 2, 'LAKE HOSPITAL SYSTEM INC   ', 'WANTS TO KNOW WHAT KIND OF &#34;TRUNK TRAFFIC REPORT&#34; SUPPORT IS AVAILABLE', 'X', '2011-10-12 15:06:14', ''),
(377098, '10/12/2011', '14:09:18', '16:09:18', 9, 'AAA OHIO MOTORISTS ASSOCIATION', 'Site not processing data', 'X', '2011-10-12 14:20:45', ''),
(377099, '10/12/2011', '14:35:02', '16:35:02', 2, 'SMITH & NEPHEW    ', 'Locate info for number', 'X', '2011-10-12 15:11:13', ''),
(377100, '10/12/2011', '15:11:56', '17:11:56', 4, 'YUSEN LOGISTICS  ', 'Help reset password', 'X', '2011-10-24 13:42:33', ''),
(377102, '10/12/2011', '18:19:08', '20:19:08', 2, 'CLIFFS AT PRINCEVILLE         ', 'isv cme acdc collect service timers will not be started application dead...not collecting data...not speaking property managment...SSS', 'X', '2011-10-13 07:40:24', ''),
(377107, '10/13/2011', '09:17:51', '11:17:51', 9, 'PAYMENT SYST.FOR CREDIT UNIONS', 'No calls processing since 9-22', 'X', '2011-10-13 09:42:11', ''),
(377109, '10/13/2011', '13:13:24', '15:13:24', 9, 'GENEVA COLLEGE  ', 'Processes won&#39;t run.', 'X', '2011-10-13 13:26:57', ''),
(377111, '10/13/2011', '10:03:26', '12:03:26', 2, 'UTAH RETIREMENT SYSTEMS    ', 'No Page breaks on report    ', 'X', '2011-10-14 11:21:08', ''),
(377113, '10/13/2011', '11:15:40', '13:15:40', 9, 'CITY OF EL PASO         ', 'DOWN SYSTEM', 'X', '2011-10-13 12:14:29', ''),
(377114, '10/13/2011', '11:37:36', '13:37:36', 9, 'UNITED GUARANTY GREENSBORO  ', 'DOWN SYSTEM', 'X', '2011-10-14 10:12:00', ''),
(377115, '10/13/2011', '11:55:31', '13:55:31', 9, 'CHINLE UNIFIED SCHOOL DISTRICT', 'DOWN SYSTEM ', 'X', '2011-10-13 14:17:53', ''),
(377116, '10/13/2011', '12:36:19', '14:36:19', 4, 'TARGET', 'Record collection for Cisco feeds is not working properly within InforTel Select. Please call and we can review via a screen share/live meeting. ', 'X', '2011-10-13 14:09:07', ''),
(377117, '10/13/2011', '12:46:11', '14:46:11', 2, 'ANOKA COUNTY GOVERNMENT       ', 'EXTENSION DETAIL- NEW USER', 'X', '2011-10-13 16:57:38', ''),
(377118, '10/13/2011', '13:09:58', '15:09:58', 2, 'NATIONAL FUTURES ASSOC. ', 'NEEDS REPIs there a report that details call per hour from any extension starting with 1*** to 6*** and 6*** to 3***?ORT DETAILS FOR', 'X', '2011-10-14 15:15:00', ''),
(377120, '10/13/2011', '13:34:09', '15:34:09', 4, 'MOORE REGIONAL HOSPITAL', '911 Calls showing up incorrectly', 'X', '2011-10-13 16:59:07', ''),
(377122, '10/13/2011', '14:15:54', '16:15:54', 4, 'HARRIS WILLIAMS AND CO ', 'Error file in use when he is loading his international rate table', 'X', '2011-10-13 16:58:23', ''),
(377127, '10/13/2011', '15:29:52', '17:29:52', 9, 'HEALTHCARE PARTNERS   ', 'NO CDR FOR HCP', 'X', '2011-10-13 16:57:44', ''),
(377129, '10/13/2011', '15:42:32', '17:42:32', 2, 'SONY COMPUTER ENTERTAINMENT AM', 'WANTS IP ADDRESS FOR BUFFER BOX', 'X', '2011-10-13 15:59:12', ''),
(377131, '10/13/2011', '16:11:41', '18:11:41', 2, 'HYATT HOTEL VICTOR  ', 'TRYING TO REINSTALL INTERFACE FOR PROPERTY MANAGER...HAD DIAL UP MODEM..WANTS TO KNOW IF THEY CAN GET CONNECTED TO THE INTERNET CAN WE LOOK AT SOME CONFIGURATION ISSUES BASED ON THE INTERFACE...SSS', 'X', '2011-10-14 07:58:26', ''),
(377132, '10/13/2011', '16:15:03', '18:15:03', 2, 'NATIONWIDE MUTUAL INSURANCE mn', 'Here is what I used to do to set or reset a password. I&#39;d open the directory database and find the person, then click to &#39;edit person&#39; Once I got the edit person screen up , I&#39;d click on the little &#39;security settings&#39; square. That then would bring up a permissions screen and at the top of the screen beside the user name field, there was a box you could check or uncheck for &#39;reset password&#39;. That little box is no longer there :( ', 'X', '2011-10-14 07:29:00', ''),
(377133, '10/13/2011', '16:20:05', '18:20:05', 2, 'FREMONT COUNTY GOVT  ', 'UPDATE DIRECTORY CHARGES', 'X', '2011-10-14 15:18:29', ''),
(377137, '10/14/2011', '07:41:34', '09:41:34', 9, 'BUCHANAN INGERSOLL & ROONEY PC', 'HAVE 2 HOUR CALLBACK P/MEW', 'X', '2011-10-14 07:53:44', ''),
(377140, '10/14/2011', '09:22:20', '11:22:20', 4, 'SHEPHERD UNIVERSITY   ', 'Billing off differnet cost off on report', 'X', '2011-10-14 11:15:53', ''),
(377142, '10/14/2011', '09:53:36', '11:53:36', 9, 'EXPRESS, LLC     ', 'Bad CDR alarms', 'X', '2011-10-14 10:49:20', ''),
(377144, '10/14/2011', '10:45:59', '12:45:59', 2, 'PALOS COMMUNITY HOSPITAL   ', 'WANTING TO RUN REPORTS ON SPECIFIC EXTENTIONS WHOLE DAY BROKEN DOWM BY HOURS FOR A THREE MONTH PERIOD', 'X', '2011-10-14 14:25:02', ''),
(377146, '10/14/2011', '12:04:27', '14:04:27', 2, 'CONNER STRONG COMPANIES, INC  ', 'NOT GATHERING DATA FOR NEW EXTENSIONS ADDED', 'X', '2011-10-14 13:49:31', ''),
